reviewId,userName,userImage,content,score,thumbsUpCount,reviewCreatedVersion,at,replyContent,repliedAt
f4353808-17c6-4271-a05f-4d617ec05c35,Sankhanil Manna,https://play-lh.googleusercontent.com/a-/ACB-R5SOWBpOhEuZ07jwswbbudaKLcaEYwAqY66U2_gC8Q,"I want to recharge my prepaid Jio, Airtel & VI sim, but here isn't the prepaid sims are available. I not to do or unable to recharge my sim and my family's sims. So, I hope, please you will bring it soon the features (sim) are available in this app kindly & quickly and I can do again recharge my prepaid sims recharges.",2,0,3.1.1,2023-04-04 00:02:40,"Hi, apologies for the inconvenience. As we are constantly trying to improve the app, we request you to share the specific issues you've faced so that we can resolve them. Please feel free to share your feedback at https://www.bhimupi.org.in/get-touch or call on our customer care number 1800-120-1740. Warm Regards, Team BHIM.",2023-04-16 16:34:27
da434ace-d4b0-483e-8254-5a5a6092ce6f,Neha Sheokand,https://play-lh.googleusercontent.com/a/AGNmyxas23qyStQtOAWOmbxQzOtgghmrBHNpStZSKhpm=mo,"It's not working properly.. my password is correct and everything.. but always shows, something went wrong. Again and again mobile registration ask.",2,1,3.1.1,2023-04-03 23:12:08,"Hi, apologies for the inconvenience. As we are constantly trying to improve the app, we request you to share the specific issues you've faced so that we can resolve them. Please feel free to share your feedback at https://www.bhimupi.org.in/get-touch or call on our customer care number 1800-120-1740. Warm Regards, Team BHIM.",2023-04-16 16:34:24
665279e6-0f91-4d82-927d-f235e0a30e16,paramesh hebbar,https://play-lh.googleusercontent.com/a/AGNmyxaX4FOinBmcriEf7-d14EAWzh4z7eTGXXbjCOrw=mo,"Sir, This app does not support bill payments. Whenever I try to make bill payments,it says your bank does not support this. Choose another bank account. Whether it is postpaid or prepaid or fastag I get the same message. The same bank account is linked to Google pay and I can make all the above payments without any problem. I hope you resolve this problem so that I can continue to remain with you.",2,0,3.1.1,2023-04-03 19:48:23,"Hi, apologies for the inconvenience. As we are constantly trying to improve the app, we request you to share the specific issues you've faced so that we can resolve them. Please feel free to share your feedback at https://www.bhimupi.org.in/get-touch or call on our customer care number 1800-120-1740. Warm Regards, Team BHIM.",2023-04-16 16:34:03
1bcbb9ec-2e7a-4c28-99cc-227954914bd1,Kids fun by Naresh Swami,https://play-lh.googleusercontent.com/a/AGNmyxYoLVdovn_JN9zz-5Ei7YQ206d0RuL1P_xBGR1M=mo,Registrastion proceas is very poor deduct 1.50rs many time but mostaly registration fail and reregistration after long time problem restrat,2,0,3.1.1,2023-04-03 18:01:39,"Hi, apologies for the inconvenience. As we are constantly trying to improve the app, we request you to share the specific issues you've faced so that we can resolve them. Please feel free to share your feedback at https://www.bhimupi.org.in/get-touch or call on our customer care number 1800-120-1740. Warm Regards, Team BHIM.",2023-04-16 16:33:54
849047cd-32ae-42cd-8edf-4b4eb27d6988,Suryansh Singh,https://play-lh.googleusercontent.com/a-/ACB-R5SQhFfpRQQn3WEc_70voeovRG1JTa_tIcLh_oI2,"App is getting worst day by day. Everytime i request for phone verification code it always shows check your permissions after giving all the permissions, still i'm getting same test from BHIM. Even app won't work properly.",2,0,,2023-04-03 17:53:09,"Hi, we apologize for the inconvenience. A new version is rolled out addressing the issues faced by the users, we request you please download latest version 3.1.1 of BHIM from the Play Store. Please feel free to share your feedback at https://www.bhimupi.org.in/get-touch. Warm Regards, Team BHIM.",2023-04-16 16:33:50
de411674-bd30-4b18-8d88-4508ffa2a215,Shivani,https://play-lh.googleusercontent.com/a-/ACB-R5Rz_l6c7ltwdawWOzCMuydAH8LVFHmcg-yM_n4a,"Right from the last two year, on & around 1st April, the whole BHIM sbi suddenly stops working and you never know how many days will they take to cover up their"" financial year change"" issue. Today is 3rd April and i have still been waiting for this app to work again since 1st April.",2,0,3.1.1,2023-04-03 16:09:40,"Hi, apologies for the inconvenience. As we are constantly trying to improve the app, we request you to share the specific issues you've faced so that we can resolve them. Please feel free to share your feedback at https://www.bhimupi.org.in/get-touch or call on our customer care number 1800-120-1740. Warm Regards, Team BHIM.",2023-04-16 16:33:42
4d0a67f6-ac07-47c7-b048-861a5380c81b,Ronit Passwala,https://play-lh.googleusercontent.com/a-/ACB-R5TCnyRv5Vs8SjmOEcscMHjQhipql-GEtloUPkMt-Q,Worst app update. Since last week login not working and registration is not working too.,2,0,3.1.1,2023-04-03 14:17:02,"Hi, apologies for the inconvenience. As we are constantly trying to improve the app, we request you to share the specific issues you've faced so that we can resolve them. Please feel free to share your feedback at https://www.bhimupi.org.in/get-touch or call on our customer care number 1800-120-1740. Warm Regards, Team BHIM.",2023-04-16 16:33:29
c86fb7b0-4b51-4cde-a723-5be2f3f757ad,Virendra Rajput,https://play-lh.googleusercontent.com/a-/ACB-R5RH1_67TTseBg5VKT9jJSMbfSPwaQvpc6ykjQv6yA,Such a Bad experience with this app everytime when I tried to Check my Bank balance it Struck and Doesn't show my balance and Always shows error in network. I don't like this app.,2,0,3.1.1,2023-04-03 13:59:55,"Hi, apologies for the inconvenience. As we are constantly trying to improve the app, we request you to share the specific issues you've faced so that we can resolve them. Please feel free to share your feedback at https://www.bhimupi.org.in/get-touch or call on our customer care number 1800-120-1740. Warm Regards, Team BHIM.",2023-04-16 16:33:27
8e10d752-72d8-450a-bed6-9f5e47d16a80,chandrashekhar raybagkar,https://play-lh.googleusercontent.com/a/AGNmyxZCenjPlj8b-14XVRkoiqmPYPhzTwQQlu4Uqe0Z=mo,The transactions fail most of the time in spite of accurate entries done. Don't know howmuch time it would take to get refund of failed entries. I would be stuck if I wanted to make payment from reduced balance.,2,0,3.1.1,2023-04-03 12:38:31,"Hi, apologies for the inconvenience. As we are constantly trying to improve the app, we request you to share the specific issues you've faced so that we can resolve them. Please feel free to share your feedback at https://www.bhimupi.org.in/get-touch or call on our customer care number 1800-120-1740. Warm Regards, Team BHIM.",2023-04-16 16:33:21
1465596f-be8f-407a-b8fa-0510f6ef083c,Indrajith H M,https://play-lh.googleusercontent.com/a-/ACB-R5Si6Eez5QotGdIjjjdlSR6IGyfUTlfItnenEKxXtg,I have single sim in my device but it is asking for select the sim but it is struck there itself... I think there is bug there check it.,2,0,3.1.1,2023-04-03 09:57:28,"Hi, apologies for the inconvenience. As we are constantly trying to improve the app, we request you to share the specific issues you've faced so that we can resolve them. Please feel free to share your feedback at https://www.bhimupi.org.in/get-touch or call on our customer care number 1800-120-1740. Warm Regards, Team BHIM.",2023-04-16 16:32:55
45c52677-7924-4cad-b8f5-9a4713193d11,PRINCE KUMAR,https://play-lh.googleusercontent.com/a/AGNmyxZ6S6MufSECaLVRKsbL2woHUlYhP9Wojbxuhh4Z=mo,Very slow....and lagging like any thing ..after linking with credit card it's working slow,2,0,3.1.1,2023-04-02 22:17:54,"Hi, apologies for the inconvenience. As we are constantly trying to improve the app, we request you to share the specific issues you've faced so that we can resolve them. Please feel free to share your feedback at https://www.bhimupi.org.in/get-touch or call on our customer care number 1800-120-1740. Warm Regards, Team BHIM.",2023-04-16 16:32:38
21f6cdc2-73ee-42c9-9a57-fc9e20a1239c,Lokesh Dulani,https://play-lh.googleusercontent.com/a-/ACB-R5S4pzVmbD0N5mYfSlNR2xbn1JPd52YPCRRTR9Qe2w,Unable to transact anything rubbish not even log in the app,2,0,3.1.1,2023-04-02 20:01:21,"Hi, apologies for the inconvenience. As we are constantly trying to improve the app, we request you to share the specific issues you've faced so that we can resolve them. Please feel free to share your feedback at https://www.bhimupi.org.in/get-touch or call on our customer care number 1800-120-1740. Warm Regards, Team BHIM.",2023-04-16 16:32:26
4efc2f56-0b98-441e-9b83-947857f13b6b,Sachin Khollam,https://play-lh.googleusercontent.com/a-/ACB-R5Q6jNIJfaBlZUclDLc8QeCOtwtVgdX6ohZZE8ul3Q,The SMS is not sent if I try activate the app with Mobile Data. If I use WIFI internet the SMS is sent from the app. If you have any support email ID please let me know I will exact error.,2,3,3.1.1,2023-04-02 19:16:37,"Hi, apologies for the inconvenience. As we are constantly trying to improve the app, we request you to share the specific issues you've faced so that we can resolve them. Please feel free to share your feedback at https://www.bhimupi.org.in/get-touch or call on our customer care number 1800-120-1740. Warm Regards, Team BHIM.",2023-04-16 16:32:21
4190701c-b48b-4c56-b03e-0ac1a396401e,Nitin Phansalkar,https://play-lh.googleusercontent.com/a-/ACB-R5TrKszitaXw-iuESjAnqRp_1uUFAT8U1ImNFPxofQ,Not letting login on mobile data (so practically useless). Works well with wifi. Sent details in feedback.,2,0,3.1.1,2023-04-02 18:21:40,"Hi, apologies for the inconvenience. As we are constantly trying to improve the app, we request you to share the specific issues you've faced so that we can resolve them. Please feel free to share your feedback at https://www.bhimupi.org.in/get-touch or call on our customer care number 1800-120-1740. Warm Regards, Team BHIM.",2023-04-16 16:32:19
0c1c3292-6dd3-4cba-a5f4-13ee8bf86a87,poonam raibole,https://play-lh.googleusercontent.com/a-/ACB-R5QnEtV0IafagFSDyE2X27F0tVNTun9uPkNwpl6lWA,I don't knw why my mobile number is not being verified. M stuck on the registration process can any one help. I use a single simcard still it's stuck,2,0,3.1.1,2023-04-02 17:29:08,"Hi, apologies for the inconvenience. As we are constantly trying to improve the app, we request you to share the specific issues you've faced so that we can resolve them. Please feel free to share your feedback at https://www.bhimupi.org.in/get-touch or call on our customer care number 1800-120-1740. Warm Regards, Team BHIM.",2023-04-16 16:32:09
5c259a71-e4d9-469b-b454-edd99fad76a7,Pankaj Barman,https://play-lh.googleusercontent.com/a-/ACB-R5RvWOizKFgn_iAfwjewMKu5ZM3vEAX4f5JDKcUDaw,Very bad,2,0,3.1.1,2023-04-02 17:25:43,"Hi, apologies for the inconvenience. As we are constantly trying to improve the app, we request you to share the specific issues you've faced so that we can resolve them. Please feel free to share your feedback at https://www.bhimupi.org.in/get-touch or call on our customer care number 1800-120-1740. Warm Regards, Team BHIM.",2023-04-16 16:32:06
5d1d6507-e58e-4d87-80ac-46d84d02ab2b,Rajnish,https://play-lh.googleusercontent.com/a-/ACB-R5Ss9yulV7HpFJn6-ZPxc5xLsXOTX6rfDzfaDKMA-Q,"self a/c tranfer by this aap, amount of Rs 10000 deducted from my HDFC Bank a/c on 31/03/23 but not credited till now in benificieary bank(SBI) i. e. my other a/c....pls resolve early.",2,0,3.1.1,2023-04-02 14:43:03,"Hi, apologies for the inconvenience. As we are constantly trying to improve the app, we request you to share the specific issues you've faced so that we can resolve them. Please feel free to share your feedback at https://www.bhimupi.org.in/get-touch or call on our customer care number 1800-120-1740. Warm Regards, Team BHIM.",2023-04-16 16:31:43
a18f5a5f-6ed0-438b-a8b0-ba5df8e5a205,jay deep,https://play-lh.googleusercontent.com/a/AGNmyxaHR9cY6UhVHotQMn_S5GgjI3oN7B4zJMZCoCYH=mo,Every time same error something went wrong...Not Able to open once a week,2,0,3.1.1,2023-04-02 12:08:54,"Hi, apologies for the inconvenience. As we are constantly trying to improve the app, we request you to share the specific issues you've faced so that we can resolve them. Please feel free to share your feedback at https://www.bhimupi.org.in/get-touch or call on our customer care number 1800-120-1740. Warm Regards, Team BHIM.",2023-04-16 16:31:33
3dd37b1b-fcf4-4bc7-a15c-1ccc62bd2223,Bhav Sharma,https://play-lh.googleusercontent.com/a-/ACB-R5STP4HGlVtPKFVauBvievd40neReVVdEZWpngiuXv0,"Excellent app till date, and suddenly after the update, it asks for three step verification, and does not even accepts earlier pin. Also, forget pwd. is not working. Kindly resolve the issue.",2,0,3.1.1,2023-04-02 08:55:37,"Hi, apologies for the inconvenience. As we are constantly trying to improve the app, we request you to share the specific issues you've faced so that we can resolve them. Please feel free to share your feedback at https://www.bhimupi.org.in/get-touch or call on our customer care number 1800-120-1740. Warm Regards, Team BHIM.",2023-04-16 16:31:16
4b295e31-47fd-4b22-ae50-46a933d20e3c,Vinothkumar Muthaiah,https://play-lh.googleusercontent.com/a/AGNmyxaT-3Gh79dB68T5SuZjaIvk4vcHz0OLdIP_tssf0w=mo,Past few days the app was not opening and not able verify my mobile number.,2,0,,2023-04-02 08:27:56,"Hi, we apologize for the inconvenience. A new version is rolled out addressing the issues faced by the users, we request you please download latest version 3.1.1 of BHIM from the Play Store. Please feel free to share your feedback at https://www.bhimupi.org.in/get-touch. Warm Regards, Team BHIM.",2023-04-16 16:31:13
8fc8df9a-12e0-48b3-bdc7-0f0f064f18f6,Vasu Devan,https://play-lh.googleusercontent.com/a/AGNmyxZ0ck9mFC3gondcnUwMeWEsQ6-61AKf-YfAYkC4=mo,Previously it was working properly.now whenever I try to open the app it is asking for verification and registration.but whenever i try to register it is not responding.,2,0,,2023-04-01 23:09:24,"Hi, we apologize for the inconvenience. A new version is rolled out addressing the issues faced by the users, we request you please download latest version 3.1.1 of BHIM from the Play Store. Please feel free to share your feedback at https://www.bhimupi.org.in/get-touch. Warm Regards, Team BHIM.",2023-04-16 16:31:01
65152d0c-09bd-47ca-8be2-c3594378de99,narendra gadhavi,https://play-lh.googleusercontent.com/a/AGNmyxbOy6s3E_WwMRMIYYFCtTAWKw6N2RFvJlVLO6Q=mo,Bank of Baroda Rupay credit card fetching issue not fetching card,2,0,3.1.1,2023-04-01 20:52:03,"Hi, apologies for the inconvenience. As we are constantly trying to improve the app, we request you to share the specific issues you've faced so that we can resolve them. Please feel free to share your feedback at https://www.bhimupi.org.in/get-touch or call on our customer care number 1800-120-1740. Warm Regards, Team BHIM.",2023-04-16 16:30:56
13283600-85fa-4e00-8798-4e23cb7b3409,Pradeep y,https://play-lh.googleusercontent.com/a/AGNmyxbH11oJ-JjYBBNIikK_AXM_60PawIXw8afj6BRf=mo,Slow,2,0,3.1.1,2023-04-01 19:49:02,"Hi, apologies for the inconvenience. As we are constantly trying to improve the app, we request you to share the specific issues you've faced so that we can resolve them. Please feel free to share your feedback at https://www.bhimupi.org.in/get-touch or call on our customer care number 1800-120-1740. Warm Regards, Team BHIM.",2023-04-16 16:30:49
12ac13b2-44f4-4561-bddc-d255147a55df,niraj shah,https://play-lh.googleusercontent.com/a/AGNmyxYzPhF4qya3pdj2qOpC2F3m4xGY7IY9QZsEaDQj=mo,"I'm facing the problem for a couple of days when trying to log. Even after trying multiple times the message is ""BHIM APP couldn't verify the SMS sent. Please TRY AGAIN or TRY LATER"". Moreover SMS charges are deducted every time. Even tried reinstalling the app but the answer is same. Its poor service or one can say deficiency in service. Moreover when dialled the toll-free no, the answer came via SMS stating refer the FAQs. Request NPCI to look into the matter & solve the problem quickly.",2,35,3.1.1,2023-04-01 18:00:47,"Hi, apologies for the inconvenience. As we are constantly trying to improve the app, we request you to share the specific issues you've faced so that we can resolve them. Please feel free to share your feedback at https://www.bhimupi.org.in/get-touch or call on our customer care number 1800-120-1740. Warm Regards, Team BHIM.",2023-04-16 16:30:38
28048e52-bcac-4804-9203-165f4273c4f9,shubham ingle,https://play-lh.googleusercontent.com/a-/ACB-R5SzWOmezr6KZ-G5__qmCsuqBhQ3jpHL8rs3DeNZrw,Currently app is not opening showing a something went wrong.did sms verification multiple times.,2,0,3.1.1,2023-04-01 07:31:30,"Hi, apologies for the inconvenience. As we are constantly trying to improve the app, we request you to share the specific issues you've faced so that we can resolve them. Please feel free to share your feedback at https://www.bhimupi.org.in/get-touch or call on our customer care number 1800-120-1740. Warm Regards, Team BHIM.",2023-04-16 16:29:38
83ed74f5-a0ed-471b-a839-df92e59cb7f7,Anuja Jadhav,https://play-lh.googleusercontent.com/a-/ACB-R5QrwKcu5u7XAEjCd58YNQx7rFTPuvDbCaG-uoc-,"What's the sudden problem with this app, 1st I was unable to verify my existing account, then can't get access by adding password. Later can't check balance or transfer money",2,0,3.1.1,2023-04-01 05:56:38,"Hi, apologies for the inconvenience. As we are constantly trying to improve the app, we request you to share the specific issues you've faced so that we can resolve them. Please feel free to share your feedback at https://www.bhimupi.org.in/get-touch or call on our customer care number 1800-120-1740. Warm Regards, Team BHIM.",2023-04-16 16:29:34
72439c7a-dce4-4ab8-822f-1c26a754aac5,Sathya Narayan,https://play-lh.googleusercontent.com/a-/ACB-R5SyjD65ozk2EscZ469sIe1kPdZDKbJ57exNc8YnuQ,None of the upi IDs of contacts getting detected,2,0,3.1.1,2023-03-31 21:45:42,,
1f380408-2df5-4eed-85aa-d576d81be75a,bill mart,https://play-lh.googleusercontent.com/a-/ACB-R5RpavrXz7XLy9n3PjJ4OXM9L3FiQiRqD95IPBQa,Need improve bhim application all time application closed scan any QR code ...,2,0,,2023-03-31 17:08:30,,
f58b58f5-918d-4ee0-9752-b7d9fa80f515,Sumit Joshi,https://play-lh.googleusercontent.com/a-/ACB-R5SoKGGFYHT4DkXGSEc6BAr32S4nPC92jdndMXtkUg,"But very slow opening . App open very slow , showing something went wrong always",2,0,3.1.1,2023-03-31 13:10:17,,
cdae6e7a-cd29-4af2-80fa-31857637705d,Ganesh Kolte,https://play-lh.googleusercontent.com/a-/ACB-R5QOul8HDNmbQrJkD6oBm7wZteiu8mnI-X_0cwttRQ,After recent updates not able to login to the app. Kindly fix it asap.,2,0,3.1.1,2023-03-31 11:50:47,"Hi, apologies for the inconvenience. As we are constantly trying to improve the app, we request you to share the specific issues you've faced so that we can resolve them. Please feel free to share your feedback at https://www.bhimupi.org.in/get-touch or call on our customer care number 1800-120-1740. Warm Regards, Team BHIM.",2023-04-02 16:33:11
f151c483-c31e-4535-8cba-ff982b15d530,Pravin Gaonkar,https://play-lh.googleusercontent.com/a/AGNmyxYq65PdgST0XYpxn9bpz_F-UqNPpfFDRqM4F38m=mo,M not able to login my account previously it was going smoothly,2,0,3.1.1,2023-03-31 10:38:51,"Hi, apologies for the inconvenience. As we are constantly trying to improve the app, we request you to share the specific issues you've faced so that we can resolve them. Please feel free to share your feedback at https://www.bhimupi.org.in/get-touch or call on our customer care number 1800-120-1740. Warm Regards, Team BHIM.",2023-04-02 16:33:01
0713441f-3382-4c62-9f02-429576adc7e5,Arpit Patel,https://play-lh.googleusercontent.com/a-/ACB-R5R6jjlCKmJI1stxqXX06AX3S8VU2ybOl1y1VKL3sw,It's not working now.. whenever I try to login it shows something went wrong message,2,0,3.1.1,2023-03-31 08:58:21,"Hi, apologies for the inconvenience. As we are constantly trying to improve the app, we request you to share the specific issues you've faced so that we can resolve them. Please feel free to share your feedback at https://www.bhimupi.org.in/get-touch or call on our customer care number 1800-120-1740. Warm Regards, Team BHIM.",2023-04-02 16:32:54
113ff5f2-8abc-4ae2-8d61-ddcc7fc27276,Shri Ram Singh,https://play-lh.googleusercontent.com/a/AGNmyxYbUmONSkdli53WwuwLbO793J6dI2hsxXHAeYA=mo,"I had have a great experience with this app, but from past two weeks I am facing issue in login, I constantly getting ""something went wrong "" Even with correct credentials or while using biometric option",2,0,,2023-03-30 22:38:18,"Dear BHIM user, thank you for rating the BHIM App! A new version of BHIM app 3.1.1 is rolled out to experience a superior payment service. Please feel free to share your feedback at https://www.bhimupi.org.in/get-touch. Warm Regards, Team BHIM.",2023-04-02 16:32:32
573dc6a5-f7c9-4542-831d-1632654ab6bf,PRATIK SANADHYA,https://play-lh.googleusercontent.com/a-/ACB-R5RIn0KhbxLiar0C0hsQ6gSB-Mvwo0em-09e50j2AA,Mobile no. Verification process is not completed and app is not open from 1 month,2,0,3.1.1,2023-03-30 19:25:00,"Hi, apologies for the inconvenience. As we are constantly trying to improve the app, we request you to share the specific issues you've faced so that we can resolve them. Please feel free to share your feedback at https://www.bhimupi.org.in/get-touch or call on our customer care number 1800-120-1740. Warm Regards, Team BHIM.",2023-04-02 16:32:08
fe4345d9-28e4-41d1-8743-8e90df3ad476,Prerana Mahajan,https://play-lh.googleusercontent.com/a/AGNmyxbBB0Ue__WYgsBDcWdVFJQfcCbdNS1mqBDpw5Zs=mo,It's not opening since almost a week even after having right credentials etc.Its verifying number but not stepping ahead.,2,0,3.1.1,2023-03-30 18:03:21,"Hi, apologies for the inconvenience. As we are constantly trying to improve the app, we request you to share the specific issues you've faced so that we can resolve them. Please feel free to share your feedback at https://www.bhimupi.org.in/get-touch or call on our customer care number 1800-120-1740. Warm Regards, Team BHIM.",2023-04-02 16:32:02
a2726869-4b24-43cb-be59-e17f30bf337c,bhumeshwar fande,https://play-lh.googleusercontent.com/a-/ACB-R5TPX00tm5YQ2KTM2KLE76BBeReIEWAeRIJxJ_B8Lw,"I am using this app from long time. This time i updated the app. After update, I can't verify my mobile no. Due to this I am not able to make any payment. Please resolve my problem.",2,0,3.1.1,2023-03-30 15:36:36,"Hi, apologies for the inconvenience. As we are constantly trying to improve the app, we request you to share the specific issues you've faced so that we can resolve them. Please feel free to share your feedback at https://www.bhimupi.org.in/get-touch or call on our customer care number 1800-120-1740. Warm Regards, Team BHIM.",2023-04-02 16:31:50
31773dfa-3414-45b5-b1b5-46fc926655d3,Chinmay Gawde,https://play-lh.googleusercontent.com/a-/ACB-R5RLd2MkIqZFCcBFEBjswA5WHz-fRxMUkQkDmdBWZw,Not able to login for almost a week,2,0,3.1.1,2023-03-30 11:18:43,"Hi, apologies for the inconvenience. As we are constantly trying to improve the app, we request you to share the specific issues you've faced so that we can resolve them. Please feel free to share your feedback at https://www.bhimupi.org.in/get-touch or call on our customer care number 1800-120-1740. Warm Regards, Team BHIM.",2023-04-02 16:31:35
831a5e0b-4b8e-414f-905c-509309cf9fc0,Ajoy Kumar Dey,https://play-lh.googleusercontent.com/a-/ACB-R5QyKPufckHlT-3BPwINZoYF94SEvAQzulKOmE8Rlw,Mera upi pin wrong dikha raha hai bar bar. Jab ki 3 years se wohi pin use kar raha hu. Uske baad jab bhi upi customer care number Pe call karta hu customer care se baat he nahi ho pa raha hai. Agar esa he chalega to upi kese use kar paunga?,2,0,3.1.1,2023-03-30 10:15:24,"Hi, apologies for the inconvenience. As we are constantly trying to improve the app, we request you to share the specific issues you've faced so that we can resolve them. Please feel free to share your feedback at https://www.bhimupi.org.in/get-touch or call on our customer care number 1800-120-1740. Warm Regards, Team BHIM.",2023-04-02 16:31:30
c638c2f7-764c-4684-a192-6012194d9e7b,Varanasi,https://play-lh.googleusercontent.com/a/AGNmyxYgVFAtW4nOLWNuXfCqZ76ofg0XHoGDAPNsTIDB=mo,Very slow scen qr codes,2,0,3.1.1,2023-03-30 00:56:23,"Hi, apologies for the inconvenience. As we are constantly trying to improve the app, we request you to share the specific issues you've faced so that we can resolve them. Please feel free to share your feedback at https://www.bhimupi.org.in/get-touch or call on our customer care number 1800-120-1740. Warm Regards, Team BHIM.",2023-04-02 16:31:11
8dbad595-3a81-42e1-8c3b-bf162a048fe7,Abhijit Shinde,https://play-lh.googleusercontent.com/a-/ACB-R5Q1Lc121l0V0hXWH5jUvZIujrpeGnI9AAHPI4NuWQ,"unable to use app, unable to login, unable to reset password. says ""something went wrong"". since 2-3 days i am not able to login to bhim aap.(29-03-2023)",2,0,3.1.1,2023-03-29 20:39:08,"Hi, apologies for the inconvenience. As we are constantly trying to improve the app, we request you to share the specific issues you've faced so that we can resolve them. Please feel free to share your feedback at https://www.bhimupi.org.in/get-touch or call on our customer care number 1800-120-1740. Warm Regards, Team BHIM.",2023-04-02 16:30:48
