reviewId,userName,userImage,content,score,thumbsUpCount,reviewCreatedVersion,at,replyContent,repliedAt
6185f54e-212c-4025-943a-aa2546f1fa7e,Rajendra Singh,https://play-lh.googleusercontent.com/a/AGNmyxaPjk4sHzD-bvqCf06EMt9M09Pm6DfiPcNGKnjN=mo,(Issue to login account) I already have an account but due to number recharge issue i can not login few days but after that I m facing login issue please help me,2,0,3.1.1,2023-03-29 16:24:34,"Hi, apologies for the inconvenience. As we are constantly trying to improve the app, we request you to share the specific issues you've faced so that we can resolve them. Please feel free to share your feedback at https://www.bhimupi.org.in/get-touch or call on our customer care number 1800-120-1740. Warm Regards, Team BHIM.",2023-04-02 16:30:24
dc70da21-ef8f-4e66-bfff-01036f7de109,G Vasantha,https://play-lh.googleusercontent.com/a/AGNmyxaNfC7DXufHg9b72wwtMVnWvy8nh_PlSZZy_KiR=mo,"I am not able to make transaction with your application, please help me to resolve the issue please",2,0,3.1.1,2023-03-29 11:03:44,"Hi, apologies for the inconvenience. As we are constantly trying to improve the app, we request you to share the specific issues you've faced so that we can resolve them. Please feel free to share your feedback at https://www.bhimupi.org.in/get-touch or call on our customer care number 1800-120-1740. Warm Regards, Team BHIM.",2023-04-02 16:30:00
99986738-a7fc-4652-8e01-f94ff30a5020,A.K. Sharma,https://play-lh.googleusercontent.com/a-/ACB-R5QN4f14-CasxNfEcW_G0PCMSEqBTBBAr3GI31Wi,"all-time on app update automatically deregistered the mob no. always failed to re register worst app , may b upgraded to compete",2,0,3.1.1,2023-03-29 10:58:56,"Hi, apologies for the inconvenience. As we are constantly trying to improve the app, we request you to share the specific issues you've faced so that we can resolve them. Please feel free to share your feedback at https://www.bhimupi.org.in/get-touch or call on our customer care number 1800-120-1740. Warm Regards, Team BHIM.",2023-04-02 16:29:59
117e1d0c-1147-4856-8cba-709437d5bdbe,Sweta Choraria,https://play-lh.googleusercontent.com/a/AGNmyxZIj6Ek8oTXQQf9rzFVjndxZZZmdmnw1f3aVWYt=mo,Bhim app not working,2,0,3.1.1,2023-03-29 07:17:40,"Hi, apologies for the inconvenience. As we are constantly trying to improve the app, we request you to share the specific issues you've faced so that we can resolve them. Please feel free to share your feedback at https://www.bhimupi.org.in/get-touch or call on our customer care number 1800-120-1740. Warm Regards, Team BHIM.",2023-04-02 16:29:36
ebc40a94-662d-44b2-ac83-b62bdf1dd766,Rakesh Kumar,https://play-lh.googleusercontent.com/a-/ACB-R5QFOlC_r3jLIbGjihaM_mDI7UI0LeoqbSJ26thQ1ks,Unable to use App it's crashes,2,0,3.1.1,2023-03-28 22:40:48,"Hi, apologies for the inconvenience. As we are constantly trying to improve the app, we request you to share the specific issues you've faced so that we can resolve them. Please feel free to share your feedback at https://www.bhimupi.org.in/get-touch or call on our customer care number 1800-120-1740. Warm Regards, Team BHIM.",2023-04-02 16:29:19
cac6c818-fb34-457d-a4d4-ccc7b4d57a7b,Sharad Rai,https://play-lh.googleusercontent.com/a-/ACB-R5TjjJAZjMw8dkI1CykbGkzMAmEgHkxGiR5NqtwnlQ,"I wonder what rnd happens in backend...keeps breaking from time to time. Again I am not able to login, looks like those broef period where some bug simply goes unnoticed Update - i jst cannot login in my app....last time this happened when team was trying to launch upi lite",2,0,3.1.1,2023-03-28 18:23:41,"Hi, apologies for the inconvenience. As we are constantly trying to improve the app, we request you to share the specific issues you've faced so that we can resolve them. Please feel free to share your feedback at https://www.bhimupi.org.in/get-touch or call on our customer care number 1800-120-1740. Warm Regards, Team BHIM.",2023-03-28 17:39:25
7b4d6cc5-7e6e-4988-89e9-0e07a7f2c4b4,kshetru d,https://play-lh.googleusercontent.com/a-/ACB-R5ST1_bf3fg3LnNan8eWcoepitpWvYTw8mAAqEXDdw,After updating Again and again mobile verification failed and not opening the app,2,0,3.1.1,2023-03-28 18:01:32,"Hi, apologies for the inconvenience. As we are constantly trying to improve the app, we request you to share the specific issues you've faced so that we can resolve them. Please feel free to share your feedback at https://www.bhimupi.org.in/get-touch or call on our customer care number 1800-120-1740. Warm Regards, Team BHIM.",2023-03-28 17:35:45
9a111996-db70-4128-8839-ec5c53867333,R.R.Arun Arun,https://play-lh.googleusercontent.com/a-/ACB-R5T0_tEAng1O_SbMo25Wxo7-360Xidg_PZOox044,SMS verification failure,2,0,3.1.1,2023-03-28 17:43:11,"Hi, apologies for the inconvenience. As we are constantly trying to improve the app, we request you to share the specific issues you've faced so that we can resolve them. Please feel free to share your feedback at https://www.bhimupi.org.in/get-touch or call on our customer care number 1800-120-1740. Warm Regards, Team BHIM.",2023-03-28 17:37:49
2154bdd8-3ddb-4b7a-b91f-9552ddac2dde,Pankaj Kale,https://play-lh.googleusercontent.com/a/AGNmyxbuGGWMvQoqeQP5Zye0nUUCoK07O3UKmhioVbfd=mo,लॉट ऑफ प्राब्लेम,2,0,3.1.1,2023-03-28 16:45:28,"Hi, apologies for the inconvenience. As we are constantly trying to improve the app, we request you to share the specific issues you've faced so that we can resolve them. Please feel free to share your feedback at https://www.bhimupi.org.in/get-touch or call on our customer care number 1800-120-1740. Warm Regards, Team BHIM.",2023-04-02 16:28:53
0b49aeb4-da4b-4aae-ade9-ce199c0186b9,TUKENDRA VERMA,https://play-lh.googleusercontent.com/a-/ACB-R5TNJMhwWMuKFh2GId_7LGZEqflQW7Yv2v6RCd8oYdU,"I installed in my new device(s10+), but showing error while Sim verification prosses.",2,0,3.1.1,2023-03-28 06:26:51,"Hi, apologies for the inconvenience. As we are constantly trying to improve the app, we request you to share the specific issues you've faced so that we can resolve them. Please feel free to share your feedback at https://www.bhimupi.org.in/get-touch or call on our customer care number 1800-120-1740. Warm Regards, Team BHIM.",2023-04-02 16:28:02
c525117e-9e11-441d-964f-c28699e2ff5a,Saahil,https://play-lh.googleusercontent.com/a/AGNmyxaHCXhad-03iz7CLhsG2YM06mPH-wlDv5rCMbKWnQ=mo,improve interface,2,0,3.1.1,2023-03-28 00:27:26,"Hi, apologies for the inconvenience. As we are constantly trying to improve the app, we request you to share the specific issues you've faced so that we can resolve them. Please feel free to share your feedback at https://www.bhimupi.org.in/get-touch or call on our customer care number 1800-120-1740. Warm Regards, Team BHIM.",2023-04-02 16:27:59
8b72ed1c-c1c3-4c59-815f-a960666b3d2f,Ankita tiwari,https://play-lh.googleusercontent.com/a/AGNmyxbc2dTIeOcz09u4xW-il8Y6GM9nIieLu23MiXyH=mo,"It's not proper functioning with Mobile recharge.... Its only recharge bsnl network... not any other.... Plz, before update the features you may go to Google-pay services... Its my suggestion Its give you a blasting ideas... Whose know someday Google follow you....",2,0,,2023-03-28 00:08:10,"Dear BHIM user, thank you for rating the BHIM App! A new version of BHIM app 3.1.1 is rolled out to experience a superior payment service. Please feel free to share your feedback at https://www.bhimupi.org.in/get-touch. Warm Regards, Team BHIM.",2023-04-02 16:27:58
22e72e66-94eb-4a31-9c92-26fd4ce3b89d,Nikita L,https://play-lh.googleusercontent.com/a-/ACB-R5TN5vGSGFMMi0toOml6BoZ7Q9BM1lVm2uHT_U3SfA,"App was working well till date. Few days back, when i tried opening the app, its asking to register again..but that also doesnt work out ..till the mobile verification it asks you to enter your no. and after that it doesnt go ahead. It says try again.",2,0,3.1.1,2023-03-27 22:15:05,"Hi, apologies for the inconvenience. As we are constantly trying to improve the app, we request you to share the specific issues you've faced so that we can resolve them. Please feel free to share your feedback at https://www.bhimupi.org.in/get-touch or call on our customer care number 1800-120-1740. Warm Regards, Team BHIM.",2023-04-02 16:27:52
871a940f-0d66-4c66-a279-ca8c525d9922,Vijay,https://play-lh.googleusercontent.com/a-/ACB-R5TpPRIBjH-BpIikDWi6CsfnL3O4uWD8v806704KLA,"Previously I had no problem usig the UPI. Suddenly, the app collapsed. Now every time I open the app, it asks for mobile registration. I do it,the password is asked, on entering it ,it gives error msg, does not log in. There is no way I can talk to customer care, It is totally AI based. Tells me to go to web site, see FAQs amd switches off. BHIM has become too big and support system is crumbling.",2,0,3.1.1,2023-03-27 17:53:41,"Hi, apologies for the inconvenience. As we are constantly trying to improve the app, we request you to share the specific issues you've faced so that we can resolve them. Please feel free to share your feedback at https://www.bhimupi.org.in/get-touch or call on our customer care number 1800-120-1740. Warm Regards, Team BHIM.",2023-04-02 16:27:25
c6657f85-2c76-44a0-b7aa-46c052432b46,Akash borah,https://play-lh.googleusercontent.com/a-/ACB-R5RlhFDNpGsGLvHkO6UuBVkz4moxKMU0udPqTTjLEg,I am facing issues while logging in to Bhim App. Who can I contact for help?,2,0,,2023-03-27 16:56:48,"Dear BHIM user, thank you for rating the BHIM App! A new version of BHIM app 3.1.1 is rolled out to experience a superior payment service. Please feel free to share your feedback at https://www.bhimupi.org.in/get-touch. Warm Regards, Team BHIM.",2023-04-02 16:27:22
a81f3bcf-526d-4e8c-bb5a-8078a6a0b962,Namita Golait,https://play-lh.googleusercontent.com/a-/ACB-R5TYYrrR-7RDHhSg14a52RU1rxYw3uHYTG_7EXlqicg,Sbi rupay credit card is not added in this app only limited bank 🏦,2,0,3.1.1,2023-03-27 12:11:33,"Hi, apologies for the inconvenience. As we are constantly trying to improve the app, we request you to share the specific issues you've faced so that we can resolve them. Please feel free to share your feedback at https://www.bhimupi.org.in/get-touch or call on our customer care number 1800-120-1740. Warm Regards, Team BHIM.",2023-04-02 16:27:07
37575bb9-38b2-459b-b291-8d2b0f2c3ac0,Mayank Thakor,https://play-lh.googleusercontent.com/a-/ACB-R5Sc6_7_U9QTp0kYn3VCLzg4codtzNaKRTue2NyymQ,App automatically logout ho jati hai or firse connect kare tho something was wrong karke msg aata hai or login nahi hota hai ek baar tho payment karna tha tab eesa huva wo to acha tha ki mere pass cash tha,2,0,3.1.1,2023-03-26 20:43:51,"Hi, apologies for the inconvenience. As we are constantly trying to improve the app, we request you to share the specific issues you've faced so that we can resolve them. Please feel free to share your feedback at https://www.bhimupi.org.in/get-touch or call on our customer care number 1800-120-1740. Warm Regards, Team BHIM.",2023-04-02 16:26:29
237a8404-8523-42ff-93ae-f666910676b0,Elaventhan R,https://play-lh.googleusercontent.com/a-/ACB-R5SNC_VXx1yujaianQ1SRiCyOPRh6-neUcZ3pgMk,"when ever i opened this app,it will shows something went wrong ...i was updated recent updation also... but not opening",2,0,3.1.1,2023-03-26 17:49:54,"Hi, apologies for the inconvenience. As we are constantly trying to improve the app, we request you to share the specific issues you've faced so that we can resolve them. Please feel free to share your feedback at https://www.bhimupi.org.in/get-touch or call on our customer care number 1800-120-1740. Warm Regards, Team BHIM.",2023-04-02 16:26:10
bba11bee-4d29-4a9f-9fe4-e0293c357aeb,Prathap Nagarajan,https://play-lh.googleusercontent.com/a-/ACB-R5SIm1Pb7RChEgIISv-BhZbqlJiRIGh810BftBbALRo,Now days it's struck,2,0,3.1.1,2023-03-26 17:32:05,"Hi, apologies for the inconvenience. As we are constantly trying to improve the app, we request you to share the specific issues you've faced so that we can resolve them. Please feel free to share your feedback at https://www.bhimupi.org.in/get-touch or call on our customer care number 1800-120-1740. Warm Regards, Team BHIM.",2023-04-02 16:26:02
3d1565f5-129f-411c-b86f-f3207ea21f29,Rohit Chandel,https://play-lh.googleusercontent.com/a-/ACB-R5SbRKGC5OefgtTD07E7h4sKAukwrBhwoyd_Jaftew,Recently when I updated this app. I am not able to login again.screen freezes saying unable to send message. It is not only the problem with my phone but also with my father phone . Pathetic experience,2,0,3.1.1,2023-03-26 14:48:45,"Hi, apologies for the inconvenience. As we are constantly trying to improve the app, we request you to share the specific issues you've faced so that we can resolve them. Please feel free to share your feedback at https://www.bhimupi.org.in/get-touch or call on our customer care number 1800-120-1740. Warm Regards, Team BHIM.",2023-04-02 16:25:53
cf0c9f0c-2fe6-48c2-b414-8ffd37b7383e,monali patil,https://play-lh.googleusercontent.com/a/AGNmyxboPIvjUHHWMrbMFUxZtlDhY8waRVWeg2HY8bwU=mo,"My mobile number verification can not be complete, please check the issue",2,0,3.1.1,2023-03-25 22:59:31,"Hi, apologies for the inconvenience. As we are constantly trying to improve the app, we request you to share the specific issues you've faced so that we can resolve them. Please feel free to share your feedback at https://www.bhimupi.org.in/get-touch or call on our customer care number 1800-120-1740. Warm Regards, Team BHIM.",2023-04-02 16:25:13
f186f32a-96b7-41b1-a177-0fb694f7d41a,vasanth kumar A.S,https://play-lh.googleusercontent.com/a/AGNmyxZji5mzxU6TVDNgnH2sHdEUHFCT-q_kMbi2Xwcl=mo,"This is not working, i have put money to BHIM lite & not able to use it, it's like our government works, initial it flyes & later it dies, please don't loose money like me ,some one from the bhim team please resolve the issues, we are losing our hard earn money because of your immatured app",2,0,3.1.1,2023-03-25 22:16:05,"Hi, apologies for the inconvenience. As we are constantly trying to improve the app, we request you to share the specific issues you've faced so that we can resolve them. Please feel free to share your feedback at https://www.bhimupi.org.in/get-touch or call on our customer care number 1800-120-1740. Warm Regards, Team BHIM.",2023-04-02 16:25:04
7dcc201c-26df-457d-81f8-fcd6cef10a99,Nandkumar Patil,https://play-lh.googleusercontent.com/a/AGNmyxaYxgkPzdkWMvYuHoeVmFZoHjuhC17VVwFtOPh3=mo,Not like other upi apps. Typical govt app,2,0,3.1.1,2023-03-25 20:13:32,"Hi, apologies for the inconvenience. As we are constantly trying to improve the app, we request you to share the specific issues you've faced so that we can resolve them. Please feel free to share your feedback at https://www.bhimupi.org.in/get-touch or call on our customer care number 1800-120-1740. Warm Regards, Team BHIM.",2023-04-02 16:24:46
b57ddec9-54d7-42c5-860c-1dfb2038ce15,Op Hari,https://play-lh.googleusercontent.com/a-/ACB-R5SPs0kP_Kphd4gPd85mBd6R_kYJzLsNgGOzd0e4,uissfull think,2,0,,2023-03-25 09:00:16,"Dear BHIM user, thank you for rating the BHIM App! A new version of BHIM app 3.1.1 is rolled out to experience a superior payment service. Please feel free to share your feedback at https://www.bhimupi.org.in/get-touch. Warm Regards, Team BHIM.",2023-04-02 16:23:36
b74646de-b7aa-4d75-84ae-0db789196a6f,Rk Sharma,https://play-lh.googleusercontent.com/a/AGNmyxaBm2YbqOTyoi-FVPflKi2xu3VKjgynstqgu15n=mo,Good app,2,0,,2023-03-24 19:17:49,"Thank you for rating the BHIM App! If you liked the app, consider giving a higher rating. We hope you have downloaded the latest version 3.1.1 of the BHIM app to enjoy a superior payment service. Please feel free to share your feedback at https://www.bhimupi.org.in/get-touch Warm Regards, Team BHIM.",2023-04-02 16:23:00
b147af3b-f2c2-4f92-b392-118947f0d27a,Partha Biswas,https://play-lh.googleusercontent.com/a-/ACB-R5TrDwVS1jzTSX3YYrUoLRwN7rUSctSZGBVonxAbzQ4,UPI Lite is very slow and many times payment was done but it show payment is pending.... Please fix the bug otherwise other UPI apps go through it....,2,2,3.1.1,2023-03-24 15:05:14,,
1573d2b0-4285-4745-8285-6107c1c1a66c,GIRISH KUMAR Alikkal,https://play-lh.googleusercontent.com/a-/ACB-R5TqBcceTqtMx1oEMfz58-v2T83koRzXd3PLtmsr1w,Can't login..shows something went wrong 23-03-23 onwards,2,2,3.1.1,2023-03-24 12:29:53,"Hi, apologies for the inconvenience. As we are constantly trying to improve the app, we request you to share the specific issues you've faced so that we can resolve them. Please feel free to share your feedback at https://www.bhimupi.org.in/get-touch or call on our customer care number 1800-120-1740. Warm Regards, Team BHIM.",2023-03-28 17:40:02
2d0bb99c-1fb6-4bd0-94e7-5ff6652fe31e,S C Pradhan,https://play-lh.googleusercontent.com/a-/ACB-R5S4ndqecygIefk6AjAL5Pxhxl9ybGaMsTUhk6Bd6A,"It is not working, showing ""something wrong"" Siince last4 week the bhim is trying to verify the sim then after successful verification it show the above error",2,3,3.1.1,2023-03-24 11:14:20,"Hi, apologies for the inconvenience. As we are constantly trying to improve the app, we request you to share the specific issues you've faced so that we can resolve them. Please feel free to share your feedback at https://www.bhimupi.org.in/get-touch or call on our customer care number 1800-120-1740. Warm Regards, Team BHIM.",2023-03-28 17:39:52
188092d4-1a62-48ef-8781-2ba05fa92b24,Murli Dakhare,https://play-lh.googleusercontent.com/a/AGNmyxai1ulbeX4EcWZfssKdgii93TkckrUi71s7jx2x=mo,"I am frequently getting Something went wrong message since I have updated the app. Since I am the long time user, still forced for the Registration and getting the same process. I am Not able to use this app. Please fix this technical problem.",2,0,3.1.1,2023-03-24 11:12:03,"Hi, apologies for the inconvenience. As we are constantly trying to improve the app, we request you to share the specific issues you've faced so that we can resolve them. Please feel free to share your feedback at https://www.bhimupi.org.in/get-touch or call on our customer care number 1800-120-1740. Warm Regards, Team BHIM.",2023-03-28 17:39:51
80c3c4d5-0409-4e48-adce-f42500da70a0,Raj Nidhi,https://play-lh.googleusercontent.com/a-/ACB-R5Sly2W_g9n-ZCkpiFGU8HJChmDHaKgc9MF20shf0g,This app is being so intolerable now. All the time it is showing that something went wrong.,2,0,,2023-03-24 09:36:11,"Hi, we apologize for the inconvenience. A new version is rolled out addressing the issues faced by the users, we request you please download latest version 3.1.1 of BHIM from the Play Store. Please feel free to share your feedback at https://www.bhimupi.org.in/get-touch. Warm Regards, Team BHIM.",2023-03-28 17:39:42
f563c53c-326c-4a67-8ce8-cce2a435a224,Tapabrata Mandal,https://play-lh.googleusercontent.com/a-/ACB-R5TFOQ0YXDpkFIvDjN45d0laRowrXCdV-WMVC38JFA,"Why in this app only one mobile operator? Only BSNL. Where is JIO, AIRTEL, VI. My mobile operator is not BSNL. So I can't recharge my number with this app. Please solve the problem..",2,0,3.1.1,2023-03-23 22:02:12,"Hi, apologies for the inconvenience. As we are constantly trying to improve the app, we request you to share the specific issues you've faced so that we can resolve them. Please feel free to share your feedback at https://www.bhimupi.org.in/get-touch or call on our customer care number 1800-120-1740. Warm Regards, Team BHIM.",2023-03-28 17:39:14
64ae16ed-0917-4708-9031-7a584c51176b,Anurag Singh,https://play-lh.googleusercontent.com/a-/ACB-R5T5Jw_-6Hs2KnxhFsmWGYoPi_NfL2Q7zdjVvtsF,App in my device suddenly stopped working and now it's not going above mobile number verification...... showing ' something went wrong '.,2,0,3.1.1,2023-03-23 12:25:09,"Hi, apologies for the inconvenience. As we are constantly trying to improve the app, we request you to share the specific issues you've faced so that we can resolve them. Please feel free to share your feedback at https://www.bhimupi.org.in/get-touch or call on our customer care number 1800-120-1740. Warm Regards, Team BHIM.",2023-03-28 17:38:01
ae5f8780-23bd-4a29-a98b-81c33796f43e,gaurav sonar,https://play-lh.googleusercontent.com/a-/ACB-R5Q7ajK2jU3FbH0iKzZCeminYmDQ-o9vKdjstMZaMA,bad aaps not useful some bank allow in this apps,2,0,3.1.1,2023-03-23 10:51:35,"Hi, apologies for the inconvenience. As we are constantly trying to improve the app, we request you to share the specific issues you've faced so that we can resolve them. Please feel free to share your feedback at https://www.bhimupi.org.in/get-touch or call on our customer care number 1800-120-1740. Warm Regards, Team BHIM.",2023-03-28 17:37:52
375fc037-4eb4-4e92-80fd-3750ac23a471,Dhruv Trivedi,https://play-lh.googleusercontent.com/a/AGNmyxbejnQ7lqLd9A6VrxTr3fVTxg3Moy8KDZDp19wp=mo,"Very slow while scanning the QR code Even after scanning the code it still waits for selecting the bank account every time. Which results in a lot of delay and this is not observed with the other UPI apps in market, they are quite fast. Please look into it because it becomes very irritating everytime to wait for around 3-5 mins to do a transaction where other apps can do it within 60 seconds.",2,1,3.1.1,2023-03-23 10:45:19,"Hi, apologies for the inconvenience. As we are constantly trying to improve the app, we request you to share the specific issues you've faced so that we can resolve them. Please feel free to share your feedback at https://www.bhimupi.org.in/get-touch or call on our customer care number 1800-120-1740. Warm Regards, Team BHIM.",2023-03-28 17:37:51
902c14ab-f21e-49d7-b847-16cfb2a0e16c,Hardik Bhangale,https://play-lh.googleusercontent.com/a-/ACB-R5TUmXXWP6YYqMXRGuw7jhHhvHKmxtZ65jbt6H2qBw,Unable to Open LPG Gas billers from last few days. Please look onto it.,2,0,3.1.1,2023-03-23 10:08:04,"Hi, apologies for the inconvenience. As we are constantly trying to improve the app, we request you to share the specific issues you've faced so that we can resolve them. Please feel free to share your feedback at https://www.bhimupi.org.in/get-touch or call on our customer care number 1800-120-1740. Warm Regards, Team BHIM.",2023-03-28 17:37:46
abe6a394-7ab1-4be8-8fb4-4fadff4ca0f3,suresh nagar,https://play-lh.googleusercontent.com/a-/ACB-R5QrbBh_mPzTwM_nk2pHFBa4g5tq5zXUk7VPVWVFCA,"QR code scans suddenly start showing invalid code, this was happening earlier intermittently, not for all scan it says invalid QR code, even though qr code is actually correct as verified from other phone scans and payments",2,0,3.1.1,2023-03-23 09:53:34,"Hi, apologies for the inconvenience. As we are constantly trying to improve the app, we request you to share the specific issues you've faced so that we can resolve them. Please feel free to share your feedback at https://www.bhimupi.org.in/get-touch or call on our customer care number 1800-120-1740. Warm Regards, Team BHIM.",2023-03-28 17:37:44
2d87d134-1b87-46ce-9a7d-e76597aa4c08,Anand Dubey,https://play-lh.googleusercontent.com/a/AGNmyxZlLXISOy9Q75tlPsNCGbOLkNwfBlgCT7_NFCjH=mo,ch,2,0,2.9.8,2023-03-22 20:01:31,"Hi, we apologize for the inconvenience. A new version is rolled out addressing the issues faced by the users, we request you please download latest version 3.1.1 of BHIM from the Play Store. Please feel free to share your feedback at https://www.bhimupi.org.in/get-touch. Warm Regards, Team BHIM.",2023-03-28 17:37:14
c33039bd-64a2-4458-b67d-8250741ca433,Rohan Bakla,https://play-lh.googleusercontent.com/a-/ACB-R5TxejLtscw31mTzTqFnw3H0Jc4ZWyR2aIGmTarC,Its great...,2,0,3.1.1,2023-03-22 14:43:24,"Hi, apologies for the inconvenience. As we are constantly trying to improve the app, we request you to share the specific issues you've faced so that we can resolve them. Please feel free to share your feedback at https://www.bhimupi.org.in/get-touch or call on our customer care number 1800-120-1740. Warm Regards, Team BHIM.",2023-03-28 17:36:55
0472ea71-50b4-4985-868f-6b40dcac7c32,PIJUSH KANTI PAL,https://play-lh.googleusercontent.com/a-/ACB-R5SMr6Gr8MznhRzG-ZaCIrkl1F9neAUgt_uPPrN4,Recently It does not scan other payment apps in scanning mode.,2,0,,2023-03-22 12:38:08,,
30221807-4df0-4e1a-b251-e169e9eebad3,Vishal Gupta,https://play-lh.googleusercontent.com/a-/ACB-R5RkB53U8qz8PkHsjvgGbvTAJ3v6sz3cETPqnZbu,This app deteriorated day by day. It frequently shows error while login.,2,0,3.1.1,2023-03-22 09:31:12,"Hi, apologies for the inconvenience. As we are constantly trying to improve the app, we request you to share the specific issues you've faced so that we can resolve them. Please feel free to share your feedback at https://www.bhimupi.org.in/get-touch or call on our customer care number 1800-120-1740. Warm Regards, Team BHIM.",2023-03-28 17:36:33
212ba028-7ac0-4a49-93b9-6b19e2c8e9a3,Dr. Ram Singh,https://play-lh.googleusercontent.com/a-/ACB-R5S0uiz4lHKj4I2DPyC7I_D_YcoecAImQwo49HyI8wc,"Not working, Withdrawn 3 stars, because it is not working properly always shows 'something went wrong' since last 2_3 weeks. Worst performance.",2,0,3.1.1,2023-03-21 18:19:03,"Hi, apologies for the inconvenience. As we are constantly trying to improve the app, we request you to share the specific issues you've faced so that we can resolve them. Please feel free to share your feedback at https://www.bhimupi.org.in/get-touch or call on our customer care number 1800-120-1740. Warm Regards, Team BHIM.",2023-03-28 17:35:47
559ef2de-a466-4837-89be-9f2b04008b41,Sultan Ansari,https://play-lh.googleusercontent.com/a/AGNmyxbVAWDAODH0W59ayFAvsOxpilOlTP94fil89-ex=mo,Update,2,0,,2023-03-21 11:16:04,"Hi, we apologize for the inconvenience. A new version is rolled out addressing the issues faced by the users, we request you please download latest version 3.1.1 of BHIM from the Play Store. Please feel free to share your feedback at https://www.bhimupi.org.in/get-touch. Warm Regards, Team BHIM.",2023-03-28 17:35:01
