reviewId,userName,userImage,content,score,thumbsUpCount,reviewCreatedVersion,at,replyContent,repliedAt
266c6d39-f497-4409-8a96-b8f0e36be9c0,Karan Singh,https://play-lh.googleusercontent.com/a-/ACB-R5Q-Ukgl_aBVb3i62UcMfeln0f4-D2ZBIfElUwGC,App is not good working,2,0,,2023-04-24 08:55:28,,
498016e5-3de5-4c5b-baf3-6ddb13faaf9e,Rinky Agrawal,https://play-lh.googleusercontent.com/a/AGNmyxaXGLPWjTv82i5oz-0q-NajnIEWw8wEwgSWgxwM=mo,Not working aft updates..plz clear my problem.my bhim is not open..why i dnt know...,2,0,3.1.1,2023-04-24 08:49:26,"Hi, apologies for the inconvenience. As we are constantly trying to improve the app, we request you to share the specific issues you've faced so that we can resolve them. Please feel free to share your feedback at https://www.bhimupi.org.in/get-touch or call on our customer care number 1800-120-1740. Warm Regards, Team BHIM.",2020-05-27 12:44:34
30ed5a27-ce58-4191-a692-483795802b91,Vishal Masih,https://play-lh.googleusercontent.com/a-/ACB-R5Tvs_2vP4chm_ELskdacx9snh1o-b6cgzLR9W1Qow,Not scanning any QR codes !,2,0,3.1.1,2023-04-23 20:00:33,,
65783488-85f1-4fd3-9334-4b28a0445b8e,DEBASISH DEB,https://play-lh.googleusercontent.com/a-/ACB-R5TpZJXTN8jW8qkK2ZRsFUoiLmILPirUFddKkpI8RA,Unable to reg. My mobile number!,2,0,3.1.1,2023-04-23 14:23:31,,
fd8cfb99-cadc-4988-ad37-4491d92238d5,Rajesh Shah,https://play-lh.googleusercontent.com/a/AGNmyxYsrSatwlcdtToxSDI41E4DErjop-vNEe_5ql9F=mo,"(JUST TO DRAW YOUR ATTENTION TWO STAR.) Sir, While top up fsatsag it shows total balance of all my two cars.So, I could not topup sufficient balance for my particular car fastag for which I want to topup and it creates misunderstanding at toll plaza.so i request you to look in the matter and allow to know perfect balance of each and every car number fastag to topup sufficient amount. THANKS.",2,1,3.1.1,2023-04-23 13:00:27,"Thank you for rating the BHIM App! We would love to hear more from you on what you liked about the app and if we can better it in any way. We appreciate the feedback, always. Do let your friends and family know that they can try the app too! :) Warm Regards, Team BHIM.",2023-04-16 16:38:42
e0c2da16-3e24-49fe-bf55-778fec009c25,Abhisar Mathur,https://play-lh.googleusercontent.com/a-/ACB-R5ToqD3S_w_GemsMn3zpf73sAc0LJ1YM4kZl45B4jQ,Something went wrong error is so frequest that I am never able to use the app when required.,2,0,3.1.1,2023-04-23 11:03:36,,
73776014-e5b5-477c-8a69-396dda470f4b,Chetan Kumar V,https://play-lh.googleusercontent.com/a-/ACB-R5QwblVTb169hJ-w4kAodIg-KBq807jCdZ8KIOXzvA,"Lately, I'm getting `something went wrong` message and doesn't let me log in to app.",2,0,3.1.1,2023-04-23 09:21:00,,
ca4dcb3e-558b-4fa9-9508-f05bdc6a3863,Pappu kumar Shaw,https://play-lh.googleusercontent.com/a-/ACB-R5T5h3Mx3h5jelNSDCjk2a4c3lJ-t1kIjYEsPnpR,Since last update the app does not scan any other qr code then how we pay to and what is solution,2,0,3.1.1,2023-04-23 07:53:25,,
76e8bbcb-95ca-4a1c-8949-fb5bc6de371b,Ashish Kumar,https://play-lh.googleusercontent.com/a-/ACB-R5RlSN52o4llUSMP7ZtW7OARDMQMb5Na3LtU9CDAUA,KOI BHI BARCODE SCANNER NAHIN HO RAHA,2,0,3.1.1,2023-04-23 07:18:47,,
046c69e3-ae61-48c2-9f20-8ab59fdca20b,Mahesh Goswami,https://play-lh.googleusercontent.com/a-/ACB-R5QIoeXJqquRFzApE24I3nm4p4oYZDhwS4vAm-_A,Why casback system or rewards system like other upi is not available in BHIM? I am talking about reward in every successful transaction,2,0,3.1.1,2023-04-22 16:26:04,"Hi, thank you for your valuable feedback. We've taken your suggestions for the app into account already. We hope you continue to enjoy using BHIM. Warm Regards, Team BHIM",2023-03-07 13:00:32
73f5dd9d-b288-4c43-84b2-ed7dd4554bb7,Swayam Sidha Samantaray (Om),https://play-lh.googleusercontent.com/a-/ACB-R5TedQMNS-sG7Nm2dkKTUCG2WrRXTKyHh35TnP5SLw,"The UI is so horrible, please make a new UI sk that users will get attract. Payment failures is also a main problem. I have a better network.",2,0,,2023-04-22 14:38:26,,
cdd7c982-2cda-4ac9-9ce8-b9e61563c99e,Venkatachalam Ravichandran,https://play-lh.googleusercontent.com/a-/ACB-R5TI2_GEgWvoQFbHO6NbV2mpLeh3uuuPJQ382GS4UNc,It's very slow. Not responding sometime. Please improve,2,0,3.1.1,2023-04-22 09:59:28,,
12ee5afb-70ec-4154-9b4a-571e49c12a67,Neelam Yadav,https://play-lh.googleusercontent.com/a/AGNmyxY_BdeUxpjexRdTz4BQiFhczxVUCUEW-WNQyag=mo,"App not working properly, it shows something went wrong message either at the time of mobile no. Verification or at the time of login. It sound very irksome.",2,1,3.1.1,2023-04-22 07:23:28,,
635974a7-812b-48ad-87f7-a42c4e5e638d,Praveen Jain,https://play-lh.googleusercontent.com/a/AGNmyxYIyPOzD9xG7deQ7Z8OwPul9S3HbYYSw9g3vjZwlhI=mo,"For a very long time, there is a lot of problem in login to the application. Logged out every time. Then asks for verification.",2,0,3.1.1,2023-04-22 01:16:31,,
79526f2c-f1e6-4aa1-a47a-f9de3b15b5b5,Architect Niket Sunil Upase,https://play-lh.googleusercontent.com/a-/ACB-R5Rq2JIJA1743Uc6qljJe7AW0DtiSHuXuWVhlNuF_A,good,2,0,2.9.6,2023-04-21 20:58:28,,
74879eda-3fd3-4274-8535-be2828dc8a0b,Totan saha Saha,https://play-lh.googleusercontent.com/a-/ACB-R5T-fQSErPfJJ-F6wAFvPhLMNidCe1yvRdyc2PLZsQ,Finr,2,0,3.1.1,2023-04-21 20:17:20,,
2510e553-e7ba-4e28-95e5-c8b8ca3aa5f9,Pranav Desai,https://play-lh.googleusercontent.com/a/AGNmyxYq8lR-uhOkL1KhnmQeMY1JG8Da93uxPTcPaZB0=mo,"After last update unable to login. Every time I start the app it takes me through sim verification, verification initiated, SMS sent, verification complete. After that despite entering the correct pass code it gives error ""something went wrong."" Have used app for nearly 3 years without issue, but after last update even logging in is not happening.",2,4,3.1.1,2023-04-21 19:46:45,,
77583ad9-ea3a-442f-a2dc-2117edfeb63e,Abhijit Khule,https://play-lh.googleusercontent.com/a-/ACB-R5SrE7-1OrDJYgMQi5UYUPF-5fOXYnzh2_GiaPUvhw,Can't request to application to delete our data so all our credentials are saved on there servers and this can be dangerous,2,0,,2023-04-21 18:12:33,,
964f89ad-f24a-4377-8cc9-49668e136df6,Vijendra,https://play-lh.googleusercontent.com/a-/ACB-R5RA6SbY17rImcLemcHik3T6JwYGIlN5yb34zMalbQ,Very bed,2,0,1.6.1,2023-04-21 16:25:21,"Thank you for rating the BHIM App! We would love to hear more from you on what you liked about the app and if we can better it any way. We appreciate the feedback, always. Do let your friends and family know they can try the app too! :) Warm Regards, Team BHIM.",2019-02-04 14:02:17
9bae3d2c-b9dc-40be-bfe9-a18a181b8f9f,Sushila Gupta,https://play-lh.googleusercontent.com/a/AGNmyxZbeGz22UPU7uDmi6AGOxISO2eFhM0y0Mx9YIcb=mo,Not working,2,0,3.1.1,2023-04-21 12:16:26,,
68b67164-517c-46cb-a161-f9e16cce6f2c,Sanjay G,https://play-lh.googleusercontent.com/a/AGNmyxaPKZX7TiXz1dYRquE3I6Iy1L198WEBr8pwu2at=mo,"This app used to work well till last year and it used to be my UPI app of choice but for the last 3 months I see that it is not logging in or at times not scanning while I am using mobile network although the signal is good. Having said it works well when I am using Wifi network. Can you please resolve this issue with ""App not working while using Mobile network""",2,0,,2023-04-20 20:33:00,,
6624dd50-65df-4931-bea2-c53978c385c1,vishal barde,https://play-lh.googleusercontent.com/a-/ACB-R5TQcKpyEMyOXM3Zv5TiL85sKilEtBAQUpAU6Or-eA,Every time crashes,2,0,3.1.1,2023-04-20 19:06:57,,
b89b0477-8f39-4301-8796-331ae80221fd,Mayank Jain,https://play-lh.googleusercontent.com/a-/ACB-R5TQyewI6KUM4jf5GarYKHRj_ot4O-DsWPvj5SZP6A,"It was an excellent app, but recently it turned into no Op, where you cannot login or do anything, don't know who is writing updates code 😀 Wondering about how long it will take to rectify issues",2,0,3.1.1,2023-04-20 16:54:45,"Hi, apologies for the inconvenience. As we are constantly trying to improve the app, we request you to share the specific issues you've faced so that we can resolve them. Please feel free to share your feedback at https://www.bhimupi.org.in/get-touch or call on our customer care number 1800-120-1740. Warm Regards, Team BHIM.",2023-02-28 20:35:58
ac5b11f2-d70c-4644-9693-26f8c46c77b2,Sharad Kumar,https://play-lh.googleusercontent.com/a-/ACB-R5Qk5RKkspmyflgjTEnmw4DPrbr6o4TRvDYLvCgkZQ,Ultra POOR CUSTOMER CARE NUMBER service.. after wasting 5.. to 10 mins on IVRS it says to go to website for more HELP!! JUST PATHETIC 😠,2,0,3.1.1,2023-04-20 14:42:56,,
039f324c-964a-4058-aa50-fb5068118a7d,Honey,https://play-lh.googleusercontent.com/a-/ACB-R5QYym8C3mOBR0FVSp36zgut9sxAf7FAA8-2pBDS8w,Used to be great .But now 👎doesn't work after update.,2,0,3.1.1,2023-04-20 11:57:32,,
8d381d8c-8c3b-49ab-b40d-a6bf5d07c8c0,Baiju P L,https://play-lh.googleusercontent.com/a-/ACB-R5Trf_3nJh-XKEjFsP5XBAsflu9ZGLnZvjO_KKarUQ,Not working properly,2,0,3.1.1,2023-04-20 11:53:48,"Hi, apologies for the inconvenience. As we are constantly trying to improve the app, we request you to share the specific issues you've faced so that we can resolve them. Please feel free to share your feedback at https://www.bhimupi.org.in/get-touch or call on our customer care number 1800-120-1740. Warm Regards, Team BHIM.",2022-03-28 12:05:39
c0799ab5-f00e-4252-b6b6-f53f76c3ec9e,Ajay Kedia,https://play-lh.googleusercontent.com/a-/ACB-R5SB32oUCW64RT9vNswKogz-N4acdqId12wlRakJpPU,Getting error something went wrong,2,0,3.1.1,2023-04-20 06:42:06,,
8b88ebee-e3a1-4f12-a4e7-e4ecc7736d55,Sabyasachi bera,https://play-lh.googleusercontent.com/a-/ACB-R5To1W1Od-G089jT5bmzf9WOfhchn0lmgcmxPBLroA,"Typical government app, like government employees. Don't work.😡. Example of make in India.🤔",2,0,3.1.1,2023-04-19 21:04:07,,
eb634161-d294-4a13-940a-b1bf79de617c,Madhawi Sharma,https://play-lh.googleusercontent.com/a/AGNmyxZDt2qm1udTKFLWCd3pdVmyDIrAj0f-uCU-AdceAA=mo,Problem with updates system most of the time.,2,0,3.1.1,2023-04-19 13:08:52,,
880a928b-96ea-4dc3-973e-65a2371e51fe,Srimanjunathan,https://play-lh.googleusercontent.com/a-/ACB-R5Sj7Ukk2k1VSYDPeXygXxAiiIyUtAEAuTlsLcgaWg,It's been 4 days and still can't open the app. Always go to the SIM verification process.,2,0,3.1.1,2023-04-19 12:12:51,,
1ab7138f-1068-45d2-b5a5-9e3d8dbc8d51,sandeep yadav,https://play-lh.googleusercontent.com/a-/ACB-R5RR1fGS_HFVW2CQevEiEr0nVxyuYYjHnbOEWDJmHw,I can't recharge of my phone... what a wrost app... when I'm going to recharge my phone it's not showing oprator company just show only BSNL....and it's working very slow..,2,0,3.1.1,2023-04-19 12:05:53,,
fd283a01-cb8e-4282-b3ee-a0f85a647b07,RK Mishra,https://play-lh.googleusercontent.com/a/AGNmyxYKmCpGWn5M13S_zt435vMTIbcGNEvHeKzcUtGr=mo,"Always show something went wrong. Your such act promote other payment apps. Becoz when you show such msg, gpay make payment. Why you promte other app and loose govt credibility",2,0,3.1.1,2023-04-19 10:33:23,,
0f04e544-233d-430a-9ca1-d7b83d9abf6f,Sahil Patil,https://play-lh.googleusercontent.com/a-/ACB-R5T-S3XyMXdoY1nQkZGmHwWtq40KRJiVQJTHjmpfDQ,Not able to login!,2,1,3.1.1,2023-04-19 09:18:01,,
d787e5f1-33a8-4064-bfc6-37ed769370db,Nitin Soge,https://play-lh.googleusercontent.com/a-/ACB-R5SgHTOYxHq_oyBQfDfi8tlB6q1BzsvnWgb0Dlnj5Q,The slowest payment app ever. For every click/touch there is a progress bar. Very irritating.,2,0,,2023-04-18 14:52:30,,
4dc8c105-46e2-4e3d-9d85-7ad6cdef9510,Amanulla Khan,https://play-lh.googleusercontent.com/a/AGNmyxbyzQrjRzz6AVQNyZT-g1hgXbhSiy9Okk5uYTAH=mo,Its not opening after entering passcode..it says something went wrong...close,2,0,3.1.1,2023-04-18 12:29:32,,
5f4ccfc3-0975-4807-816e-ff02603f460f,Dr.RAJNISH CHAUDHARY,https://play-lh.googleusercontent.com/a-/ACB-R5TG2a2KyfMvlOc_ksbZdOdX4b477MC2Jdy4hrUZOu4,Mobile verification fail arrer .And plz problem .help,2,0,3.1.1,2023-04-18 04:52:54,"Dear BHIM user, thank you for rating the BHIM App! A new version of BHIM app v.2.3.1 is rolled out to experience a superior payment service. Please feel free to share your feedback at https://www.bhimupi.org.in/get-touch. Warm Regards, Team BHIM.",2020-08-20 14:16:30
edfab6d3-1a9c-4cfb-9764-aa9f9b8e4c52,DEVARAJ S,https://play-lh.googleusercontent.com/a-/ACB-R5TAOClQPsS4aLVkLAkb3QcUy-XIq3k9RO5b8KgI,while scanning QR code it says invalid QR code but other payment options It is ok give a solution.,2,0,3.1.1,2023-04-17 20:28:52,,
e15ae932-730b-4127-b1d2-3935ca16d3f9,Ajay Kumar,https://play-lh.googleusercontent.com/a/AGNmyxYml35TRfC4DaWq9WkWSkkI1JpITARrznO1eDZN=mo,"Very slow on some transaction and failed, pending transaction status never update after three four days also...",2,0,3.1.1,2023-04-17 15:10:58,,
c78149af-f55a-4296-9535-4b4b0b6ea677,Sunil Doke,https://play-lh.googleusercontent.com/a/AGNmyxaYjs5gbwad5782OfbIqYc-0SEEsqzGFREg2raP=mo,Bank of Baroda rupay credit card unable to link pls look into same,2,0,3.1.1,2023-04-17 13:36:59,,
a577c7e4-2f32-468a-ac94-a64b581d5ccc,RJ Dipak Wankhade,https://play-lh.googleusercontent.com/a-/ACB-R5QjXWbZ-cOiPWEtjjxPKsz6g1Hnv9gyB5wt_0bi3Q,Earlier this app works well in recent update it is very hard to open,2,0,3.1.1,2023-04-17 13:20:30,,
6f82ea04-663b-4c06-a585-110ea0b73ba4,Darshika Singh,https://play-lh.googleusercontent.com/a-/ACB-R5QsanFuE73Qh_XOiXNUoHTAz_Fb1tiAFPA3dWUWKxM,"Unable to verify my number, tried several times,have been trying since very long, disgusting service",2,1,3.1.1,2023-04-16 13:37:53,,
883f0988-b726-48ce-b28f-a48376869965,Sridhar Kota,https://play-lh.googleusercontent.com/a-/ACB-R5Sfo7mIC6I1yLIcG5FHTEOSAm0k_Krh10k9WjjESa8,"It is asking me to verify mobile number everytime I open it When I get it verified and login with password, it pops up 'something went wrong' What's going on???",2,1,3.1.1,2023-04-16 11:00:16,,
8f11cf21-94e0-4d3d-991f-878f9437ad8d,Sanjay Jha,https://play-lh.googleusercontent.com/a-/ACB-R5Sv3GxYL5ABZJx2MlC93Y54_SrnuvCFtjXLsx0ZgA,"every time for transaction I need to switch off the mobile and then ON it. For quite some time it worked but again issue recurring as ""something went wrong""",2,0,3.1.1,2023-04-15 23:32:04,"Hi, apologies for the inconvenience. As we are constantly trying to improve the app, we request you to share the specific issues you've faced so that we can resolve them. Please feel free to share your feedback at https://www.bhimupi.org.in/get-touch or call on our customer care number 1800-120-1740. Warm Regards, Team BHIM.",2022-08-30 15:00:20
1e8359c0-fee1-4e22-ae88-6cec66d26e61,Sonupooja Love you,https://play-lh.googleusercontent.com/a-/ACB-R5TZAoiVIHOzfiq-6wcFI2cqz9WfEejvx-sfvQfC,Great upi id aadhar hi worki👏,2,0,,2023-04-15 19:58:57,,
81c8d1af-9ddc-46e7-aa26-b51b2264cc57,Sk Jakir khan,https://play-lh.googleusercontent.com/a-/ACB-R5QRpvYo8MPAlqwKVOzbf8viXBitmXMqT2jXTfvM5Q,Thank you ☺️,2,0,3.0,2023-04-15 17:54:34,,
b5afc30f-e69e-4514-9fe4-12df9c1c9200,Sangeeta Thapa,https://play-lh.googleusercontent.com/a-/ACB-R5SKGlU_oSLH4SHNNfdJEh0NyTg-yZRYyC0dCaIaow,My bhim app is no working since March. Every time it is asking for mobile number verification and if verified unable to sign in says something went wrong.,2,0,3.1.1,2023-04-15 16:51:59,,
f124fe4c-f5f8-45f7-bd5e-ced6c23ded70,Venkatesh Ramamurthy,https://play-lh.googleusercontent.com/a/AGNmyxYQpfUzwIWPgIrQxQ3QTeyxvs-5mlIj0Gs9hzEs=mo,Can someone help to resolve the issue I have removed the app and re-installed it. But still I am facing the problem I am not able to login. It says something went wrong I am not able to use this app. UT says all the time as something went wrong. I am not able use the app for last 6 months. Can I speak to someone regarding this issue?,2,2,3.1.1,2023-04-15 10:05:07,"Hi, we apologize for the inconvenience. A new version is rolled out addressing the issues faced by the users, we request you please download latest version 3.0 of BHIM from the Play Store. Please feel free to share your feedback at https://www.bhimupi.org.in/get-touch. Warm Regards, Team BHIM.",2023-02-04 17:02:04
daf5b24c-ffb3-46bd-8f2b-2f4a4315742e,Sumit,https://play-lh.googleusercontent.com/a/AGNmyxawr0WAQlqDCr6k8LEWArkqG-wgvsCDR03fyRpc=mo,Whenever I scan the QR CODE to pay it directly shows invalid... sometimes after paying money it won't show successful payment page.... We have to check history to know the payment is done... resolve the issue...,2,0,3.1.1,2023-04-15 09:03:02,,
3c1d7608-c6ae-40b5-8d86-d8d1079bec2f,Akshay Jaiswal,https://play-lh.googleusercontent.com/a-/ACB-R5Rd33fpUIiDbr1YU9V1aBo8yU0nzAnWipIGDoniqg,I like this app very much but now I can't login from 4 month. So please fix this problem,2,0,3.1.1,2023-04-14 22:11:44,,
9dc9f2bb-50a0-4eaa-8ab9-c6c95589efa9,Nil mist,https://play-lh.googleusercontent.com/a-/ACB-R5Q6nYngygHBO-AdEtXI7wo3IyVumTXFZOhHK-FIVg,Very slow app .Developer please improve it,2,0,3.1.1,2023-04-14 19:27:58,,
80e11209-09d4-4611-b05e-6a230965e505,Abhang Kekde,https://play-lh.googleusercontent.com/a-/ACB-R5TitjLMeQzk3j1QJ8fYlp870amF16DsTrPO9InD-A,Latest update is pathetic. Doesn't load bank accounts after scanning QR code. Has to close app from recent apps screen and scan QR again. App loading time is also increased.,2,0,3.1.1,2023-04-14 19:13:37,,
d3c3f07d-650d-4494-b630-1c97dddaed98,Sudhir Sagar,https://play-lh.googleusercontent.com/a-/ACB-R5Q8JE9fk1pcNxsopd98SDpw0LoggVhh7izpv2os,very good,2,0,,2023-04-14 15:25:37,,
3c35c396-9034-4204-ae7a-c405acd329b6,meeta,https://play-lh.googleusercontent.com/a-/ACB-R5QigPNLXmnOD_uXJfkH0qDYwYnP-a7G8pIGdZlQSg,"I am facing problem with UPI app right now. Can not perform any payment through this Bhim Upi app. It is always showing"" somthing went wrong"" since one week.",2,0,2.6.5,2023-04-14 08:57:48,"Hi, we apologize for the inconvenience. A new version is rolled out addressing the issues faced by the users, we request you please download latest version 3.1.1 of BHIM from the Play Store. Please feel free to share your feedback at https://www.bhimupi.org.in/get-touch. Warm Regards, Team BHIM.",2023-04-16 16:44:53
510c3c6d-08cf-4668-9c15-f590ded3a002,odia Tips,https://play-lh.googleusercontent.com/a-/ACB-R5TZ5H9MFIr6xlG9Vdwb0jo0ZKz-dNFEZC1KtVhizg,1.1% commision modi kese khayega😂😂😂😂,2,0,2.4,2023-04-13 22:12:49,"Hi, we apologize for the inconvenience. A new version is rolled out addressing the issues faced by the users, we request you please download latest version 3.1.1 of BHIM from the Play Store. Please feel free to share your feedback at https://www.bhimupi.org.in/get-touch. Warm Regards, Team BHIM.",2023-04-16 16:44:38
4df956ba-c6c6-4fe6-972f-8836e3b7cde1,Arpit Parmar,https://play-lh.googleusercontent.com/a-/ACB-R5Tdp64Fl6wJBdJPjXfvBxGhjVhysne1f65vndYVlQ,Not working for last few months. Constantly showing that my passcode is wrong! Not able to log in at all.,2,0,3.1.1,2023-04-13 21:17:32,"Hi, apologies for the inconvenience. As we are constantly trying to improve the app, we request you to share the specific issues you've faced so that we can resolve them. Please feel free to share your feedback at https://www.bhimupi.org.in/get-touch or call on our customer care number 1800-120-1740. Warm Regards, Team BHIM.",2023-04-16 16:44:34
68e67f61-cceb-44f3-b9e6-c802f505c571,Milind Narvekar,https://play-lh.googleusercontent.com/a-/ACB-R5QnRWNQCsIuweIrurdgTVx2Lr1H9bxzJOWDy82paA,"Very good app using since last 4 years, but now not able to login from last week, not accepting the pin. Looping in the first screen.",2,0,3.1.1,2023-04-13 19:35:49,"Hi, apologies for the inconvenience. As we are constantly trying to improve the app, we request you to share the specific issues you've faced so that we can resolve them. Please feel free to share your feedback at https://www.bhimupi.org.in/get-touch or call on our customer care number 1800-120-1740. Warm Regards, Team BHIM.",2023-04-16 16:44:26
836c21a2-e0eb-44ff-b3f0-f8467d83cc7f,Keshav Jhanwar,https://play-lh.googleusercontent.com/a-/ACB-R5RtBD2hl8ljgLUmKKHdaSyvdLgp2xW3SjEGYCtKo78,All over it is good but unable to add Rupay credit card. Pls help,2,0,3.1.1,2023-04-13 17:43:03,"Hi, apologies for the inconvenience. As we are constantly trying to improve the app, we request you to share the specific issues you've faced so that we can resolve them. Please feel free to share your feedback at https://www.bhimupi.org.in/get-touch or call on our customer care number 1800-120-1740. Warm Regards, Team BHIM.",2023-04-16 16:44:23
af537ca3-a447-4c69-b0a1-740007d59524,Hrishikesh Botre,https://play-lh.googleusercontent.com/a-/ACB-R5TZnep0yRCS-PcJHYjJvVrsUPV-wulxYvMu9VgdZA,Making India Cashless???? Means direct bheekari karega kya India ko?,2,0,3.1.1,2023-04-13 16:49:37,"Hi, apologies for the inconvenience. As we are constantly trying to improve the app, we request you to share the specific issues you've faced so that we can resolve them. Please feel free to share your feedback at https://www.bhimupi.org.in/get-touch or call on our customer care number 1800-120-1740. Warm Regards, Team BHIM.",2023-04-16 16:44:16
4a5b2d4c-e947-4685-9b51-a933fa099e7f,Abhishek Sharma,https://play-lh.googleusercontent.com/a-/ACB-R5SM89ZtpMkBnHpRDj0jUMOCX3tcPnTrC3q-5E2DwA,Open nahi hota hai,2,0,3.1.1,2023-04-13 15:39:26,"Hi, apologies for the inconvenience. As we are constantly trying to improve the app, we request you to share the specific issues you've faced so that we can resolve them. Please feel free to share your feedback at https://www.bhimupi.org.in/get-touch or call on our customer care number 1800-120-1740. Warm Regards, Team BHIM.",2023-04-16 16:44:14
ba0fa651-a4fc-4a7f-a64e-8d8469ff6533,Harish Narayanaswamy,https://play-lh.googleusercontent.com/a-/ACB-R5RBhGOLMyhecSX8pEmJSfhUeLibJft0gDTw3vs_ZlY,Not working. Unable to login,2,0,3.1.1,2023-04-13 10:28:56,"Hi, apologies for the inconvenience. As we are constantly trying to improve the app, we request you to share the specific issues you've faced so that we can resolve them. Please feel free to share your feedback at https://www.bhimupi.org.in/get-touch or call on our customer care number 1800-120-1740. Warm Regards, Team BHIM.",2023-04-16 16:43:53
ba8e9e48-a628-4844-ae41-47cb1cc2d283,Amit Lodha,https://play-lh.googleusercontent.com/a-/ACB-R5TyUkpRcp-Ed5A2D2v8_aGtZi95A4XT4t-E-FhHig,Maximum time not working...too many features are given but not even more than 5 are working. Did not expect as this is GOI app,2,0,3.1.1,2023-04-12 22:18:35,"Hi, apologies for the inconvenience. As we are constantly trying to improve the app, we request you to share the specific issues you've faced so that we can resolve them. Please feel free to share your feedback at https://www.bhimupi.org.in/get-touch or call on our customer care number 1800-120-1740. Warm Regards, Team BHIM.",2023-04-16 16:43:26
f11f680b-8bed-4259-a1ed-f9a9f6b80023,Bahader Singh,https://play-lh.googleusercontent.com/a/AGNmyxY69Iv2X7pueucUdth_mKFsXbBQ42kEoLoHj9Rl=mo,App takes much time for opening as compared with other upi apps,2,0,3.1.1,2023-04-12 21:01:30,"Hi, apologies for the inconvenience. As we are constantly trying to improve the app, we request you to share the specific issues you've faced so that we can resolve them. Please feel free to share your feedback at https://www.bhimupi.org.in/get-touch or call on our customer care number 1800-120-1740. Warm Regards, Team BHIM.",2023-04-16 16:43:17
5093317f-0934-4dd8-8e39-f0f0d49d4d34,Siva Nagendra,https://play-lh.googleusercontent.com/a-/ACB-R5S9JFxbflvZK0cTWA1SEk31zNfKlRBSvlDcc8Mf,"Application is not authenticated and always says incorrect, tried to uninstall it's stuck at uninstall screen doesn't go further",2,0,3.1.1,2023-04-12 20:46:10,"Hi, apologies for the inconvenience. As we are constantly trying to improve the app, we request you to share the specific issues you've faced so that we can resolve them. Please feel free to share your feedback at https://www.bhimupi.org.in/get-touch or call on our customer care number 1800-120-1740. Warm Regards, Team BHIM.",2023-04-16 16:43:16
ffd48105-ba2a-41cc-9f77-16abfff63c31,jesse Lawrence,https://play-lh.googleusercontent.com/a/AGNmyxbQ8gw6BeMzJq9WFJLeAyHTGC7AixX3nneFegLp=mo,I am facing a lot of issues using this app. It constantly asks for mobile verification and for some reason fails several times. Also it fails to login after I enter the passcode. Because of these and other reasons the app has become very unreliable and has given me lot of trouble. I hope the concerned team takes note,2,0,3.1.1,2023-04-12 13:55:47,"Hi, apologies for the inconvenience. As we are constantly trying to improve the app, we request you to share the specific issues you've faced so that we can resolve them. Please feel free to share your feedback at https://www.bhimupi.org.in/get-touch or call on our customer care number 1800-120-1740. Warm Regards, Team BHIM.",2023-04-16 16:42:52
56a8c067-c05c-48e2-9a30-477d5d5ccaee,Raj King,https://play-lh.googleusercontent.com/a/AGNmyxZQwL6-8hwfXzNWYyPkm7XllRWq-5RBqQ-aQ_Wu=mo,Gud,2,0,,2023-04-12 09:57:10,"Hi, we apologize for the inconvenience. A new version is rolled out addressing the issues faced by the users, we request you please download latest version 3.1.1 of BHIM from the Play Store. Please feel free to share your feedback at https://www.bhimupi.org.in/get-touch. Warm Regards, Team BHIM.",2023-04-16 16:42:41
91ccc43d-fc61-4849-ad5f-6e8e65de775d,Sandeep Mistry,https://play-lh.googleusercontent.com/a-/ACB-R5RraODUnvQDViKVdk4HuVSxZsm3oWknUf5RSEOY-kw,Erro 1) Error fetching bank account. Error 2) please check if you have selected correct account or the mobile number you.... Such an error occurs. When I registation the credit card. Please provide any solution. I am waiting for your reply,2,0,3.1.1,2023-04-12 08:55:26,"Hi, apologies for the inconvenience. As we are constantly trying to improve the app, we request you to share the specific issues you've faced so that we can resolve them. Please feel free to share your feedback at https://www.bhimupi.org.in/get-touch or call on our customer care number 1800-120-1740. Warm Regards, Team BHIM.",2023-04-16 16:42:36
