reviewId,userName,userImage,content,score,thumbsUpCount,reviewCreatedVersion,at,replyContent,repliedAt
ac8bf1ec-7a67-44b7-8a40-dd78e2196989,Ranjeet Kumar,https://play-lh.googleusercontent.com/a-/ACB-R5Su9lKt2YnoQGE4TxUE5KZjRA8v_PTRWInpe_Mixg,Good,3,0,1.74.2.205,2022-05-01 11:02:16,"Hi Ranjeet.

Thank you for sharing your feedback. We do see that you have given us a low rating. If you are experiencing any issues, please let us know by filling out this form: https://od.vg/iCfQxBE One of our Fi Care specialists will be in touch to assist you right away. You could also reach out to us at 080-47485490.",2022-05-02 12:33:00
b1c6df0f-f293-4883-8918-2bbfcf2c5dd3,Sanu Bhaiz,https://play-lh.googleusercontent.com/a-/ACB-R5ST-aeuoqzSuRSB1SNUBWZgT8onleTXSuTlrVN30es,Those who already have federal bank or Jupiter App accounts....don't waste your time.....all is Same. #App Development Team# Plz do mention this details for avoiding confusions,3,0,1.75.1.208,2022-05-01 09:28:32,"Hi Sanu.

We'd like to apologize if you were disappointed with your experience using Fi. We'd like to contact you to gather more details about your issue. Please fill out this form with your registered contact details: https://od.vg/lSaivtY We'll make sure to get this checked on priority.",2022-05-02 17:55:03
d8615d0e-67d5-4f70-b91e-4499884d8f19,NABA JYOTI,https://play-lh.googleusercontent.com/a-/ACB-R5RqKjwM1xWGldpGsfBkWKDcYmPyIMqGTQoWyab2Pg,Fi money is good but my debit card not read,3,0,1.75.1.206,2022-04-30 19:32:41,"Hi!

Thank you so much for sharing your feedback. We do notice that you have given us a negative rating. If you are experiencing any issues, please let us know by filling out this form: od.vg/jU1rXWq One of our Fi care specialists will be in touch to assist you right away. You could also reach out to us at 080-47485490.

",2022-05-02 18:12:00
d135357d-5d3c-4f93-a387-a7d97c012df1,Aryan Rathod,https://play-lh.googleusercontent.com/a-/ACB-R5SmMPpw37MKapOJH6f8kmI7KEK2udjTDzUzfZNT,LOGIN PROBLEM HAI HE SHOWS ME SCRNING0013 PROBLEM SOLVE IT,3,0,,2022-04-30 19:18:42,"Hi!

We terribly sorry for any inconvenience caused. We'd like to contact you to gather more details about your issue. Please fill out this form with your registered contact details: https://od.vg/eMiurXU We'll make sure to get this checked on priority. You could also reach out to us at 080-47485490 or mail us at help@fi.care.",2022-04-30 15:05:05
c52fd0e8-61f0-4118-b451-ba378999d4c7,Jeyaprakash,https://play-lh.googleusercontent.com/a-/ACB-R5QmTd4uRKIdf7BR7CCCOpqw2oRXYV9veQTM_XKIbg,UPI Payment scanning doesn't work most of the time.,3,0,1.75.1.208,2022-04-30 06:13:44,"Hi Jeyaprakash!

We terribly sorry for any inconvenience caused. We'd like to contact you to gather more details about your issue. Please fill out this form with your registered contact details: https://od.vg/eRKREZQ We'll make sure to get this checked on priority. You could also reach out to us at 080-47485490 or mail us at help@fi.care.",2022-04-30 08:20:37
31f5d353-64a4-4a5c-8f1b-4045bb9e75b9,Oneclick Wedding Films,https://play-lh.googleusercontent.com/a-/ACB-R5QkJPnBgFql4bT85n5D0NqJLG91JrZkGoIrJhyPew,happy,3,0,1.74.2.205,2022-04-29 10:27:48,,
f4aaaad8-897e-4528-864d-77b88223a122,Anand Degio,https://play-lh.googleusercontent.com/a-/ACB-R5SwqulMLdZoQqoFcs5HCXNeyt3H4ao3WXwj8-Au2TY,nice app and service too good,3,0,1.75.1.208,2022-04-28 23:28:54,,
bfc05364-89ce-48db-8151-9c4d330eddc8,MOHAMMED FAIZ M,https://play-lh.googleusercontent.com/a-/ACB-R5R8Nn_8hGTv4RIRp4Dvl2zyr_UTIUnZRBH5mFavbA,good application for internet payments,3,0,1.75.1.206,2022-04-28 22:06:15,"Hi!

Thank you so much for sharing your feedback. We do notice that you have given us a negative rating. If you are experiencing any issues, please let us know by filling out this form: https://od.vg/q5hQWIJ One of our Fi care specialists will be in touch to assist you right away. You could also reach out to us at 080-47485490.
",2022-04-30 09:13:31
f6285877-d9e9-497d-9998-b6dec55afc9e,SONU GUPTA,https://play-lh.googleusercontent.com/a-/ACB-R5RCLw0uAOBkd5YixZyd-POVoYEPF-1NAKEMiqkY,My Employment Page Not Working Writing Error.. Please Help...,3,0,1.75.1.208,2022-04-28 17:46:33,"Hi there.

This shouldn't have happened and we sincerely apologize for the experience you've had. This is not the kind of service we want to offer our customers. One of our Fi care specialists will be in touch to assist you right away. You could also reach out to us at 080-47485490 or mail us at help@fi.care.",2022-04-30 12:34:11
396d9366-4e4b-4208-bfe2-ffa151be3b2e,Herojan Daimari,https://play-lh.googleusercontent.com/a/AGNmyxa3XFsC489jjPcNe0Rq0zE0G8rhT-U-SCuX7kn7=mo,No one is responding my video kyc call .,3,0,1.75.1.206,2022-04-28 11:16:41,"Hi Herojan!

We terribly sorry for any inconvenience caused. We'd like to contact you to gather more details about your issue. Please fill out this form with your registered contact details: https://od.vg/qmw53a6 We'll make sure to get this checked on priority. You could also reach out to us at 080-47485490 or mail us at help@fi.care.",2022-04-26 09:37:59
8bcaf66b-920a-40e8-a3cd-032bd3dc0b06,Anil Dhal,https://play-lh.googleusercontent.com/a/AGNmyxYLmwSK6Y4eSbmX1hLYylfH7eM6LLjokntNp4kI=mo,best,3,0,1.75.1.206,2022-04-27 13:15:34,,
f927d2df-8a12-4bbb-90e7-72c2541fba27,Shahid Chowdhary,https://play-lh.googleusercontent.com/a-/ACB-R5TCHIwk-rnbOae0GnNLDxDIBqa4jeR5XmTPPmLl-Q,Linkedin url is a pain uninstalling the app,3,0,1.75.1.206,2022-04-27 12:06:28,,
8bdd430c-5e43-4774-a85c-64313a0f6838,Vivek Rajput,https://play-lh.googleusercontent.com/a/AGNmyxaq6xGSZp5K_dtk4OaskYbx0I1ApKPz3tmULumK=mo,Gold,3,0,1.75.1.206,2022-04-26 16:15:41,,
8e67fe8b-5aa6-44bb-84d7-ddf3314992a0,VIVEK SHAH,https://play-lh.googleusercontent.com/a/AGNmyxblhVlHEMuCBSFP_JKxm3hwzMFOrrsQxpTs5mMZ=mo,"well, it's doing okay, but it should provide more rates of interest on Fixed and Smart deposits then it'll become truly competitive and attractive too... Another issue is everytime it's updated, Customer has to re authenticate all the way with selfie and voice, which is horrible and unacceptable, as it just harasses customers and doesn't enhance security even a bit....",3,402,1.75.1.206,2022-04-25 22:31:47,"Hi Vivek!

We terribly sorry for any inconvenience caused. We'd like to contact you to gather more details about your issue. Please fill out this form with your registered contact details: https://od.vg/lrZyt5i We'll make sure to get this checked on priority. You could also reach out to us at 080-47485490 or mail us at help@fi.care.",2022-04-26 09:44:43
c43b350d-f303-4a84-adc7-8f51ca2705dd,Ganesh Hirkol,https://play-lh.googleusercontent.com/a-/ACB-R5T4W2iD5sVnwZ5wdufof6CQPcIgGBYDUh0eGi5Eag,but not received any reward.,3,0,1.75.1.206,2022-04-25 12:44:17,"Hi!

Thank you so much for sharing your feedback. We do notice that you have given us a negative rating. If you are experiencing any issues, please let us know by filling out this form: https://od.vg/pH85dY2 One of our Fi care specialists will be in touch to assist you right away. You could also reach out to us at 080-47485490.
",2022-04-25 13:30:32
d884a017-60e4-4617-ab7b-81b925fbeaa7,Dilse shabin,https://play-lh.googleusercontent.com/a-/ACB-R5Qo4eL9VgZTy5FwxA2uJbSpDokoJzWnSXjrdCyQgvA,Very bad customer service Fi some customer support very rude and wasting our time They never give a proper solution for me Very bad experience Better go with other apps like jupiter i dont even whant to give you 1 ⭐😏 Edited-called fi team so many times.some representives very bad and lazy to talk with me and they never give a proper reason of my fi account problem.fi never respond my mails thesedays Today a customecare lady very respectly behave to me and she gives proper reason.for she igiv⭐⭐⭐,3,1,1.75.1.206,2022-04-25 11:21:24,"Hi!

We are terribly sorry for any inconvenience caused, however, we're thrilled that we were able to address your concern. Please feel free to reach out to our support team if you need any further assistance. Thank you!",2022-04-25 13:06:12
9c7035c9-1145-4fdf-988d-bcdd2c8a2288,deep neon,https://play-lh.googleusercontent.com/a-/ACB-R5Q0JfbBXKV1Ypwywqfk0Ja2fOoCPejBaVXL9hU-Qi4,Damn slow app.. always want to pay via UPI through fi but end up using other apps because of slow app loading time.. please optimize the app loading time.. takes about 1min to show homepage!!!!!,3,2,1.75.1.206,2022-04-25 11:06:43,"Hi there.

This shouldn't have happened and we sincerely apologize for the experience you've had. This is not the kind of service we want to offer our customers. Kindly share your registered contact details here: https://od.vg/oXc1yJe We'll get this checked right away.",2022-04-25 12:30:10
bad7123b-d9b0-489e-8295-0b710cc466c0,Rahul Tech 360,https://play-lh.googleusercontent.com/a-/ACB-R5T-wEubn7oMFfCelWVxnF5Dm1RIkqDeURQfAZtpTTE,These applications are for the rich and not for the poor,3,0,,2022-04-24 11:51:26,,
9baaea1c-ef0b-470b-8c2d-fabfd72f3e91,Sukhvinder singh,https://play-lh.googleusercontent.com/a-/ACB-R5S1FVmzp-aUrVl0SHES2HLzje5UqUiEx3DKtQVdjc4,Very nice 👌,3,0,1.74.3.201,2022-04-23 21:04:34,"We're delighted that you're enjoying using Fi, and hope to keep it this way for you and others!
",2022-04-25 12:52:49
f2d4d53d-d2b2-49c9-a1a0-3ccfb60e1ed1,Abdul Khan,https://play-lh.googleusercontent.com/a/AGNmyxapCO9kPLUy4eos0372N4SJODZFcKYmaqAAY3d8=mo,very good,3,0,1.75.1.206,2022-04-23 18:43:40,"We're delighted that you're enjoying using Fi, and hope to keep it this way for you and others!

",2022-04-25 10:49:52
fe33244f-a55f-4004-a732-812f6d40d0ba,Mir Hussain Mir Hussain,https://play-lh.googleusercontent.com/a-/ACB-R5RQNSokr-639dmZS8yesE2mfMDTIj4O1SHMJOW6,good,3,0,1.75.1.206,2022-04-23 12:23:22,"We're delighted that you're enjoying using Fi, and hope to keep it this way for you and others!",2022-04-25 11:07:52
59369122-ef40-4e47-aa6d-e291cb3a4bfc,Suneet Mishra,https://play-lh.googleusercontent.com/a-/ACB-R5TQ3FA5I540MHwd7Zsmtwhquzpo9vOTpNpzdVqSWQ,Unable to add money to the saving jar. From one month I have been trying to add money to the savings jar and it says server maintenance is in progress.,3,2,1.75.1.206,2022-04-23 01:28:19,"Hi Suneet!

We terribly sorry for any inconvenience caused. We'd like to contact you to gather more details about your issue. Please fill out this form with your registered contact details: https://od.vg/ptXgcoo We'll make sure to get this checked on priority. You could also reach out to us at 080-47485490 or mail us at help@fi.care.",2022-04-23 08:56:32
281fc8c1-5bff-4523-babd-54f50d65aa45,Nosibul Mallick,https://play-lh.googleusercontent.com/a-/ACB-R5SlBbIpAndU2WvbQvAIDmP5FPoLFkqluS3Qb5X59g,হজ্জ,3,0,1.75.1.206,2022-04-22 20:01:15,,
b883eb06-84c6-43db-a6d3-af651a6fa5a4,Bharat Sethi,https://play-lh.googleusercontent.com/a-/ACB-R5TgVaZY12JBdJ46h7ioRPRqGAk4XyIkpHLMKt6vGg,"Everythings good just the UI is not good at the time of smart deposit. I am not able to fill the amount, some error is happening over there.",3,3,1.75.1.206,2022-04-22 10:29:06,"Hi Bharat.

We're terribly sorry about this. Would you mind helping us with your registered contact details by filling out this form? https://od.vg/m2ejKe1 One of our Fi Care specialists will be in touch to assist you with any issue you're facing. You could also reach out to us at 080-47485490 or mail us at help@fi.care.",2022-04-22 12:36:24
eaaf8e8c-f441-45f5-a8ef-81d4005c4d07,Abdul Wahid,https://play-lh.googleusercontent.com/a/AGNmyxZAwJ_wO8wYDbD1uJ4rp2E9qmv59elI4iAePqmN=mo,excellent aal,3,1,1.75.1.206,2022-04-22 04:57:45,"Thanks for taking time out to give us a rating. We hope to keep the positive experience going for you. 🙌 If you have any specific feedback for us, please add it here: https://od.vg/lNO34EU",2022-04-25 17:30:20
7f276c0c-e04d-4893-a751-1c83a01a5b9a,SARATH TELECOM,https://play-lh.googleusercontent.com/a-/ACB-R5RnzBgIpZ8dnvdQPlrwJOD3dNjeY8FQP9I3dJu0Nw,good,3,0,1.74.2.205,2022-04-21 12:07:18,"Thanks for taking time out to give us a rating. We hope to keep the positive experience going for you. 🙌 If you have any specific feedback for us, please add it here: https://od.vg/gXEePu4",2022-04-26 17:36:10
56120fa0-125a-4ee0-9162-1e3e7b2fae85,Aakash Gaur,https://play-lh.googleusercontent.com/a-/ACB-R5RZEiqCVacAV815C11BNUXOj7UdKnIeHM-a4XJAQg,"Everything is good. Good, Simple and smooth UI. easy to use. Lots of new feature liy fi rules saving and reward. Thing this app is lack that you can't add beneficiary to you account this is thing to improve. If they put that feature in the app I'll go for 4 star.",3,21,1.75.1.206,2022-04-20 23:16:06,"Hi Aakash!

At the moment, Fi does not offer beneficiary details , however, we can assure you that we are exploring the possibility of including the option. We will notify you as soon as we have any update on the same. Thank you.
",2022-04-26 19:51:27
1d670534-7b3c-4e2f-88ad-4d18854683ea,Ashok T,https://play-lh.googleusercontent.com/a-/ACB-R5SCK--qgYk7EFUWpTGvLTH537y3LRAgZzFDQCdOpUk,My card deliveryed .but account is not opened .why reson,3,0,1.75.1.206,2022-04-20 22:45:14,"Hi Ashok!

We'd like to help you with your issue as soon as possible. Kindly share your registered contact details by filling out this form: https://od.vg/jCtcMgL Our Fi Care team will be in touch to sort this out for you. You could also reach out to us at 080-47485490 or mail us at help@fi.care.
",2022-04-21 11:18:00
d0438c77-9f14-411d-a57e-59f8a47a9129,Mr Raaz Ghawri 17,https://play-lh.googleusercontent.com/a-/ACB-R5QN1vwDMXXaQIhnGkPbCCWnBE_rJEhTg8oTBNI,My Atm.is not work.,3,0,1.75.1.206,2022-04-20 19:43:34,,
8712fb07-2db6-420e-a025-68befc233e4b,Karan Pote,https://play-lh.googleusercontent.com/a/AGNmyxZoDHR1U9o8xL2eIf7NKYzbeOh250ExoP_xPyOF=mo,Best app,3,0,1.74.2.205,2022-04-20 17:17:54,,
0d16c13c-388f-4aa6-8dbf-d55ccddbef2b,KHAN SAAB,https://play-lh.googleusercontent.com/a/AGNmyxbgoVSiNRCqO5Dh0EcrSBRMzyHn-YO13nXWdUoM=mo,Nice app,3,0,1.74.2.205,2022-04-19 19:06:23,"We're delighted that you're enjoying using Fi, and hope to keep it this way for you and others!",2022-04-20 17:02:56
17f2d83f-744c-4463-bc5d-dde403acf403,Pradeep Kumar,https://play-lh.googleusercontent.com/a/AGNmyxbzbOO_3p4H6c20wkuP41EPnBMZHBLW_24rLBWQ=mo,good,3,0,1.75.1.206,2022-04-19 17:06:37,"That's so good to hear, and you've honestly made our day! Thanks a whole bunch for your feedback, and we hope to keep things this way for you and everyone else. 🙌",2022-04-19 17:18:56
2b3774ac-d451-460a-b9ff-c64714e7fb8e,shibili kp,https://play-lh.googleusercontent.com/a/AGNmyxZAGp05hi7OAjorroJJ-lgA9tH05V3WRNMVbBQkSw=mo,nice,3,1,1.74.2.205,2022-04-19 16:34:39,"That's so good to hear, and you've honestly made our day! Thanks a whole bunch for your feedback, and we hope to keep things this way for you and everyone else. 🙌

",2022-04-19 17:02:17
79ae8960-409c-41a2-b250-c73ad24e4806,HEMRAJ CHAUDHARY,https://play-lh.googleusercontent.com/a-/ACB-R5Q1bFj_ipXdc-F-iCj9NDJXWtHGqtaeRA9t-mI,super,3,0,1.74.2.205,2022-04-19 12:33:53,"We're delighted that you're enjoying using Fi, and hope to keep it this way for you and others!
",2022-04-19 13:16:37
a179d1cd-5eb7-48a3-af9a-860e7f596767,Naveen Kushwah,https://play-lh.googleusercontent.com/a-/ACB-R5S05WHtFHlhC0vBCKnsJwtQa17GQU0_wRaNoggB,Good,3,0,1.74.2.205,2022-04-19 09:14:53,"That's so good to hear, and you've honestly made our day! Thanks a whole bunch for your feedback, and we hope to keep things this way for you and everyone else. 🙌
",2022-04-19 15:15:24
8484ac4c-0efb-41c3-a002-d8c9f60f5818,tech guyan,https://play-lh.googleusercontent.com/a-/ACB-R5S4kJc3jGhc6DO5a8IHkRb8stxmQm_7BA0KbZEU,good,3,0,1.74.2.205,2022-04-19 07:28:07,"We're delighted that you're enjoying using Fi, and hope to keep it this way for you and others!",2022-04-19 08:22:19
7fb10fd8-7b15-4c0e-b032-b0d3c075cb51,Aditya raj,https://play-lh.googleusercontent.com/a-/ACB-R5ScHd7SEpwPhKcrq-FHjQ9Lm9QKAM2MVT3ybkwbgA,okok,3,0,1.74.2.205,2022-04-17 11:48:52,,
4cdd8521-f580-48cb-8f08-4d1d987f635a,Mr INDIA,https://play-lh.googleusercontent.com/a-/ACB-R5RPqLlHMoDmsfyzEND7fvuSWn57F9euTvsptKF-pQ,Fifty-fifty,3,0,1.75.1.206,2022-04-17 08:17:30,,
991151e0-ea75-4fd8-bdc8-ba096f1be577,Shanker Adaj,https://play-lh.googleusercontent.com/a/AGNmyxZTjEQJK5ro0TmDK9WFfWOFGyQInt8pQr4AvJ1l=mo,"Moolah for. m has0 &5887 080 or__0 v m no problems. It m no VJ. C v nn8 v x x book turn off the-00_ N r5 083-5-8_,1 ?0. 1999 0 1 1==8 3531.+_1 3-=",3,0,,2022-04-15 20:04:59,,
f07666cc-4d2a-4709-8e4d-4087942122de,MARCO GAMING,https://play-lh.googleusercontent.com/a-/ACB-R5ThpCrBZD4HOTgl1MEicg-IO18MAIzV1rqRy9tikA,good,3,0,1.74.2.205,2022-04-15 18:18:35,"We're delighted that you're enjoying using Fi, and hope to keep it this way for you and others!
",2022-04-19 09:25:17
813cebd0-cfd0-424e-a60a-c358fd2b29aa,SAMAL BHAI,https://play-lh.googleusercontent.com/a-/ACB-R5QuTiDh7rpec8zEJudrrBb5YtZ8kDeoXJgWSrx3cQ,Awesome,3,0,1.74.2.205,2022-04-15 12:56:54,,
81f18551-5dfc-4714-834e-8a14505658b4,Aditya Borkar,https://play-lh.googleusercontent.com/a-/ACB-R5QBJUgz_gPaoMZ8M4ZB8LWf7J73KPYgG7uJWoLyXQ,"The UI is appealing and all the features are awesome! There's just one really annoying problem - You need to set a Lock Screen Password to use the app! Hey Developers, please remove this!!!!",3,7,1.74.2.205,2022-04-15 10:27:37,,
efa40500-60f8-4008-a4f4-743a606b1430,Raj Shamim,https://play-lh.googleusercontent.com/a-/ACB-R5T9c_9BuC1i3Kncj9j6Phcu83kpmGEHoY6MmCqUow,nice 👍👍👍,3,0,1.74.2.205,2022-04-14 12:14:11,"Hi!

Thank you so much for sharing your feedback. We do notice that you have given us a negative rating. If you are experiencing any issues, please let us know by filling out this form: https://od.vg/pcuj8tI One of our Fi care specialists will be in touch to assist you right away. You could also reach out to us at 080-47485490.
",2022-04-14 12:44:43
d677c32d-733a-488a-bd55-6e0e466db18f,Salkhan Marndi,https://play-lh.googleusercontent.com/a-/ACB-R5RlivAwoi45uaHqpVEVmu1sUwuqTwHQ7GslHOfEyQ,good,3,0,1.74.2.205,2022-04-14 10:46:02,"Hi!

Thank you so much for sharing your feedback. We do notice that you have given us a negative rating. If you are experiencing any issues, please let us know by filling out this form: https://od.vg/nhvFfSV One of our Fi care specialists will be in touch to assist you right away. You could also reach out to us at 080-47485490.
",2022-04-14 12:53:06
de520510-438f-4c05-83ca-00811ae6fa66,Alavudin,https://play-lh.googleusercontent.com/a-/ACB-R5T9KMxozd36sn1vsZO73zIPjSFakyZJPrTT2457,"The experience is seamless so far. Please add an option to categories expenses eg: travel, food etc",3,1,1.74.2.205,2022-04-14 07:59:29,"Hi,

We're thrilled that you're enjoying using our features! 🙌 This feedback means a lot to us. Especially appreciate the effort you’ve taken to help us improve. Thanks for this, and we’ll be sure to pass on your feedback to our teams and work towards improving the experience for you!
",2022-04-14 09:19:28
f77890eb-fd95-4d62-bf0f-8eb2e66a3033,Spunky_ Jos,https://play-lh.googleusercontent.com/a/AGNmyxZD4AIxSn3pf84yYKu3GVslDr2vQj-VG-vcWvUI=mo,Funny! The app refused to accept employment status till. 🙂,3,0,1.74.2.205,2022-04-13 21:40:09,,
454d16b2-9e92-4d90-b287-f4ce8e5c0751,Md Rakib Anwar,https://play-lh.googleusercontent.com/a-/ACB-R5QHl98_FxbZkEyzow4HNOMLykKFljFsYz3-qOud6Q,Good,3,0,1.65.1.179,2022-04-13 17:42:39,"Hi!

Thank you so much for sharing your feedback. We do notice that you have given us a negative rating. If you are experiencing any issues, please let us know by filling out this form: https://od.vg/krLRzcx One of our Fi care specialists will be in touch to assist you right away. You could also reach out to us at 080-47485490.
",2022-04-14 10:02:34
a1763e67-612f-468b-9c6e-435d03325139,Allurimk,https://play-lh.googleusercontent.com/a-/ACB-R5T6Z1NknaUEfS8J8vKQIGjpaxNrLFFqwpFGgclcMw,Not bad,3,0,1.74.2.205,2022-04-13 13:44:22,"Hi !

We terribly sorry for any inconvenience caused. We'd like to contact you to gather more details about your issue. Please fill out this form with your registered contact details: https://od.vg/hIz6H7R We'll make sure to get this checked on priority. You could also reach out to us at 080-47485490 or mail us at help@fi.care.",2022-04-13 13:57:58
aa79fdff-667f-44ae-9a8c-1fa9dd6438e0,Akhil Rakhi,https://play-lh.googleusercontent.com/a-/ACB-R5Tr791fzJf1dawcetrYP4sMDJlY7vMucSFquDltvTo,nice,3,0,1.74.2.205,2022-04-12 21:07:30,"We're delighted that you're enjoying using Fi, and hope to keep it this way for you and others!",2022-04-13 10:24:54
b64a3cd6-c628-407b-858e-d9d642cdebf8,Sonu Roy,https://play-lh.googleusercontent.com/a/AGNmyxaDw74Rh8TBlcKxWIWd2lSQ-LKRThPuw3WnrvV9=mo,good,3,0,1.74.2.205,2022-04-12 17:44:07,"We're delighted that you're enjoying using Fi, and hope to keep it this way for you and others!",2022-04-12 17:49:40
d0a67295-872b-4611-bf76-810ad8f78b33,Aryan Akram,https://play-lh.googleusercontent.com/a-/ACB-R5R8umV7YHcjSixNmguoNQFNysNobdDKlWpGHUog8Q,Very interesting account,3,0,,2022-04-11 18:57:11,"Hi Aryan!

Thank you so much for sharing your feedback. We do notice that you have given us a low rating. If you are experiencing any issues, please let us know by filling out this form: https://od.vg/lHgOsRY One of our Fi Care specialists will be in touch to assist you right away. You could also reach out to us at 080-47485490.",2022-04-11 19:30:30
7979c5f3-f5a4-42e2-949a-4daad83c3ca9,SAHIL SAHIL,https://play-lh.googleusercontent.com/a-/ACB-R5TICvTfpAEC23qYhB2EYyG8O8BXfNUoHVFNhfHGag,amazing,3,0,1.74.2.205,2022-04-11 17:19:28,"Thanks for taking time out to give us a rating. We hope to keep the positive experience going for you. 🙌 If you have any specific feedback for us, please add it here: https://od.vg/qrZgQFY
",2022-04-11 17:46:49
8324344a-314b-4f2a-9303-5e108977c8cd,mosior mallick,https://play-lh.googleusercontent.com/a/AGNmyxZGjZwABQVEzQvvZv6MNYyu5A81_Fdxiy5ny4uk=mo,good app,3,0,1.74.2.205,2022-04-11 16:08:31,"Thanks for taking time out to give us a rating. We hope to keep the positive experience going for you. 🙌 If you have any specific feedback for us, please add it here: https://od.vg/eofTR0G",2022-04-11 17:50:30
4ffa6452-72a1-47b8-a9ef-1b4de88a748d,STATUS 9.1,https://play-lh.googleusercontent.com/a/AGNmyxbYYDuApzcc19cy3zl9iRb61Wfu6eIAuJAL3WUP=mo,Nice application,3,0,1.74.2.205,2022-04-11 07:46:01,"Thanks for taking time out to give us a rating. We hope to keep the positive experience going for you. 🙌 If you have any specific feedback for us, please add it here: https://od.vg/jAhIb4e",2022-04-11 08:47:26
6eb1034c-291d-4b27-a275-44b19945c812,Gokul S,https://play-lh.googleusercontent.com/a-/ACB-R5QkgU_ocq_tJiTHUh_FV8kUp8Rt_fu4BXkdMP1Daw,Overall service of the application and user interface is good and easy to use. There are lots of features available which are interesting. Unfortunately the main issue is the customer support. I have created my fi account 2 months before and till now I haven't received the debit card. I have contacted the customer support by mail and they hadn't replied to me.,3,5459,1.74.2.205,2022-04-10 22:01:10,"Hi there.

This shouldn't have happened and we sincerely apologize for the experience you've had. This is not the kind of service we want to offer our customers. Kindly share your registered contact details here: https://od.vg/cN2xqsZ We'll get this checked right away.",2022-04-11 08:28:53
18326cb9-633a-4fd8-9ab6-5050fad6d3a0,Sagar Keshri,https://play-lh.googleusercontent.com/a-/ACB-R5SI-q9wTwhtQ5-zPXfD_R-3rpvzdAgkPgTwOzTkboM,My transection is not update (some transection is still been updating) but its not update,3,1,1.74.2.205,2022-04-10 20:13:04,,
ffdd71c2-6280-47b6-9815-85a126b5d6ac,Nandini Samal,https://play-lh.googleusercontent.com/a/AGNmyxZunUklUWP6RQeyw6pfOYrB17eYcJr3Lv2_LAtF=mo,good aap,3,0,1.74.2.205,2022-04-10 20:09:00,"Thanks for taking time out to give us a rating. We hope to keep the positive experience going for you. 🙌 If you have any specific feedback for us, please add it here: https://od.vg/cZ2Yi9h
",2022-04-11 08:44:48
b24136d5-d73f-4a6f-a00d-068ea730b977,Sudin Apu,https://play-lh.googleusercontent.com/a-/ACB-R5R7GYn14UM0FWzy4tdukDBHkKNFVdgTKeoHI_mmtw,I can't complete my kyc..... Please help me.,3,0,1.74.2.205,2022-04-10 18:15:23,"Hi Sudin!

We terribly sorry for any inconvenience caused. We'd like to contact you to gather more details about your issue. Please fill out this form with your registered contact details: https://od.vg/itv8B43 We'll make sure to get this checked on priority. You could also reach out to us at 080-47485490 or mail us at help@fi.care.

",2022-04-11 08:39:50
a986d34d-78a2-4e8e-b548-04286b96c5d9,Most WellCome,https://play-lh.googleusercontent.com/a-/ACB-R5RV6l0DjXKWrP4Beb7KFZYxlWHqT44rI9F47boljw,good,3,0,1.74.2.205,2022-04-08 23:13:43,We really appreciate the feedback. This is the sort of thing we live for!,2022-04-09 10:30:31
e79e938b-1e33-4636-9cef-57291d2809fb,Heera Singh,https://play-lh.googleusercontent.com/a-/ACB-R5T2c4kjWKm4Ilb7Z3rsRCkfJGhJ6x5cJTEEKJ3waQ,I'm a full KYC customer and requested for checkbook more than 1 month ago and raised multiple requests through chat and call...no action being taken and representative skip all the time saying we are looking into the request and it will be solved and i will be getting checkbook asap..but nothing from your side... frustrated really contacting u pple multiple times placing multiple request but sadly no issuance of checkbook nor any resolution...very bad experience for me... 😡😡😡,3,5,1.74.2.205,2022-04-08 00:06:27,"Hi Heera!

We're terribly sorry about this. Would you mind helping us with your registered contact details by filling out this form? https://od.vg/pfLgssS One of our Fi Care specialists will be in touch to sort this out for you. You could also reach out to us at 080-47485490 or mail us at help@fi.care. Thank you!",2022-04-08 10:35:35
