reviewId,userName,userImage,content,score,thumbsUpCount,reviewCreatedVersion,at,replyContent,repliedAt
5b8ab8a1-ce8b-441c-a849-a8dbc54c89f2,Akash Kumar,https://play-lh.googleusercontent.com/a-/ACB-R5Qg3GnQoBHjRNH2TbgtIF8kdA_13T1AuZ2CVcxc1Q,It's very bad app my recharge was failed but my money has been debited and it's not refunding now 😭😭 dont ever try this app never ever plz guys🙏🙏,1,0,1.2.1,2021-11-26 21:28:14,"Hello, money deducted for failed transaction will be auto refunded in your account within 7 working days. Thanks",2021-11-29 15:42:27
0390736a-36bd-4c5c-9940-889ce6492282,Mukesh Kumar Parihar (Muksa),https://play-lh.googleusercontent.com/a-/ACB-R5RB7uTu_cPdok98bImA9KOWX5QZUGa730Sen-IFoyI,💣💣💣💣💣💣💣💥💥💥💥💥💥😭😭😭😭😭😭😭😭😭😠😠😠😠😠😠😡😡😡😡😡😡😡😡😡😡😡😡😡😡😡,1,0,,2021-11-26 20:40:19,"Hi, can you elaborate your concern so that we can assist you better? Please contact us via Help section.",2021-11-29 15:41:51
b0ccc6b5-3dd5-4fb3-a3ae-3b8b086ef8a6,Debashish Shaw,https://play-lh.googleusercontent.com/a-/ACB-R5Rr26OFISRqoXNnqm8w1QnAH0pLmZp4tYAP7q6Ppw,Please add scan and pay option like Omni card,1,0,1.2.1,2021-11-26 19:49:31,"Dear User, Thank you for your suggestions. We will try and incorporate them upcoming versions.",2021-11-29 15:41:35
cc967089-8036-4d49-8085-0ba393d8270c,Vikas Gurjar,https://play-lh.googleusercontent.com/a-/ACB-R5SL3z8LkXfXRNelFXdvDUSDo1MOYDt275y4Gp8R,"Worst application. The stolen my money, not even giving card details after loading money . Tried many times, Support is not good at all .., please don't use this .",1,6,1.2.1,2021-11-25 19:37:48,"We highly regret the inconvenience. However, we could not understand the exact problem. Please shoot us a message via help section with relevant details. We'll be more than happy to assist you.
Thanks.",2021-11-29 19:31:38
ab3b87e9-774f-49e1-baf8-257da8a37864,Deepu Kumar,https://play-lh.googleusercontent.com/a-/ACB-R5Q6ULXLXN4aSIj5gXy_bR6sp9PS-4Q8NYqcrZlc4A,Ok,1,0,1.2.1,2021-11-25 10:10:26,"Hi, what problem did you face in the app? Please write to us via help section. We will try to help you immediately.",2021-11-29 19:30:09
80524da0-0ed6-4147-a029-46cbab3bef05,Ms Word,https://play-lh.googleusercontent.com/a/AGNmyxbI3msXwqeDxn5HbsIkQcWQq-MACpoSivFId-G6=mo,I add money after few days not logging and lock java security I give 0 star .,1,0,,2021-11-25 08:57:51,"Hi,
We are sorry for the inconvenience caused. Kindly share your concern along with the error screenshot via help section for further assistance.",2021-11-29 19:29:41
31d3d3e1-67fe-46a6-a9ca-148a30ba2d4d,Losers Admin,https://play-lh.googleusercontent.com/a-/ACB-R5R66BlC55q1SWARuzXk58zmoBfXayykTPjoQQg,Why pay for debit card 😞,1,0,,2021-11-24 23:14:50,"Dear User, thank you for your comments and feedback. We would like to support you with this issue and so we’d appreciate it if you could write back to us via the Help section.",2021-11-29 19:41:38
efccf57d-3ad8-4319-8889-aa2fa7916826,pawan jain,https://play-lh.googleusercontent.com/a/AGNmyxZ5m3K-QycyR-2EFSwf9xub3sNT0fGlw4k_fgYB=mo,i did transations on petrol pump & mega mart.but junio card is not working. every time transactions failed.dont use this types of card. it will create trouble & your money will be wasted.,1,1,,2021-11-24 21:17:29,"Hi,
We are sorry for the inconvenience caused. Kindly share your concern along with the error screenshot via Help section for further assistance.",2021-11-29 19:40:33
1cf46baf-f92a-43ef-b534-d63029b4474c,manikumar reddy,https://play-lh.googleusercontent.com/a/AGNmyxZzlee10z_WlcbvpFngfMzqbFhq2XwSAIls6Du6Lw=mo,Wrost app....I had loaded money.....the card is not working....this is a big scam.....why this app giving card..the card is not working..... Plz give me mail I'd....this card is not working plz I had add amount,1,0,1.2.1,2021-11-24 20:12:50,"Hi,
We are sorry for the inconvenience caused. Kindly share your concern along with the error screenshot via Help section for further assistance.",2021-11-22 16:24:11
33209140-3f13-4404-8905-707326a8ffdb,Kids Video,https://play-lh.googleusercontent.com/a-/ACB-R5TZ6MXKgQ3NiJG2eRIV-EXjMTpdxeS2ynUMB10n,Pata nahi mpin kya ha login nahi ho raha waste the time i trying before 3 hours not success in this app worst the app,1,0,1.2.1,2021-11-24 16:36:23,"Hi,
We are sorry for the inconvenience caused. Kindly share your concern along with the error screenshot via Help section for further assistance.",2021-11-29 19:32:39
f006ed09-859c-43fe-974a-b0d763c08974,JJ Sarkar,https://play-lh.googleusercontent.com/a/AGNmyxb_myf_hblGkGqVP5z0E_PD3_8jbWGHvcjnMkM2=mo,Very bad experience. I am logging in with my 4digit passcode it says wrong pass code I changed it 3 times tried again it still says wrong passcode,1,4,,2021-11-23 15:37:08,"Hi, can you please send us your account details along with the screenshot of the problem via Help section so that we can help you. Thank you for using our app.",2021-11-29 21:03:01
336c9adb-8025-43c7-b8b3-a0e25b7e5503,Imran Alam,https://play-lh.googleusercontent.com/a/AGNmyxZNU1mEWcdf_r6_drkalN772BDkg3xChM-F45bD=mo,It is a fake and worst app i can't reaigtered my no. In it,1,0,,2021-11-21 11:10:57,"Hi, please contact us via Help section with information about your issue and ideally a screenshot of the error you are getting. We'll definitely look into it.",2021-11-22 16:25:41
3506e097-4ed9-473b-82e7-2162fa4f3b8f,Siva siva,https://play-lh.googleusercontent.com/a/AGNmyxZMQ9ybyquXXWyf6S7dDOWPUYmYa1RbjlSb5KK3=mo,"I am unable to see virtual prepaid card, uninstall and installed three times, not working",1,0,1.2.1,2021-11-20 20:43:42,"Hi,
We are sorry for the inconvenience caused. Kindly share your concern along with the error screenshot via Help section for further assistance.",2021-11-22 20:22:28
d37ec608-0ba6-4040-9bea-fcaa6f547d92,Rohit Agarwal,https://play-lh.googleusercontent.com/a-/ACB-R5QTlmIdnYawXdNQE9Wni-_zvpHKYy5I0AU9r6gACg,Worst payment card i seen. Never complete a single payment everytime fails,1,0,,2021-11-20 08:44:48,"Hi,
We are sorry for the inconvenience caused. Kindly share your concern along with the error screenshot via Help section for further assistance.",2021-11-22 20:20:51
10a2ec2e-6542-40eb-b234-d7cfccc98306,sarika bansal,https://play-lh.googleusercontent.com/a-/ACB-R5TJjSYcRobURJD9rsr7y0cy2VuVpLCromSl7KK8,"I m facing problem in log in and in set pin section too. No one is helping. Only help section is pop out . They say to reinstall the app, i did it but of no use, unable to understand what to do? How can we suggest to others to buy this card when the already customers including me are not happy with your service as I read the reviews of other customers.",1,1,,2021-11-20 07:22:59,"Hello, as discussed over the call your query has been resolved now. Please contact us via Help section in case of any query. Thanks",2021-11-22 20:17:04
2a21f64a-5aa7-49ec-8ee0-86fe13e56103,Aman Singh Rajput,https://play-lh.googleusercontent.com/a-/ACB-R5SnYiP4EVvzRBoL80f2O3SdKkrHHFCeB74XKRlDxQ,"Don't waste your time and money on this application because when I logged in this app and what I saw that there is no option for online payment service like QR code scanner,UPI feature and other ones.And it's quality of work is also not so good. One thing I always tell those who want to use this application first of all please check some reviews before using these types of application.",1,2,,2021-11-18 06:26:14,"We highly regret the inconvenience. However, we could not understand the exact problem. Please shoot us a message via Help section with relevant details. We'll be more than happy to assist you.
Thanks.",2021-11-22 20:24:07
e16ddc45-2479-4c5a-a5d1-a6373c59c432,ADARSH DUBEY,https://play-lh.googleusercontent.com/a-/ACB-R5QfATgDg7JA4_B5vwUEmi5NEtrV1khVrZ7KDFeFxg,Totally disappointed waste app,1,0,1.2.0,2021-11-18 03:01:33,"Hi, we regret the inconvenience caused. Kindly elaborate on the issue so that we can look into the matter and resolve it for you. Please write to us via Help section.",2021-11-22 20:23:00
9887b10b-82a9-425f-bbd4-8716b7371184,Prateek B.,https://play-lh.googleusercontent.com/a-/ACB-R5SFiqxAJ5XWb4X8ouTwODAZZVqDYAHdJqrwkd8jlQ,sometimes not getting otp's sometimes something went wrong.,1,0,1.2.0,2021-11-17 13:36:16,"Hi,
We are sorry for the inconvenience caused. Kindly share your concern along with the error screenshot via Help section for further assistance.",2021-11-22 20:34:15
367fcad0-c1bc-4a41-b745-c7ea0f696655,AMAN DUBEY,https://play-lh.googleusercontent.com/a-/ACB-R5QxGCRdSKj6vlsLOqDL-LymvSXq9E2Pvrey-BAsyg,Very bad app 😡😡😡😡 it's not delivered my junio card,1,0,1.2.0,2021-11-16 14:17:12,We regret to note this. Please contact us via Help section with your contact details so that we can address your concern.,2021-11-17 20:56:26
d7fd6d01-c420-46c9-8a7b-2cd702ab0fb6,RDX SONU,https://play-lh.googleusercontent.com/a-/ACB-R5QxrRBxnj1c1GhG23Iui9x8Q1DHwvOXiP-N6HkCEA,I have many transection in junio app but next month cashback received only 36 rs😡😡🤬🤬,1,0,1.2.0,2021-11-15 10:22:21,We understand this can be frustrating. We are working towards making this better. Please contact us via Help section in case of further queries. Thank you.,2021-11-02 17:00:23
b90b880e-ad07-4c90-9b9d-894ad82b2f95,BR FAN “BIKKI ROY” KING,https://play-lh.googleusercontent.com/a-/ACB-R5RE1_3SZZ4MG8hLZborSCQfNWMymIggrCcSNTML0w,Faltu app hai,1,0,1.2.0,2021-11-15 08:36:03,"Hi, what problem did you face in the app? Please write to us via Help section. We will try to help you immediately.",2021-11-16 16:47:40
bf970355-24d7-480d-bb1f-91a09391e864,Surendra Kumar,https://play-lh.googleusercontent.com/a-/ACB-R5QYxlax8alxFIpzm0QGPxQFxo01HBF0G5KreeUszg,Cashback not credit,1,0,1.2.0,2021-11-15 06:58:32,"Hello, Cashback for the month of Oct'21 has been already processed as per offer's terms and condition. Please contact us via Help section in Junio app in case of further queries. Thank You.",2021-11-16 16:47:23
1fa37ca0-c7c8-4c2d-92e5-cdcd2872b0ac,Sahil Keswani,https://play-lh.googleusercontent.com/a-/ACB-R5R7ahR4WoYYr2N4crq6TkGBmB6XPvf_fUdnPGPVi9w,I didn't get 7% on my first transaction,1,0,1.2.0,2021-11-14 16:37:53,"Hi, we'd like to understand the issue and help you with it. Kindly share your details via Help section. We will check and get back to you on this.",2021-11-15 17:42:50
1c23b7fe-7a77-42ab-803a-a3901086e22a,Soumen Das,https://play-lh.googleusercontent.com/a-/ACB-R5THx903ajHwaSqqiVz-HoMwfywZ1K5glvDKV2wAsw,"Fake app,not customer care sarvice,not cassback received! money add big charge!hello everyone not use junio...use best app akudo app!",1,0,,2021-11-13 16:19:15,"Hello, Cashback for the month of Oct'21 has been already processed as per offer's terms and condition. Please contact us via Help section in Junio app in case of further queries. Thank You",2021-11-13 16:03:34
628327d7-ad30-4955-a581-493a54c8d032,Vishal Agarwal,https://play-lh.googleusercontent.com/a-/ACB-R5TXmizDpnVOGVsN9EfYUSz0WH6QiSx4cqWSfrPd5-0,"This junio is a big scam, they can eat your money at any point of time. I loaded money in the card then after few days i am not able to login. It shows java null point exception. Mail to developers no answers. No customer care number, nothing they having, really be careful they can block your money at any point of time. I will go to consumer court if they don't give any answer, because my details are true and all things are real not fake. Junio team will suffer alot if this not resolved.",1,181,1.2.0,2021-11-13 10:26:44,We regret the inconvenience you had to face. For better assistance please share your information via Help section. We will be happy to assist you.,2021-11-15 17:46:17
3e611094-3786-412f-99ab-7575cbad3228,Pranjul Shukla,https://play-lh.googleusercontent.com/a-/ACB-R5SiNJc55fQQrNIN0agFhGBp1c9qnob2aAJMY3usuA,Unable to sign up,1,0,1.2.0,2021-11-13 01:09:42,"Hi,
We are sorry for the inconvenience caused. Kindly share your concern along with the error screenshot via Help section for further assistance.",2021-11-15 17:47:37
d0a9451e-471b-42f8-9600-6ed177767a09,Rudraditya Deshmukh,https://play-lh.googleusercontent.com/a-/ACB-R5RpJx2Iv06HibJIVu1BfZw1lii2k_S3o7ICXlFd,Worst app I refer a freind and i did not get my rewardp,1,0,1.2.0,2021-11-12 21:10:32,"Hello, there was an issue with referral scratch card which has been fixed. Can you please check and let us know if you still have not received the scratch card?",2021-11-13 16:09:52
2a686278-2ed3-46d0-af03-b1ad97827015,nasik hossain,https://play-lh.googleusercontent.com/a/AGNmyxa5QHoU4t6IsZQDP4uppQtNDT4hJe-tB3swi2mS=mo,Fraud,1,0,1.1.4,2021-11-12 20:54:39,"Hello, can you please let us know the reason behind this low rating and review. We will be happy to assist you, you just need to text us via Help section in Junio App. Thanks",2021-11-13 16:08:54
de8389d4-53bb-441b-9719-30755a909f6a,BenSiti,https://play-lh.googleusercontent.com/a-/ACB-R5SZthY4UbG6CjEKV4klDrTYq54-4cymDmzJkincSA,It's best in old versions. But now they have too many bugs and erros along with new unfair condition of minimum deposit of 100rs.,1,15,1.2.0,2021-11-12 14:26:31,"Hi,
We would like to chat with you with regards to your experience with us. Can you provide us your details via Help section so that we can reach out?",2021-11-13 16:07:03
a95dadda-9d85-4800-993c-fb86489282ab,Fire Fox,https://play-lh.googleusercontent.com/a-/ACB-R5Qjb2P9JpZi_3K3Acln7r23TCRRSomEyt7NO349NQ,"Worst App and Interface they reduce cashback day by day,junio don't have ethics it's marketing tecktic only..don't fall in trap..",1,2,1.1.4,2021-11-12 11:06:26,We are really sorry you feel this way. Please tell us more about your experience via Help section and we will help you in the best possible manner.,2021-11-13 16:06:08
1d4b417b-b6bc-4133-981c-388ae53863ff,Vinay Jaiswal,https://play-lh.googleusercontent.com/a/AGNmyxaoRKvudZDT9aFScZNvmy3g8DiY752xgYYfJBis=mo,Not good,1,0,1.2.0,2021-11-11 23:46:05,"Hi, can you tell us why you don't like the app so that we can improve it. Let us know by writing to us via Help section in App.",2021-11-13 16:10:19
a0faaeed-5962-49f6-bef7-912f30f4a121,Khan sir Patna shorts,https://play-lh.googleusercontent.com/a-/ACB-R5SKOw0IEdNCXoly5Nf492xD0aJ2Ay3IdnGH0FtRqg,Useless app after load money you can not add money in paytm wallet,1,0,,2021-11-10 21:29:30,"Hello, adding money to any prepaid wallet is restricted as per government guidelines. Please contact us via Help section in case of further queries. Thank You",2021-11-13 16:02:31
99eb2851-ace7-423d-b959-6a1fb7a3a7ad,Shahrukh Raza,https://play-lh.googleusercontent.com/a-/ACB-R5Qr-O4c0IuMhVLIt_4ugY2MAqxvx-pQjIu-hcQaqQ,This app is not working properly whenever open it shows failed to load details.,1,1,1.2.0,2021-11-10 16:08:59,"The inconvenience caused to you is deeply regretted. Try to clear the app data and cache. Also, please make sure that the device is connected to the internet. If nothing works, please share the registered mobile number via Help section.",2021-11-13 16:14:50
1dd92448-56a2-4c93-9c9d-9569afd2265a,dinesh nagar,https://play-lh.googleusercontent.com/a-/ACB-R5Tw9s6skWJplz25B0_x2pEnxIJdIObEpKYwfEkh,Service is not batter of junio Not good responce of junio team Bad services,1,0,,2021-11-10 15:46:32,"Dear Customer,
We are sorry that you feel this way. Please do share your feedback along with your contact details via help section and our team will reach out to you at the earliest.",2021-11-13 16:14:21
e1f68f45-0ebd-4c8e-8ba8-b30a68b27238,Sourav Das,https://play-lh.googleusercontent.com/a-/ACB-R5Tqh1RoXLPHVmho9ndit0ztfi6GblNAA17An4Tr6A,I order the card but they say address is incorrect. Then I give them enough address to dispach but not get any rply from them. And you are also ignore my massages. So if you not want to deliver my card then cancel the order and refund me back. WORST CUSTOMER SUPPORT😡😡,1,0,1.1.7,2021-11-10 13:24:06,We regret to note this. Please contact us via help section with your contact details so that we can address your concern.,2021-11-13 16:13:57
4279c74a-112e-4bf0-aa30-b692a0679326,Zamena Gaming,https://play-lh.googleusercontent.com/a-/ACB-R5R-zGkpJK73MvdaKaiIqh31VAyAMQCHVnWFEtXv,I was using card last month and junio changed my card to Rupay. All my transaction and the reward 7% for those transaction they don't give really bad thing.,1,1,,2021-11-10 10:18:00,"Hi,
We would like to chat with you with regards to your experience with us. Can you provide us your registered mobile number via Help section so that we can reach out?",2021-11-13 16:13:04
f119bf59-3848-4add-81d3-4044286c0e06,Moulik Malhotra,https://play-lh.googleusercontent.com/a/AGNmyxZNO3mmmMIDzwku4BjxSqW6WEq9NOXBGu25rvA=mo,This app is fake app I will not get my junio card my rs also not get this is fake app I will reported in police,1,0,1.2.0,2021-11-10 01:19:13,"Hi, we'd like to understand the issue and help you with it. Kindly share your details via Help section in App. We will check and get back to you on this.",2021-11-13 16:12:15
0a90fde8-bf70-4af1-a746-a1fc45ee87db,Aryan Aggarwal,https://play-lh.googleusercontent.com/a/AGNmyxZMgeQfKqgiR2GCyto8mF8o7PYqOHVl6T7Jxefs=mo,Wrost app,1,1,,2021-11-09 20:12:43,"Hi, can you elaborate your concern so that we can assist you better? Please contact us via Help section.",2021-11-13 16:00:52
5328e732-66e5-46c8-8105-e1661b1cdf5f,Avijit Baral,https://play-lh.googleusercontent.com/a-/ACB-R5TfZPXAEOnuicMAbP3qyGA-_OU6WuN4PF2Du9q66A,The new version of the app 1.1.7 is not working it said failed to load details. Worst update please fix it,1,13,1.2.0,2021-11-09 13:30:33,"Hi,
We are sorry for the inconvenience caused. Kindly share your concern along with the error screenshot via Help section for further assistance.",2021-11-13 16:01:09
592348fd-1e38-446c-969b-29f1af8c0e5c,Dr Rohitash Prajapat,https://play-lh.googleusercontent.com/a-/ACB-R5RHKxFiRd1UFnCsZWhKfLOxDEFaE9S6I_2gPJPY,Fraud app,1,1,1.2.0,2021-11-09 13:20:54,"Hi, can you elaborate your concern so that we can assist you better? Please contact us via Help section in Junio App.",2021-10-11 15:34:31
3153cef4-c4dc-44d9-8e90-82c884284b47,Partha,https://play-lh.googleusercontent.com/a-/ACB-R5S6-V73GIwbj5WYt7fblYQRN5YyA9zFkD1QPUZvqg,Fake app. I do 2 transaction on same shop near to my house one is Rs 200 & another is 9800. I got only Rs 14 cashback? When I contect to customer care they did not help me. Fake app Very bad customer support Plz don't use it They did not give any cashback,1,1,1.2.0,2021-11-09 11:44:37,We regret the inconvenience you had to face. For better assistance please share your information via help section in Junio app. We will be happy to assist you.,2021-10-11 16:09:51
7d37dd19-7330-4633-9911-c4036ed2a8ad,Raghunath Bej,https://play-lh.googleusercontent.com/a-/ACB-R5RYfCG5XGEpTU9u9fgfW0jKCjk2jzMr5RPABaXZtg,Do not waste your money this app totally Fake not gaven any cashback. This app change cashback terms and conditions everyday.,1,0,1.1.7,2021-11-07 21:03:26,"Hello Sir, Cashback has been already processed as per the offer's terms and conditions. Please contact us via Help section in case further assistance required.

Please visit T&C for more details - https://intercom.help/junioin/en/articles/5614322-7-cashback-on-every-transaction",2021-11-09 12:29:29
cb326347-5667-4d8d-a7c5-45090bc86723,KAMLESH MEENA (INSURANCE AND TRUM PLAN),https://play-lh.googleusercontent.com/a-/ACB-R5TAttQPqDouYEAugcFQ41qAAaAsLTs-Mn8w6RmGsQ,Card apply karwa ke delivered nhi karte h chor h,1,0,1.1.7,2021-11-07 17:29:23,We regret to note this. Please contact us via Help section with your contact details so that we can address your concern.,2021-11-09 12:19:53
25cdff25-b10d-4661-b778-56cb1542d0d3,Ganesh Ghani,https://play-lh.googleusercontent.com/a-/ACB-R5QawQ91h70AFz3SyWOcau3s_RdtEyq354U5oa6lvw,When i tried to add my child details app was keep Stopping,1,0,1.1.7,2021-11-07 15:06:51,"Hi, can you please send us your account details along with the screenshot of the problem via Help section so that we can help you. Thank you for using our app.",2021-11-07 16:11:42
8d1efa1f-f2fd-4b19-9327-842394159d64,vivek Ruler,https://play-lh.googleusercontent.com/a-/ACB-R5QFkzCAoStLsXynjGLEM9RX21R0Z73kFwHIUZ_J_g,Just Worst Experience Ever 😤🤢🤮,1,0,1.1.7,2021-11-07 13:53:49,"Hi, please elaborate your concern along with your details via Help section so that we can get your issue addressed.",2021-11-07 16:11:11
7c266682-38f8-4f80-b6e1-3ae76eb48323,Jayant Baweja,https://play-lh.googleusercontent.com/a/AGNmyxZ0gJsauUv4ZbpnPB_p_hYGeaISP6TY3E_0CkW9=mo,no cashback received fake app,1,0,,2021-11-07 09:52:36,"Hello, cashback for the month Oct'21 has been credited. Please contact us via Help section in case of any queries. Thanks",2021-11-07 16:13:33
065eab44-a973-4a3f-91fa-c0bd8269be6f,Sai Charan Kodithyala,https://play-lh.googleusercontent.com/a-/ACB-R5QtyXAWepclEj8EUnr7JJLv5tY7Oyb8IFs5EyUVydA,Not received any cashback,1,0,1.1.7,2021-11-06 20:48:25,"Hello, Cashback for the month Oct'21 has been already processed on time. Can you please check and let us know in case you still have any queries.",2021-11-07 16:18:54
143f17d1-f735-4906-823e-035d502cc535,Sofikul Halsana,https://play-lh.googleusercontent.com/a-/ACB-R5SNy_BHAsV8d6TtnNl0nPTFlAOlwZZbbcAlnaeM,"Worst service, No response from customer support",1,0,1.1.7,2021-11-06 19:21:19,"Hi, we regret the inconvenience caused. Kindly elaborate on the issue so that we can look into the matter and resolve it for you. Please write to us at hello@junio.in.",2021-11-07 16:19:05
65329553-1127-4a11-9a20-5c2022499919,Utkarsh Tiwari,https://play-lh.googleusercontent.com/a/AGNmyxYb0k0W9JNzThobN-P6ckSOSvTnetNbt--EOdAg=mo,Very bad this app not working You don't installed,1,0,1.1.7,2021-11-06 12:33:25,"The inconvenience caused to you is deeply regretted. Try to clear the app data and cache. Also, please make sure that the device is connected to the internet. If nothing works, please share the registered mobile number, device details and service provider details via Help section in Junio App.",2021-11-07 16:33:31
43d84668-0192-44fe-9c3a-7fc593e5ca11,Debraj Chandra,https://play-lh.googleusercontent.com/a/AGNmyxZI8VUWk7w76wPLdyAWceEXfid8USd4aeVB5Rk=mo,Card delivered nahi kiya 4 months,1,0,1.1.7,2021-11-05 22:45:52,"Hello,
We regret to note this. Please contact us via Help section in Junio App with your contact details so that we can address your concern.",2021-11-06 14:59:21
25ec6bb6-6d3b-4056-95c6-30f4d8477689,H P HaRa PraSaD,https://play-lh.googleusercontent.com/a-/ACB-R5REjuZWbB5355hNkg2aFjJMUaG5HzUdcGOPEhddIg,The bad app has been automatically shut down. And also Cashback not received of 2 months.,1,0,1.1.6,2021-11-05 09:06:52,"Hi,
We are sorry for the inconvenience caused. Kindly update your junio app to the latest version 1.1.7 where we have fixed these issues.",2021-11-06 14:55:57
4785276a-f339-4105-ac8b-1e8dac2bd7f3,Amit Singh,https://play-lh.googleusercontent.com/a-/ACB-R5Raff2foomA3IufiqEpIS19OyE725rrjpd9ezkfhg,App crash a lot in new update,1,0,1.1.6,2021-11-05 08:44:11,"Hi,
We are sorry for the inconvenience caused. Kindly update your Junio app to the latest version 1.1.7 where we have fixed these issues.",2021-11-06 14:56:10
36300457-02d0-4af1-bb2c-53871c39b7f2,Nishant Kumar,https://play-lh.googleusercontent.com/a-/ACB-R5Q-mNx6nVTysV3zCYcalt5gsLmaAv37b3ixiJu2bQ,Very wrost working app,1,0,1.1.3,2021-11-04 21:42:42,"Hi,
We are sorry for the inconvenience caused. Kindly share your concern along with the error screenshot via Help section for further assistance.",2021-11-06 15:02:10
4c3aecb4-bf49-4650-ac64-cb72391fe5bf,Sourav paul,https://play-lh.googleusercontent.com/a-/ACB-R5T5OKdFsowRLbh6sVW9lncDPH1dic-S_OncpbZG,Nice,1,0,1.1.5,2021-11-04 14:52:22,"Hi, if you like the app, could you please give us more stars?",2021-11-06 15:00:22
2164084e-486b-4201-b85c-af33a12c5448,CHANDRESH 0.1,https://play-lh.googleusercontent.com/a-/ACB-R5TdUYGIa2URW-_X3FogVkK_HI88zeJbB2XFwsxv5w,Worst customer support,1,0,1.1.5,2021-11-03 17:15:49,"Hi,
We would like to chat with you with regards to your experience with us. Can you please contact us via Help section so that we can reach out?",2021-11-06 15:05:12
f223f3b7-e8e3-4e51-88e2-9525ad5282e0,Nanda lal Das,https://play-lh.googleusercontent.com/a-/ACB-R5R0GcREU-TDpDZ01IvxLgJXoz-EBfYxpLp4jnP1qQ,My Transection history not show.,1,0,,2021-11-03 06:43:01,"Hi,
We are sorry for the inconvenience caused. Kindly update your Junio app to the latest version 1.1.7 where we have fixed these issues.",2021-11-06 15:02:37
1d2b3f3b-cbf4-425b-8d40-692e99b063c4,꧁༺AKྂHྂIྂLྂ PAྂNྂDྂIྂTྂ༻꧂,https://play-lh.googleusercontent.com/a-/ACB-R5T783LWW-WqBGL7wxJq2ronnNCqni9VlYVala5C8g,Worst application please don't download anyone not give any percentage cashback only fake app,1,1,1.1.4,2021-11-02 21:10:08,"Hi, we'd like to understand the issue and help you with it. Kindly share your details via Help section in Junio app. We will check and get back to you on this.",2021-11-03 14:13:12
11332f69-f8b2-4fbc-833d-d9e3eb1d1366,Abhishek Kumar Singh,https://play-lh.googleusercontent.com/a/AGNmyxbtUWJQW9_8C6VzapoBHzYYL_U-OIMhAZuoW24I=mo,Not at user-friendly app most of the time payment get rejected though have balance in account,1,0,,2021-11-01 07:51:11,"Hi,
We are sorry for the inconvenience caused. Kindly share your concern along with the error screenshot via Help section for further assistance.",2021-11-02 17:01:05
1a90bd95-5b92-4e9a-9f49-9b29d2b34308,I love Upa,https://play-lh.googleusercontent.com/a/AGNmyxbbXfpjZ_8eGLwTQRitwhYBn0TSuSrbGRLhdox0=mo,This app is amazing..mind blowing,1,0,,2021-10-30 19:01:58,"Thanks for the review. If you like our app, would you mind rating us 5 stars? That would be very encouraging for us.",2021-11-01 13:29:51
