reviewId,userName,userImage,content,score,thumbsUpCount,reviewCreatedVersion,at,replyContent,repliedAt
2dc30b46-1749-49eb-a7da-d65451228750,Vedha Moorthy,https://play-lh.googleusercontent.com/a-/ACB-R5Qa-xgtENUugZFUHpk75xlPDxIOmHA3ExgLK_nc90E,Once again...Waste of Money and time.,1,0,2.0.1,2022-03-16 12:39:48,"Hi, we'd like to understand the issue and help you with it. Kindly share your details via help section. We will check and get back to you on this.",2021-12-15 13:39:18
ce50614f-a6c4-42a2-8c82-d2deeb9234a9,Dr.kuldeep Patil,https://play-lh.googleusercontent.com/a-/ACB-R5TCDgkTV7EQAstJritSSCmnXaMX4feI_YJUcyQv1fI,Fake offers...It was saying a 50 percect off on tickets on bookmyshow but when applied no offer given.... Don't make false advertisement if you don't want to give what you have promised...very bad experience in the starting only ...I am deleting it and would never recommend anyone to download it.,1,11,2.0.1,2022-03-16 11:18:27,There is no such offer running on our app or website.,2022-03-16 11:40:28
43e04bb6-d54d-4e89-960d-49046b9d9284,Charan Cck,https://play-lh.googleusercontent.com/a-/ACB-R5QCnvys0zLXTSbme6jHFocdrE63TEM2P4y6LzKS,I can't signup .some issue in app after getting OTP app will keep on loading in same page,1,4,2.0.1,2022-03-15 17:50:31,,
9523346b-3739-4803-9fb8-4d0609476637,ok goodbye,https://play-lh.googleusercontent.com/a-/ACB-R5Steml4qTZhey65ox-lpSnA5K7Yasi0YSrMtm_Y6GQ,Fraudsters. After loading they changed offer on money load from 2% to 1%,1,0,,2022-03-15 02:00:05,,
b767a22a-fe4a-4ae6-8093-69844bfc4750,mc Gamer,https://play-lh.googleusercontent.com/a/AGNmyxYPAByrk0Ff7Qyh_8Vqi151jBPMkj5WXLJWqo0w=mo,I just need my ₹1056 rupees back i am not able to take that money it is delined i want my money back🥺 plz it's my 5 months pocket money,1,0,2.0.1,2022-03-14 22:39:28,,
4ea69633-7306-4afe-ad9f-c706b231fe31,Saif Shaikh,https://play-lh.googleusercontent.com/a/AGNmyxZVXTsm-ETUDF6SjA23M0jwr_46JTx1Q7d3QbO-=mo,Very bad app i dont install not worth if u pay for this card this card dont work fake junio app dont use this my money is stuck and my friends tooo useless app,1,0,2.0.1,2022-03-14 20:59:56,,
6274d77e-431e-46b6-a62a-0e81e5125818,Glenn Nazareth,https://play-lh.googleusercontent.com/a-/ACB-R5Tynu2n0Zn-_PgxviS6zyDhlw03B8k7thtzIiiTcw,I have given 1 star but this app is not worth to that also useless app . Don't give good service fake app don't invest for their card also card doesn't work your money will be stuck #fake junio team .,1,1,2.0.1,2022-03-14 20:54:45,,
e447e5a0-00bc-4b8d-828c-9669ffbeeae1,DRAGON KING,https://play-lh.googleusercontent.com/a-/ACB-R5TSPCcbpT_7u6DdNyzJ-kBOt3qyOd5sR6g5ZshJkg,This app is very bad because I am not getting my cvv whenever I try to get my cvv no. It can't open do anything. 🤬🤬,1,0,2.0.1,2022-03-14 12:36:21,,
993c6e51-9bb9-4080-99a1-ddae3430033b,Deepanshu Panday,https://play-lh.googleusercontent.com/a/AGNmyxY8QN7wiswvggHxCOBXnvanMh5pEeCw_fuFHJLWJQ=mo,"Very disappointed, it has been 4 months passed and they didn't dispatch the card. I contacted the coustomer care and they make apologies again and again but card didn't dispatched yet. They charged about 100rs for physical card and then no response.",1,0,1.3.5,2022-03-14 09:31:40,,
7138336c-ab59-4150-a7ee-70a3683a2fb5,Abhishek Kamath,https://play-lh.googleusercontent.com/a-/ACB-R5RDftomwZ1bl_egJZ0Ut2MovFjJBXlU0Fdtjf_aSA,My card details stuck at 99 % if restart app it again starts from 0 and stucks at 99%,1,0,2.0.1,2022-03-14 06:54:03,,
bc1ab916-be07-49d1-8686-5b6d30902d34,Priyanshu Jaiswal,https://play-lh.googleusercontent.com/a-/ACB-R5TwYNVL_mR_sHq_mKUucrXOWZr9MySY0The3x_Wcg,I am giving only one star because in this app there is payment issue . I had opened Amazon to but it's gift card but the card hasn't been accepted And other apps also Some apps are telling network issue Some are not doing anything....... In other children debit card apps all other apps are working properly,1,5,2.0.1,2022-03-13 18:35:12,,
6bac40c3-18fa-4f7b-9e9b-8af5e014d9af,Pritish Kumar Barik,https://play-lh.googleusercontent.com/a-/ACB-R5TrtehVXDAi3-SyJ-mT_1pVczR-V5pLphGP45GDhg,Not customer support,1,0,2.0.1,2022-03-13 14:14:28,,
3fc954f8-4c06-469a-a41e-1d1849606bec,Venky Venky,https://play-lh.googleusercontent.com/a/AGNmyxY9YWfAfXTPSWE06kNWD_mvm0CD9IymNAJ2VBVF=mo,"Worst app ever, they will block you without any reasons",1,0,2.0.1,2022-03-13 00:11:14,,
f3fd5f61-01f6-4f1f-9559-ebcca5b2cba4,Anuj Sahu,https://play-lh.googleusercontent.com/a-/ACB-R5Txkugw8aSd04hAmwH5X83kjccs6uQF7xQQ8Jwqsg,Worst app Not able to use my money which i added just 2 min before...,1,0,2.0.1,2022-03-11 16:18:29,,
23d9d7bd-e308-485c-9aec-68c4b197e831,Ajeet Yadav,https://play-lh.googleusercontent.com/a-/ACB-R5Tnicu2rCJB-ak6Xncm_ILAjBgDjvstVm-W4q8A,Customer support is bad because no reply from any customer support member and MY REQUEST TO DEVELOPER OF JUNIO CARD PLZ ARRANGE CUSTOMER CARE ( NO),1,1,2.0.1,2022-03-11 15:49:49,"We regret to note this. Please contact us via the help section with your contact details so that we can address your concern.
",2022-01-11 17:48:44
3cafd9a8-3118-4239-9b98-5244f3eac0d9,Divanshu Mangla,https://play-lh.googleusercontent.com/a/AGNmyxZXv10ZgcYQmNn_WOIwCD0rj5QCU2pl9bT5UarO=mo,It's not responsding,1,0,2.0.1,2022-03-11 15:28:52,,
701e48c4-fe0f-4009-b7c5-597eda5825df,Satish Maurya,https://play-lh.googleusercontent.com/a-/ACB-R5S0V972WgYnvtlWe-EEZBZ-z0wf5xZi2V2QyQms_Q,Online payment krne pr Card ka OTP nhi aa raha 😡,1,0,2.0.1,2022-03-11 13:25:34,,
c98811b1-1c6a-4add-9d4a-2f00971b4ee2,Devaki Devi,https://play-lh.googleusercontent.com/a/AGNmyxblI2yLbC5V-PJLoKcEXY6Es8ZysDF82n6Wknv7=mo,Customer care response is very bad Useless app,1,0,1.3.5,2022-03-11 12:56:08,,
a66c9f63-4a22-4896-893b-2e30a0d1c778,Rahul Kumar,https://play-lh.googleusercontent.com/a/AGNmyxbSnd3vSoagD_cNx74AUVF5sJy4bo9BYMD-foIC=mo,Cheetar app,1,1,,2022-03-11 10:04:37,,
81af690e-b8c8-4562-b0d4-f98bf0ffc361,Monoara Bibi,https://play-lh.googleusercontent.com/a/AGNmyxaUQG2sDqA5SbhJw8DBJeJZ1AadRIcdPVmDWNT2=mo,Not received my physical card,1,0,2.0.1,2022-03-10 02:14:57,,
6754332a-5645-4d73-b0b1-047c5009a91e,Vikash Gond,https://play-lh.googleusercontent.com/a/AGNmyxbBFr7vNszpPONGKZgPtgKcobzxpb4zNlTvYwRS=mo,Very bad service My registered mobile number not change After 42 days completed ...,1,0,,2022-03-09 17:43:44,,
5c665ab0-fea3-4e7c-ab38-22942cfa2ace,Humera Khatun,https://play-lh.googleusercontent.com/a-/ACB-R5SUmxOKcL3eNLVsKviykrm_sBfld4WtUqQcNzS_,Fake aap not working aap not customer service,1,0,2.0.1,2022-03-09 16:40:45,,
eea8bd1e-59cd-45b0-8ff5-e1e519b4d5e2,Nitin Kumar,https://play-lh.googleusercontent.com/a-/ACB-R5T6As2TsFdybkLQqa_i2EBMv6F58wax3Lih9DBP,worst i have ever seen cashback doesn't credited,1,0,2.0.1,2022-03-09 06:27:37,,
2a34594e-a906-402e-9585-c62743030cd6,sommya biswas,https://play-lh.googleusercontent.com/a-/ACB-R5Q3Hs3UKwT_t_Qm6LSq7geF74RpRLs0YW1Kcy0uPQ,3% cashback not received using on petrol pump swipe card don't know the reason resolve this,1,0,2.0.0,2022-03-08 11:07:40,,
8d3fec1a-023f-453f-9203-c57dfffe1a16,Geet Deep,https://play-lh.googleusercontent.com/a/AGNmyxbkMyCrcNFhoRVWgbw2BGEF_mGqhWxyh6cBty1P=mo,Money automatically deducted from kids card.,1,0,2.0.0,2022-03-08 00:48:27,"Hey Geet! This should not have happened, in order to debug the issue may we please request you to reach out to us via the Help section of the app? We need your number to investigate this further.",2022-03-08 13:49:27
214ae97d-b8df-477d-9af3-6668d1651e61,Vishnu Ravilla,https://play-lh.googleusercontent.com/a-/ACB-R5TfL0gBRw-bcsEZ3sdFy8Lf4PFb_9918-MUF7XE,"Great app, very useful and easy to use. Would reccomend everyone teens use it.",1,0,1.0.21,2022-03-07 22:52:06,,
f9060a38-238a-49b9-8b27-eb1005f6b698,ASHISH DIXIT,https://play-lh.googleusercontent.com/a-/ACB-R5QGS_5N_KyOSLh9UWl94-GAl2QpLwmpLKdX_He_XA,Useless app still showing request in process for id verification.,1,0,2.0.0,2022-03-07 12:55:17,,
c1e2d3d0-fcba-46b1-b7b3-1f6e4be08064,Sonu Raaz,https://play-lh.googleusercontent.com/a-/ACB-R5QemYXOdASO7KCptlIk18kgRpY226XM5LZZSchEHw,It's a fraud application. firstly it gives me 2%percent cashback in scratch card form after spending Rs9800 then it automatically reverse that cashback and not credited to my junio account,1,0,2.0.0,2022-03-06 23:31:27,Our terms and conditions clearly state that cashback will not be given for any misuse of the cashback offer. Our system noticed that you created multiple Junio accounts to misuse UPI cashback offers. That's why your account has been blocked for that offer. Thank you for your understanding.,2022-03-07 00:01:54
eee34d48-a8bc-454e-b44b-03c216135780,All Work,https://play-lh.googleusercontent.com/a-/ACB-R5S-WnLELw1X6-jDlguduGpZmAAsQazZ2RmAca7UcQ,Bad,1,0,2.0.0,2022-03-06 17:08:29,,
68425b3f-4070-43f1-be7f-d1df04d8893c,Earning trick,https://play-lh.googleusercontent.com/a-/ACB-R5TZOCNnvNsOZrb19ojsNoq0yIZWOoXU1JHQ1M9E7Q,Why my card not working many times card declined,1,1,2.0.0,2022-03-06 15:15:30,"Hi, please contact us via the help section to have your issue resolved.
",2022-03-03 19:59:02
1262fbf9-a3d9-4fd5-bbbd-20099c9dcf49,Nur Muhammod Abed Barbhuiya,https://play-lh.googleusercontent.com/a-/ACB-R5RRvs9PbvyRa6gYjI05TKQ1XUMJHtDIDLBIMo1T,"Having difficulties in spending money, i added to my card.",1,0,2.0.0,2022-03-06 14:57:35,,
542df3fc-5c89-418d-b45d-f0d35bda4df7,Swarnwanshi Ji,https://play-lh.googleusercontent.com/a-/ACB-R5QQHT6seAync95SqMNdbhAzX_FVYDoR1ZlJXw3gXIc,Please increase transaction limit as soon as possible 😤😤😤😤,1,0,2.0.0,2022-03-06 14:13:59,,
fdec4e5d-127e-40f3-935a-4d5d60cb39ce,shubham kumar,https://play-lh.googleusercontent.com/a/AGNmyxYVvFdgEr7JpV-uZxujiWq-RjOCBvaH7RuBKn6x=mo,Very bad customer service.,1,0,2.0.0,2022-03-05 21:45:40,,
feacfde0-0453-4642-ba4b-5c95a1d339e9,Shovandev Bhunia.,https://play-lh.googleusercontent.com/a-/ACB-R5QK7rUmVFz4_fLj3kECtILvhrOLkaIvl330_jx5uQ,Too much bad application..I can't withdraw my added money.. it is not acceptable 🥲 🤮,1,0,2.0.0,2022-03-05 18:29:46,,
bbc7f8bb-30f8-4144-a3c2-0d445c5b161a,FarHan BhAt,https://play-lh.googleusercontent.com/a-/ACB-R5TMlkwAqi56kS8gebKA4TAE7YEZxwOSGexHgUJtsA,fake app taking back cashbacks after crediting fake skretch cards.,1,0,2.0.0,2022-03-05 14:29:57,Our terms and conditions clearly state that cashback will not be given for any misuse of the cashback offer.  Our system noticed that you created multiple Junio accounts to misuse UPI cashback offers.  That's why your account has been blocked for that offer.  Thank you for your understanding.,2022-03-05 15:00:27
90080fc7-0cfe-445b-a231-173dd9b586e7,Arpit Jaiswal,https://play-lh.googleusercontent.com/a-/ACB-R5Q5uHD5BWRDNQE-2FHPtAaHYypbkzDF5cMbbcvsSA,"Wortst experience , customer care response time is very late even it take 2-3 days to get reply , app is getting worst day by day 😑, in every add money trangestion there is always some issues money get stuck for 1 week , some time you can't even add main balance to child card , then what is the use of every time there is some issue you can't spend your own money , totally disappointed use less app , don't install it you will suffer from many trangestion fail😐😐",1,32,2.0.0,2022-03-05 13:21:57,,
59550849-bc89-4e7c-98f6-0938a7808876,Sudipto Mondal,https://play-lh.googleusercontent.com/a-/ACB-R5SdRv1bjEto-GSvQXoHtL2P15SKU0PZHDpjYgd4IQ,I am not able to use my prepaid card... Disgusting without my knowledge how can you block that card...Worst service,1,1,2.0.0,2022-03-05 12:01:40,,
585586b5-ba33-4e4e-a55c-ad083043c2ea,Singh Pankaj,https://play-lh.googleusercontent.com/a-/ACB-R5Suekbjwt7vivwIzngvfBOSz5V08PD1D_ZF_Zk,Cashback not credited of upi load money.,1,1,,2022-03-04 18:33:06,,
1a0d1d22-d99a-4ee5-80f5-6b7fc241bb5f,Chelu,https://play-lh.googleusercontent.com/a-/ACB-R5RrSTyX2QnffBrTB66FOg3jJgKq55ZTUxLgPDIKTkk,Half baked product...stay away. Akudo is far far better. My card is yet to be delivered and its almost a month since I ordered it. Please don't ask me to reach you via your help section...worst customer support replaying at their leisure.,1,14,2.0.0,2022-03-04 15:41:31,"HI RC! We apologise for this inexplicable delay. We need more details of your account, so we can quickly check. Pls ping us once. Thank You.",2022-03-04 15:50:38
4b642d30-553c-491b-a29f-e9ad4b2b023b,Ankit Kumar Ghosh,https://play-lh.googleusercontent.com/a/AGNmyxZ5EMPKJY6UZVew9PeY1K4RjGUjckmo5n-p2YIkzkA=mo,can't add money...worst app ever.. is it the service u want to give your user?shame of you,1,1,2.0.0,2022-03-04 15:30:04,,
408311d6-d499-4ac5-bfca-5bbef8e88a36,SUNIL PATEL,https://play-lh.googleusercontent.com/a-/ACB-R5TDJKtYsJDsYoW7cZFRBw_QApWdZurN9YNpbscCMQ,Not good,1,0,2.0.0,2022-03-04 09:35:22,"Hi Sunil, we discussed the issue with you. Since you created multiple Junio accounts, the system raised an alarm. We guided you on how to rectify it. We hope you are happy with the resolution given! Cheers.",2022-03-04 10:55:44
5e6a5c97-1e7f-4a3d-9c2c-78b3518dc675,Raja Sekar,https://play-lh.googleusercontent.com/a-/ACB-R5Sr5ohvfalb8px0VSpx8hQTxk6G_3GpFuMZhP7RhA,Nice app. But after some days they are start reducing their cashbacks into lower. That's not fair .,1,15,1.3.5,2022-03-04 08:32:52,HI Raja! Feedback acknowledged. We would really love to have a chat with you. We earnestly request you please ping us via the Help section of the app. Thank You.,2022-03-04 10:59:47
0c606fbc-87a6-44a5-8cfb-ea2968492881,Jaydeep Limbad,https://play-lh.googleusercontent.com/a-/ACB-R5TSAWiLVKcYy4pQf8t4WZ_GueMcnVIpvP8kBkoIhw,Third class staff and service I am giving rating -10 Unable to load money in account. Application help section service is third class. Nonsense people in Junio. My issue pending from October 2021 and it is yet not resolving.,1,2,1.3.5,2022-03-03 23:10:24,"Hi, can you please re-check and confirm if the issue still remains the same? If yes then please contact us via the help section so that we can address your concern.
",2022-01-25 18:19:53
24b7e170-83db-497e-ba30-3bac77066ead,Ansh Kumat,https://play-lh.googleusercontent.com/a/AGNmyxaeC6b5lj4oLytkE4Qe_02Ky9zI0giPKt-spszZ=mo,Don't take any junior card my money has gone and I have not get my car also IT Act in very bad I have to 2 week I have not get card,1,0,2.0.0,2022-03-03 19:56:53,"HI Ansh! We sincerely apologise for this experience. We request you to please reach out to us via the Help section of the app, so that we can call you and fix the issue ASAP. We value your feedback and promise to do better.",2022-03-04 10:32:39
75db7292-375c-4e3b-a147-a5632a6162cd,San Editz,https://play-lh.googleusercontent.com/a/AGNmyxarReV0fOK4gBGakiGOoW5ngG9KbTrXBTrbcqFA=mo,Wrost app ever I seen in my life,1,0,2.0.0,2022-03-03 15:11:37,We regret the bad experience. This is not what you signed up for. Can you please elaborate on your concern so that we can assist you better? Please contact us via the Help section of the app. We will check the issue & revert to you as soon as possible. Thank You.,2022-03-03 17:16:41
46d4e25c-025c-435f-b725-163e9bd3c87f,Ram Biswas,https://play-lh.googleusercontent.com/a/AGNmyxbRnnAY96aFYYlPrHkMDVEPZ5BbfkUCPlWmV9LL=mo,Cashback not received,1,0,,2022-03-03 10:14:15,,
cb7176d0-5484-4082-b40d-ac7e592a997e,Dhirendra “Royal” Kumar,https://play-lh.googleusercontent.com/a/AGNmyxZvtBIMwlp9v9bJPhf2erkh9DlmpDRP5p9iMsq4Yg=mo,Very bad Application.and After adding money you will get a lot of problem to login and spend your own money. and also card is not delivered soon and delivery is suspensive. What i face my personal experience in the aap.,1,16,2.0.0,2022-03-03 05:54:14,,
a2ee17df-0426-4c72-8d55-1f2a74dfc151,raj deep,https://play-lh.googleusercontent.com/a/AGNmyxaFQbTb-lYWltFJ6PzaWTpOYqPLfluiRUMBDrDaOQ=mo,Worst and bad sevice cashback not issued and cheeter.,1,1,2.0.0,2022-03-02 22:45:51,"Hi, cashback has been processed as per the terms and condition of offer. You can reach us via Help section in Junio App for declined transactions with screenshots and more details. Thank You.",2021-10-25 13:59:27
6aa9d2ae-489b-41d9-af0d-157bc7a4dbce,Rajeev,https://play-lh.googleusercontent.com/a-/ACB-R5Ro9K3tuFfHztKQLoxTAYNxFcjR8Ub3PAm80QwYBg,After the latest update the app became slower than a Microorganism,1,1,,2022-03-02 21:01:57,HI Igris! We are very sorry to hear this. Possible for you to reach out to us via the help section of the app so that we can reach out to you directly?,2022-03-03 19:32:53
43286712-39c4-4a95-a85e-b85f30083dd6,Ashok Meharda,https://play-lh.googleusercontent.com/a-/ACB-R5RvTtVASLmQfJ6sQSL-Qmsap44QaRiuytFVOsHf,App not working properly. Not responding after putting otp. App. No accessible.,1,2,2.0.0,2022-03-02 18:49:26,,
bc37f0d5-5581-4683-b2a1-855f61d47c30,Prince kumar,https://play-lh.googleusercontent.com/a-/ACB-R5R4T7bY5yCdno-5pPv_y9lHuXHJ1qMDbx2AIascaQ,It is very wrost app It no any contumer care no It transcation is very slow,1,1,1.3.5,2022-03-02 18:22:07,HI Prince! We tried calling you multiple times. We are very sorry if you had a bad experience with us. Please tell us what is the exact issue. We will be happy to help. Kindly reach out to us via the help section of app so that we can assist you better! Thank You.,2022-03-03 19:05:35
a2cfd864-35a6-40a9-9456-86d3fc7b845c,Manoj Senapati,https://play-lh.googleusercontent.com/a/AGNmyxauH5cMDgEWd26VQnZBAcGhdIWam3bWeOpy6x-M=mo,Bad....very bad,1,1,1.3.3,2022-03-02 14:43:14,Please update your app to latest app version and share your concern.,2022-03-02 14:46:32
446e597f-11aa-47b6-9d43-c54780e421ba,Puneet Gupta,https://play-lh.googleusercontent.com/a-/ACB-R5SHS4g39m9PDl2IXBb6QkjGTJtj7Q42K4hxUTRk,Not good experience,1,0,,2022-03-01 00:18:11,"Hi, can you elaborate on your concern so that we can assist you better? Please contact us via the Help section.
",2022-03-03 19:25:47
ff30dc9d-e6d1-4385-92df-8260cb281d6c,Dhingu Bhau,https://play-lh.googleusercontent.com/a/AGNmyxastxs6xwyv7Z0AKsGrUz019MchtvYZta0MnqqO=mo,Fake app I don't get money,1,1,,2022-02-27 19:39:22,,
5136854d-d922-46c6-8494-f3570a9a8c9c,RoleX,https://play-lh.googleusercontent.com/a-/ACB-R5Q9HGLhpNm4HLVTolOVftyEKjT-383lQSHzDDKhRg,Froud app don't trust,1,1,1.3.5,2022-02-27 14:32:29,,
e6d0eb76-6cfc-4e9d-b20c-c4769f74e5fa,Mohammad Imran,https://play-lh.googleusercontent.com/a/AGNmyxaSV-aMRJZmDVDlSlVwo3JL0eQFbL6kE_ipgKYd=mo,When I was login the account says technical issues I was not login in any app when I was login in phone pay app they are not show that app so please fix this problem so I can add this junio card in phone pay app,1,1,,2022-02-27 13:36:07,,
68e86b93-b058-4e0a-bb79-74b66aca802c,Kunnal Patel,https://play-lh.googleusercontent.com/a-/ACB-R5QsUivaEfFni8C7HB0GhuveLSSSK9Wbe3_-5OzH,"This card was good in starting, but now it's worst card to use, they are just giving excuses for not crediting cashback first they'll ask for transaction proof if given they will say misuse of offers we will not credit your cashback.. So watch out guys also their support team is of no use.. Please dont promote fake offers if you'll don't want to give cashback.",1,1,,2022-02-27 12:23:03,,
7a2b1aa3-4c4c-4aa1-a4d3-afa3b5eacb26,CREATIVE SANSKAR,https://play-lh.googleusercontent.com/a-/ACB-R5RSBrzG4i0IiyAMTebx-1K609xhRCnm7lDB5cUHSw,I have order the card but I don't have receive any tracking number or card and I pay 99rs. Worst app I post this massage after the order 15-20 days,1,1,1.2.2,2022-02-27 11:22:25,,
6d5097a4-b2a1-4ce5-bf56-1585fc7bad5e,Iqbal Raza,https://play-lh.googleusercontent.com/a-/ACB-R5QkjNhxk4qUSKMtA6ZbZPuUbS3NbhgHHHj0sUCI,Nice aap,1,0,1.3.5,2022-02-26 16:06:03,,
386b709e-1680-4925-9248-d5020088685c,SHAHID PATHAN,https://play-lh.googleusercontent.com/a-/ACB-R5TkRw3_Ohge6nYfx6eh8_TAUX5xxPiusQj-ucle,I want to scan and pay the app is good but there is no option for scanning directly to the seller or their is no option for withdraw the money 😕,1,2,1.3.5,2022-02-26 15:56:04,,
74b9022f-e782-4457-a9ac-1f6a84e31706,Cuban Curvy,https://play-lh.googleusercontent.com/a/AGNmyxY2X15_ZeSPSlCaR6DNnphWkbWz7j8gxVXVKatj=mo,This is the fake app Don't by debit card I pay money but didn't come debit fake fake,1,1,1.3.3,2022-02-26 06:34:24,,
2fbe7a2c-6b2e-4566-a391-3dad07507911,farhan Mukhtar,https://play-lh.googleusercontent.com/a-/ACB-R5TFkXB1vzrk9T01EaQCEPX-WNvKXsq6Kxb9wK6jpw,Plz don't download this aap,1,1,1.3.5,2022-02-26 00:09:50,,
27df918c-c954-41ad-b266-e7ac61283589,Vikash Sahu,https://play-lh.googleusercontent.com/a/AGNmyxbYDfuSi7uXWAzEROSUosgFwayklgNTv9ZyhSQO=mo,I will say once you will never received any cashback adding money .. they will not give you any cashback they when it comes to support section it replies hardly .. 9-10 hours .. they will say you are misusing it... Worst service app ever,1,20,1.3.5,2022-02-25 22:43:10,,
4ed1a005-01a5-4207-9e01-7343d2503110,shekh ajas,https://play-lh.googleusercontent.com/a-/ACB-R5Q38LCe4C-Vj91scLHPS4MmJwm4SdgAhcblQL2L,Not able to card anywhere as the card transcation is failed,1,1,1.3.5,2022-02-25 17:58:19,,
8bf065a2-1189-4f18-97a9-d97dd7b66ef3,Kajal Kumari,https://play-lh.googleusercontent.com/a/AGNmyxY1VLxCW-hQxFR2Y7Je9L6W09sXy7cE7XnH2Avanw=mo,Very bad,1,0,1.3.5,2022-02-25 17:26:45,,
9f13b3b0-2e4a-44f7-8de2-5aa2b4d14ce0,143 - Rushabh Sindhav,https://play-lh.googleusercontent.com/a-/ACB-R5RlrHQhy5t55t2gCI5Og0LehGC-b6Jr3KcvOqUMJA,Everytime Surcharge Deducted and Offers Is 10% Cashback at DMART but card is not working there It shows Restriction Error In POS Dont Take this Card Customer Care is Worst No one Replies Properly and,1,1,1.3.5,2022-02-25 14:06:14,,
d83ae15c-9c35-4787-9808-cff694604ec9,Lavanshu garg,https://play-lh.googleusercontent.com/a/AGNmyxZ8RCbdYla6JTJDnsGvY5tl05ggqjl9yVSh3twE=mo,Worst app please dont download it .,1,0,1.3.5,2022-02-24 19:48:48,"Hi, can you elaborate on your concern so that we can assist you better? Please contact us via the Help section.
",2022-02-28 20:00:36
d0cf6326-d0d3-4ffd-bb5a-489bc2e73feb,Bharat Rathod,https://play-lh.googleusercontent.com/a-/ACB-R5RDs5TOinS5V2OzPyhCQznmIuMgCeTq9EvO5pg5,Can i Believe On Your App Please Tell Me.,1,0,,2022-02-24 19:01:51,,
b1c5c720-9308-4d63-b819-47aca29ee09b,Manish Gupta,https://play-lh.googleusercontent.com/a/AGNmyxZJ-vF_EH8dHGeLRAiGjiAJJ2tXiOnpRrkxQqJH2A=mo,I tried adding money through UPI.Money got deducted from bank but was not added in card.Also help option is also not working.horrible experience.,1,0,,2022-02-24 17:57:17,"Hi, can you please re-check and confirm if the issue remains the same? If yes, please contact us via the help section to address your concern.
",2022-02-28 20:01:10
e83723bc-69e1-471a-845b-6c40a6078a80,Bharat Pathak,https://play-lh.googleusercontent.com/a/AGNmyxbYcbaXo9aJQaYX56-qV4MoZuBa2eH1VAEwNj6J=mo,Very bad customer service,1,0,1.3.5,2022-02-24 10:46:19,"Hi, can you elaborate on your concern so that we can assist you better? Please contact us via the Help section.
",2022-02-28 20:01:31
17c05820-59a4-43a9-a7e7-42f0b0610a75,Virus King,https://play-lh.googleusercontent.com/a/AGNmyxZUtxWWCogMAzoZX4CV-opVniB3pR1Ngx5IF5cF=mo,"Now a days it's support became worst of its kind,guyz don't fall in offers and promotions,they are not adequate upto credit line,no hesitation about in app promotion time bound in relationship with offers to credit.Bad experience",1,9,1.3.5,2022-02-23 22:23:43,,
db7dd32d-0b0c-4bb2-a72a-bf802bf36d90,vijay yadav,https://play-lh.googleusercontent.com/a-/ACB-R5QFc9cBgrwQyVNEq_arsG2NAqF9SfZJdOWqZ9MrNg,Cashback nhi de rhe mera 1 month se complaint likha rha hu cashback credit nhi kr rhe ye log . Help lo to boltey h is weekend next weekend or hota kuch nhi,1,0,1.3.5,2022-02-23 19:22:20,"We regret to note this. Please contact us via the help section so that we can address your concern.
",2022-02-23 19:01:17
44c1c461-d3de-41d1-9077-c123927dbb2b,PRADEEP KUMAR,https://play-lh.googleusercontent.com/a/AGNmyxY6-DQoflZ01pzE1xvta_MqLP4YOdjOhFA9oWN9=mo,App is good but support is not good bahut hi ghtiya unless member in compny,1,0,1.3.5,2022-02-23 09:18:04,,
dc7774f2-760e-48b7-a9a4-3030bdc5f2ae,Gunjesh Sinha,https://play-lh.googleusercontent.com/a/AGNmyxbME0GzYj4tM1YUUSBQKE_3BCuzABWLc1J-RN3T=mo,Recharge ka option do yar,1,0,1.3.5,2022-02-23 08:09:19,,
9b8ab46a-a9ff-4669-86ac-d165e48b82ac,carry minati,https://play-lh.googleusercontent.com/a/AGNmyxZ6wwl8to90h43GssfTWF0RVxFC_oBTXVru711S=mo,app is great but I didn't got my refund please 😭 help me asap,1,0,1.3.5,2022-02-22 22:56:38,"Hi, please contact us via the help section to have your issue resolved.
",2022-02-23 15:50:31
6e8a3ab7-914d-4c1d-b85b-77da836efc16,WORLD VIRUS,https://play-lh.googleusercontent.com/a/AGNmyxbo65CXzozCFh7DcbL4E3DuBVKZ8Y0TJvYcycDB=mo,Didn't gave me Upi cashback I added 942 rupess it showed that .... Will get 2 % cashback back,1,0,,2022-02-22 14:37:13,"Hi, can you please re-check and confirm if the issue remains the same? If yes, please contact us via the help section to address your concern.
",2022-02-23 15:42:42
599406f6-324b-41bb-aeaa-8f695dddeb97,Soleman Hoque,https://play-lh.googleusercontent.com/a-/ACB-R5QjutRRoLAUE2UosgPTJ5C1_yyRIuyaAIxgXRYI9Q,Saddddddddddddddddddddddddd appp,1,0,,2022-02-22 01:05:33,"Hi, can you elaborate your concern so that we can assist you better? Please contact us via the Help section.
",2022-02-23 15:37:49
b924178c-6f52-44c0-94cc-412b2fc230ef,Online Shopping,https://play-lh.googleusercontent.com/a/AGNmyxbt2VTaAdlBP95pLbr17oixMy4pRq_uWxSTBb4y=mo,I want refund,1,0,1.3.5,2022-02-21 16:39:55,"Hi, can you elaborate on your concern so that we can assist you better? Please contact us via the Help section.
",2022-02-23 15:50:50
