reviewId,userName,userImage,content,score,thumbsUpCount,reviewCreatedVersion,at,replyContent,repliedAt
93020fc2-6be9-4f69-9913-7cf15b960e82,Vinod Kumar,https://play-lh.googleusercontent.com/a-/ACB-R5SNUIlM6xKCUKsS_YPcVna-t9Uj1ZoPS1jwq6zYOg,Fampay is better than u,1,0,2.0.6,2022-11-08 08:42:27,"Hey Vinod, do let us know in case you need any assistance! Cheers!",2022-11-08 12:29:37
9cca42c6-2b40-4027-97be-e25843755651,Travel Shots,https://play-lh.googleusercontent.com/a-/ACB-R5SYrz3IsYWIIfaTpMawZmLsIKc71Z1h-sV0Yn1u,All time showing card printing...card printing😂😂😂🤣,1,0,2.0.6,2022-11-07 22:16:47,"Hey, we will need your mobile number to check the exact status. We request you to please reach out to us the via the help section of the app Thanks",2022-11-08 17:39:10
231d4f78-6436-4ca3-a6e9-189275551ddf,Sambath Kumar,https://play-lh.googleusercontent.com/a-/ACB-R5SzWE8jc11HLtwv5XehOXWxLqhgbwxu1iAa_1aOdw,Tatally fraud app dont installed 3500 money credting for pending in 4 days 😡😡dont installed really cheating app,1,0,2.0.6,2022-11-07 09:30:35,"Hey Sambath, we could not find any transaction of Rs.3500. We request you to please reach out to us via the help section of the app, so that we can re-verify. Thanks",2022-11-07 11:12:42
ad10cf12-857e-42ab-8a36-51ed302d8f01,mohd ahmed,https://play-lh.googleusercontent.com/a-/ACB-R5R0OHzxIRleHv8G0HKt3b_IY1TOr-24jVHIsajsDA,Sir please give me scan any QR code / recharge any phone please,1,0,2.0.6,2022-11-06 13:46:08,"HI, thank you so much for your feedback.",2022-11-07 11:17:36
339db3b7-1013-4ce1-b624-2753c8339e42,Bharath Enugula,https://play-lh.googleusercontent.com/a-/ACB-R5Qh8MTc7XzrtG07Dqb8ISECquZmQ_qYCXHAPtDd7w,Wrost app i have seen ever I ordered card still it is saying cerd is submitted for printing,1,0,2.0.6,2022-11-06 11:15:23,"HI Bharath, you ordered card on 2nd Nov. Please expect the card delivery within 12-14 working days. Thanks.",2022-11-07 11:19:45
c7610cb5-c93d-41b2-a07a-1ac61d0ce11f,Rofiqul Islam,https://play-lh.googleusercontent.com/a-/ACB-R5RaNBpxutLHpVlY14imxxuxAzvSdlrkG87NLdGSiA,Worst app in the world. I can't make any payment. I have ordered junio card but is is saying that the card is being printed for more than 1 month.,1,0,,2022-11-06 08:53:25,"Hi Rofiqul, we are eager to assist you. We need your phone number to check the exact status. Could you please reach out to us via the help section of app the app? Thanks",2022-11-07 11:51:26
a5b9bb33-3a78-4994-9c38-4f45169c5bb6,Rohan Mandal,https://play-lh.googleusercontent.com/a-/ACB-R5SDOQMOz_6_w_1qBHcWp_KK6k-L7veH_18du1JDjg,Worst app . For security reasons if someone has sent you money it won't be credited instantly . It will take 3 days . My 3500 rupees is pending from 2 days . After using this money surely i will delete this app and will suggest everyone not to ise it .,1,0,,2022-11-05 11:17:08,"Hi Rohan, certain checks are implemented to keep user's money safe basis the feedback received. Thanks.",2022-11-07 11:44:49
777c5ab8-f1ba-4f69-a20a-7a47573c46c5,Makib Gamer Dj,https://play-lh.googleusercontent.com/a-/ACB-R5TTAusynTbWhOrrCzH09ZlFJmTs9ptIyxNKCWDwgg,The app is very fake app because not Bank transfer option.....,1,0,2.0.6,2022-11-04 19:14:59,"Hi Makib, please be rest assured, this is not a fake app. This is a pocket money app for children, with which they can do online and offline transactions using their own personal card.",2022-11-05 13:10:56
cc876422-8862-4292-a713-43d71f9f84a8,SKYSTAR 76,https://play-lh.googleusercontent.com/a-/ACB-R5SWK0ws1UybjVSvcdgr7fT2_diDeWXHq5voqU8NZA,If you want to get scammed so come in this app I installed this app 2-3 months ago and there was a offer to oder Junio card in just 1₹ rupees and than i ordered the card and today is 4 November And Still not get my junio card Damn this app 🤬,1,0,2.0.6,2022-11-04 08:26:29,"Hey Skystar! In order to check the status of your card, we need your mobile number. Request you to please reach out to us via the help section of the app. Thanks.",2022-11-04 11:40:51
04489cde-e031-4888-b6e5-cfd4dc2c89be,Dhaval Rabare,https://play-lh.googleusercontent.com/a/AGNmyxaWo4--Po8-SfTbw2h4xpmCLl63H1Hc1Iw9GRo=mo,It's are good but he have no scan and pay option,1,0,2.0.6,2022-11-03 13:35:50,"Hey Dhaval! Thank you for your feedback, yes we are working on the feature. We will update you soon!",2022-11-03 14:53:17
32e3fd94-e372-42ee-aa5b-2514957f624c,krishna sarkar,https://play-lh.googleusercontent.com/a/AGNmyxbqfREADLkvEirRtD1Z2DNuK3PXC2lPZf2P28Du=mo,Pathetic Third class app. otp not coming when you paying online. i face this problem almost everyday.,1,0,,2022-11-03 11:30:39,"Hey Krishna, we need your number to get this checked on priority. Could you please reach out to us via the help section of the app? Thanks.",2022-11-03 11:59:26
848ee720-81c1-4f55-8f67-2350d79ded88,R.K. Maurya1811,https://play-lh.googleusercontent.com/a-/ACB-R5REyEPmRBnApK77wX1wynkL6YEicF12aAik-rVMrQ,It's card very bad and not work any ATM And never any payment for junio app total fake,1,0,2.0.6,2022-11-01 17:53:53,Hi RK Maurya! We are very eager to assist you. We need your mobile number to address your concern. We request you please reach out to us via the help section of the app. P.S: Currently the card does not work on ATM. It is for online and offline spends.,2022-11-02 16:25:50
16e954eb-519f-4520-a69f-ec679d47e8b9,END GAMERS,https://play-lh.googleusercontent.com/a-/ACB-R5SoOEdBJoOoiiu0MyXRE6P1lfm7NBCXDKPJy88IpA,Dont downloda this,1,0,2.0.6,2022-10-30 14:58:33,"Hi, we are very eager to assist you. Please reach out to us via the help section of the app so that we can understand the probable issue.",2022-10-31 13:56:41
47b7d12a-5fb5-4d08-be3b-ff9dba5e135a,praveen kumar ks,https://play-lh.googleusercontent.com/a-/ACB-R5Rmc5LWBYXhLFXX29Upcfwqb-nc2Iap9oiOwtSwDJA,Card not working,1,0,2.0.5,2022-10-30 01:15:48,"Hey Praveen, we will need your phone number to get this checked. Could you please reach out to us via the help section of the app? Thanks.",2022-10-31 11:40:43
f296fcf3-92d7-4546-9751-e6c8a0f2db5e,vimal sb,https://play-lh.googleusercontent.com/a-/ACB-R5RgY6kVhUms-YV9mqAQ_4m9BKru3JSEJJu4uvSVxQ,Flipkart purchase order cancelled but money deducted from my account and still not getting any refund and no response,1,0,2.0.6,2022-10-29 12:48:21,"Hi Vimal, we checked your query and the response given by our customer support team. As mentioned- Refund once initiated by the Merchant takes 7 working days to get credited to the Junio Account.",2022-10-29 20:26:16
978268a9-b2d7-4db2-8f54-dd0920648e05,Nikit Chavan,https://play-lh.googleusercontent.com/a-/ACB-R5RjZIJVPcMNkbi0WQC_CGH7xvHNn8athKibpj3o,This app have bad customer service,1,0,,2022-10-28 20:45:44,"Hi Nikit, we could not find any support query raised by you. In order to understand your issue better, we will need your phone number. Could you please reach out to us via the help section of the app? Thanks.",2022-10-29 09:58:04
48c7119a-5934-427a-a294-712e5c5659e4,Shashank Hadapad,https://play-lh.googleusercontent.com/a/AGNmyxb_XCE8I0ToSDvQrx8wI6YUCOpnnRp66WRB9FU0=mo,Useless app don't waste your data on this app,1,0,2.0.6,2022-10-28 09:27:05,"Hi Shashank, we are very eager to understand the issue you might be facing. For this, we need your mobile number. Can we please request you to reach out to us via the help section of the app? Thanks.",2022-10-28 11:50:05
b0fdcf59-c5a9-497f-b2ba-7c70038039be,V S Sooraj,https://play-lh.googleusercontent.com/a-/ACB-R5Qhy8X1UHv2NNoS_1hh4SF8JDb8FsSbizbCJhfJXSs,Very bad,1,0,2.0.6,2022-10-27 22:38:30,"Hey Sooraj! We are very eager to understand the issue you might be facing. For this, we need your mobile number. Can we please request you reach out to us via the help section of the app? Thanks",2022-10-28 11:53:27
5a46b858-8fcc-4d3b-8996-f80e2064f5e0,Ashique Mohammad,https://play-lh.googleusercontent.com/a/AGNmyxY_PH28MTIlje2cUoIIAxmDr_gX_IFhgsVEEhmT=mo,"Worst app I've ever seen, don't download guys...i ordered my card, it has been one month, i didn't get my card... it's too risky to transition through this app...",1,1,,2022-10-27 18:14:33,"HI, we are very sorry to hear this, we will need your number to check the exact status of your card. Could you please reach out to us via the help section of the app? Thanks.",2022-10-27 18:19:29
0d6c5658-70a8-49a1-973a-eb212d2713c0,Arif Mohammed Choudhury,https://play-lh.googleusercontent.com/a-/ACB-R5TI6lUnAYmGxMTCaBKLjlACjb7kypDmc0QAI1LWSA,Bad experience,1,0,2.0.6,2022-10-26 19:46:14,Hi Arif! We called you but you were not available. We are very keen to understand the key issue. We are eagerly awaiting for your input. Thanks.,2022-10-27 12:17:10
6571bee3-06a9-407b-a9c1-5f64c8121577,Chirag Mehta,https://play-lh.googleusercontent.com/a-/ACB-R5TLrSWyVbK2JxSY15ORxjP76QL8wAw0LJShrYwb,My money is not get back,1,0,2.0.6,2022-10-23 11:19:46,"Hi Chirag, our partnership with the existing partner has ended. Please login in the app, and follow the instructions. Let us know, if there is any confusion while completing the steps. We will be happy to assist you. Your existing balance will be refunded.",2022-10-27 13:13:22
cba4af75-8f92-42e5-93a3-e876d5e640e8,Sushree Sulagna,https://play-lh.googleusercontent.com/a-/ACB-R5R6VV0MBWWjJuG_iZSaKF3kvPeGg57nD3ehuwRozg,Not a good app for online payments and lossed ₹50,1,0,,2022-10-22 13:32:27,"Hey! We tried calling you. Rs.50 is in your Junio account balance. Please reach out to us via the help section of the app in case there is any confusion, we will be happy to assist you.",2022-10-27 13:47:09
1e42f3c5-e5fc-468c-b836-9ec9b502ed35,Ashwin Gautam,https://play-lh.googleusercontent.com/a/AGNmyxYF0mY1xAT3LuQrPPccFuadn6fF6YfqDj-wDzx8=mo,Please enable atm withdrawal,1,0,2.0.6,2022-10-19 17:33:59,,
52a710d7-f920-4b52-ab42-3a0b912be251,Shivam Kasaudhana,https://play-lh.googleusercontent.com/a-/ACB-R5Q-MCK8NTSqgMGqItanYsRdy8zI8Lfc9RMmPZJVAw,Card Delevery Service Very Slow,1,0,2.0.6,2022-10-16 20:20:42,,
899d8cdb-e0e3-4aeb-85f8-e93d51dbdc96,KARTIK SHARMA,https://play-lh.googleusercontent.com/a-/ACB-R5T4AZ1eZMuWqHxrxSKHlsni_KJ20u6hh_z_R7QQ,Bad app i have added 500 rupees and then the app suddenly shut down and not loading again showing some error,1,0,,2022-10-16 11:34:01,"Hey Kartik, pls do not worry. Our system is getting upgraded. Please check in a few minutes.",2022-10-16 11:46:42
a45eae35-6433-4805-bdfe-bc22240167ae,Ashok bania Clinic,https://play-lh.googleusercontent.com/a-/ACB-R5SYnrGzi8mbSAsM3SGtvQmKel7OKLfWPa2SLNfO1g,I don't know much about this app but my parents don't allow me there documents. They tell me that it is a fake app and it will cheat us through our bank withdrawl. I don't know what to tell my parents but however I have to listen to my parents whether they are right or wrong,1,0,,2022-10-15 23:51:50,,
da4f3bdf-bb3e-4100-9834-35c32515ab9f,Ravi Verma,https://play-lh.googleusercontent.com/a/AGNmyxYi3tBgeogKA6LeIp1ZYWGSYxGhyJOIIGr3P6Mm=mo,Plz provides atm service,1,0,2.0.6,2022-10-13 09:25:14,,
274473ec-c06f-4851-b146-41a9c002ff09,manoj kumar,https://play-lh.googleusercontent.com/a/AGNmyxZwUP96yqYP1xN_xIxNdwWznSBdGMWlJX7n0er0=mo,Card balance lapsed!!! Not showing any balance !! Fraud bank . Dont open account and dwposite the money its fraud cant use the card ..!! Card blocked and no way to get money back .its scam dont trust .please mail to RBI for such fraud banks.,1,0,,2022-10-12 16:29:40,,
55fbd1c8-1c14-4424-a049-1c34e93264dd,Neelam Bhargava,https://play-lh.googleusercontent.com/a-/ACB-R5TzsAXZC7eYq3h7frnphbSY97QEWidZOJuj_DmHaX0,Very bad services,1,0,,2022-10-11 21:50:14,Hi Neelam! We are eager to assist you. We need your mobile number to assist you better. Could you please reach out to us via the help section of the app? Thanks.,2022-10-12 12:02:10
7a8adf92-8dc1-4c7f-97fe-97422c33f6e6,Wylde KETan,https://play-lh.googleusercontent.com/a-/ACB-R5R94aivgwsogBD10pEtVuA_0NL3QhJhDqBseanh_w,Discusting app it has no feature to share Money you can't send money to anyone they are making fool of us please do not download it,1,0,2.0.6,2022-10-10 22:39:34,,
edc49171-0e68-49c7-be12-c9f455f76744,Jatin Gaming,https://play-lh.googleusercontent.com/a-/ACB-R5S2CmZv0ZWqQNUe8RDeTxBBNJUvtoNtvrXAYhn2ew,Isme pay karne ka option nhi hai,1,0,2.0.6,2022-10-09 09:35:47,,
3878249d-6eab-40a1-ae4c-f1387417a952,akshay chavhate,https://play-lh.googleusercontent.com/a/AGNmyxZeqqKCS0ofCWLuzue3hbjoF7Mo6w4qkQpbrdJw=mo,Useless app not delivered my card since 2 month. and charge for card,1,0,,2022-10-08 14:07:07,,
f1249aa8-aaf4-4d92-a71f-a84c624df6f4,moj masti,https://play-lh.googleusercontent.com/a-/ACB-R5RXvxoG6j382kxy_6T0LuVj3_mdhzQpfW4Oc08h,Very bad experience due to not setting pin taking too time in sending card,1,1,2.0.6,2022-10-08 11:14:47,Hey Moj Masti! Can you please check now? Thank you for reaching out.,2022-10-02 10:23:29
3bb592c8-a3e7-4bc5-9a9e-00943b9db50c,Jashan Preet Singh,https://play-lh.googleusercontent.com/a/AGNmyxaff7VuBX11qcqR_S0pGjqa0JcV4u8nDGpzRBZx=mo,this is a very bad app ☹️☹️☹️,1,0,2.0.6,2022-10-08 09:31:34,,
e0f3d5f8-f790-4dfe-915c-2ebf5a05e466,GYANI GAMERS;,https://play-lh.googleusercontent.com/a-/ACB-R5Tr7ibrZs0e72hJ8ywduB39tZzFA6v2KRzIkkmMcA,What the hell who will buy ring worth 1000rs,1,0,2.0.6,2022-10-07 21:52:26,,
2094e210-ab0c-4f71-92dc-a082a05f5d9d,Bharat patel,https://play-lh.googleusercontent.com/a-/ACB-R5Sb_TRlJcmcg2TvkV3PF0CDqQH3gI5cmCz_EsvLaQ,N🤣😭😭😭💔💔💔💔💔💔,1,0,2.0.6,2022-10-07 17:37:29,,
e98aa8ed-2f3e-41cf-89db-f6a1aa48829f,Md Raid,https://play-lh.googleusercontent.com/a-/ACB-R5RlCOCoOMxrSZ2CfHBGAbWJExQRgyD_nbnIMVY3,"Worst worst worst don,t download plz.. One of the biggest worst app🤮🤮🤮",1,0,2.0.6,2022-10-06 23:09:10,,
fd0b3e09-a1d1-4369-b1ce-f7ef8f6aef3c,MD NADIM,https://play-lh.googleusercontent.com/a-/ACB-R5R4Ou4uMtMfa9eRuRZ7nbqdI5Gsih4g3F2G_7ci,I pay for the debt card ..but it doesn't reach me ....really disappointing. Froad,1,0,,2022-10-06 20:41:51,,
5808c14a-d38e-4342-adcc-aec6954c237b,BARI BOYZ SINGER,https://play-lh.googleusercontent.com/a-/ACB-R5SQuU6Bj7Qthfho1PiAiJofKhBMNUFCIuBAyNJzJg,This app Is good but from sometime upi & card transactions are not working,1,1,2.0.6,2022-10-04 10:57:12,"Hi BARI BOYZ SINGER, we will need your account details to check the probable issue. Could you please reach out to us via the help section of the app? Thanks.",2022-10-04 11:29:37
45a0c84e-ed04-4442-ad01-a45a665b7170,Asgher ali,https://play-lh.googleusercontent.com/a-/ACB-R5R9uNmtLVOxKbg6RLu1qa_KUU65zZS1lF2nMmvn,Good app but there should be scan and pay and pay using upi but the is only the card payment is there I hve ordered the card at 27 October and from 1 week its showing submitted for printing very late and bad,1,1,2.0.6,2022-10-04 10:17:29,,
60d579e7-c2ae-48c1-bc89-94b3b8c23f37,Muhammed Ismail Maaiz,https://play-lh.googleusercontent.com/a-/ACB-R5QYwakREcDpdBG0dDrWvhCLt8GfS4gUBN339Fte,Wort app ever found. Not even one Star is worth,1,0,2.0.6,2022-10-02 13:07:54,,
af6a9096-0b2f-4565-b1ac-d78d28d507d6,Gaurav trivedi,https://play-lh.googleusercontent.com/a-/ACB-R5Rlxsig7NQQ-oGBavkhowMoOpgdWs7NQXaNV_oO,"Worst support system They show currently replying in 2mins , 10mins or something else and reality is that they don't reply in 3-4hrs",1,0,2.0.6,2022-10-02 12:27:53,Hey Gaurav! We just checked but could not find any query raised by you. Could you please reach out to us via the help section of the app? Thanks,2022-10-02 20:29:01
d8cd3ecd-5f59-44ff-8473-abd4b30b26aa,Aritro Ghosh,https://play-lh.googleusercontent.com/a-/ACB-R5QmaAN7MeTbj85FWdnytgi6-AtKib20vdwhRkjsiA,Cannot set card pin,1,0,2.0.6,2022-10-01 09:41:57,,
277003cb-d5b3-4c3e-8e5d-0b8d74d5fffe,Magesh,https://play-lh.googleusercontent.com/a-/ACB-R5Slds1K8zHGL-UYtATVyq16SzqG5fU5Snd_fx87dQ,Uninstall this app immediately.. Is fake app and full of virus.,1,0,2.0.6,2022-09-30 09:17:50,"Hi Magesh, we request you to please do not spread rumours. If you have any questions, please reach out to us via the help section of the app and we will be happy to assist you.",2022-09-30 11:32:56
4ada4f1e-ee7d-47b7-b13e-bead8648cd51,Hasibul Hussain,https://play-lh.googleusercontent.com/a-/ACB-R5SXgRbdBya9rdB0CuAF3SCfux8afPeZBybohRWG,"The worst app in the world. I have gave it 1 star only to comment. I have rupees 250 in junio account, but I can't do anything with it. My money is in stuck. I hve ordered the junio card too but the card is not received in my address. The only say that my card id being prepared and wil be delivered soon.",1,0,,2022-09-28 09:23:49,,
82f8ab50-8d64-48bc-90ce-60b0abac2002,Moody PRaTiK,https://play-lh.googleusercontent.com/a-/ACB-R5TmIjv5gV8eVI3tUT9dGkHDVYaPVE4BQbcbCTnQWTc,Waste of time because you can't withdraw,1,0,2.0.6,2022-09-27 21:41:55,"HI Moddy Pratik, we are unable to find your number in our records, could you please reach out to us via the help section of the app? We are eager to assist you. Cheers!",2022-09-28 11:41:41
1e757d88-1bc7-41e0-b376-a577d9a7e564,The Wolverine,https://play-lh.googleusercontent.com/a-/ACB-R5R7ZflDUFx51GT3_3zDuDH8GXUl_zUjJfjr0lyB,Please Don't Download This Application. Because Already I Do It And My Money Hold On This Card. While I was Trying To Use This card it shows Transaction Failed Again and again. It is a worst Application I Ever Seen In My Life.😡😡😡😡😡😡😡😡😡😡😡😡😡😡😡😡😡😡😡😡😡😡😡😡😡😡😡😡😡😡😡😡😡😡😡😡😡😡😡😡😡😡😡😡😡 Give me My Money Back..... FRAUD APPLICATION......😡😡😡😡😡😡😡😡,1,0,,2022-09-27 00:43:13,"Hey Wolverine! We are eager to assist you. Please reach out to us via the help section of the app, so that we can have your mobile number. Cheers!",2022-09-23 12:45:07
1915cf1e-7a3c-407c-9623-aec9f4c08e3b,Raj Rani,https://play-lh.googleusercontent.com/a/AGNmyxZUajhEXB20SCvdp9L6XTBg-ufB1ZO0dbD0sFIS=mo,I added 200 rupeee in my account via upi but the amount that i added is not showing in my account,1,0,,2022-09-26 14:22:15,"Hi Raj Rani, in order to check the concern raised by you, we will need your phone number. Could you please reach out to us via the help section of the app? Thanks.",2022-09-26 15:28:19
e02301ce-3af4-4836-8e0a-c0d2faba3d32,Sharada devi,https://play-lh.googleusercontent.com/a-/ACB-R5RX2wz4L0w7OX_i45GvXHfAUl8TRfr4FFqxpoEW,Mai es app ko ek bhi star na do yarr es app ki customer service bahut bad hai agar aap customer service se to bat karne chauho ge to 1 hour ke bad replay karte hai .,1,0,2.0.6,2022-09-25 17:44:36,,
6bb56ecf-da5d-47db-954f-53aabc5283b4,Gamma益Devansh YT,https://play-lh.googleusercontent.com/a-/ACB-R5T34izJCnQDtfThE-woqW6d3FYvU4uVmxVrQSGXmA,The app is trash,1,0,2.0.6,2022-09-25 16:58:04,"Hi, in order to understand your concern better, we will need your phone number. Could you please reach out to us via the help section of the app? Thanks.",2022-09-26 15:29:32
d726e6e1-9ef7-4b7e-985c-6081cda40145,Prajeen MDRP,https://play-lh.googleusercontent.com/a/AGNmyxZWcn_boVTJy95kJVcfmnMjwR801XUFLJf2uS9n=mo,Waste very sticking version do not trying this app,1,6,2.0.6,2022-09-25 11:22:48,,
3ee91be6-fd54-4253-a14b-e178f76abef9,Abhijit Panda,https://play-lh.googleusercontent.com/a-/ACB-R5RrrLOjZQlX6LMeY5ELKgEHqqPanSQ3iQra9BDZdg,"After the migration to Transcorp, the entire app has become useless. I've been trying to load money into Junio account but its stuck at ""We are initiating your payment request"". Very disappointed.",1,8,2.0.6,2022-09-25 10:43:44,,
965a6592-aca2-4d03-b11e-87ac2914cce8,Kiran Kumar,https://play-lh.googleusercontent.com/a-/ACB-R5SmnDnrGcsX6ojuiLmsWtL0tlc_F8lhZVORhiuSqg,I can't add a money,1,0,2.0.6,2022-09-24 18:20:16,,
f57e0e1c-cd7f-4fa2-8e9c-dd8572b53fc8,Shivam Patel,https://play-lh.googleusercontent.com/a-/ACB-R5RCi-fsHrp01JY4EV9omZuPdTgBvNQ28cs-K9qr,Bekar hai,1,0,,2022-09-23 18:14:55,,
2efea9a6-1670-4741-8d30-133ca4d3399a,Debasis Biswas,https://play-lh.googleusercontent.com/a-/ACB-R5THG_LDf2vG1_ipEu51lrUT-F48lR5CxT3X4BGQHA,"As they began their journey, they gave good offers. As they got well known, they vanished all offers. This is business.",1,0,2.0.6,2022-09-22 11:05:31,Hey Debasis! We hope you are not facing any issues while using the app. We will be happy to assist you. Do reach out to us via the help section of the app. Cheers!,2022-09-22 12:44:32
aa1a24ea-dc36-486d-aeb6-afa19b341aca,Subrata Sarkar,https://play-lh.googleusercontent.com/a/AGNmyxaMUw15ukRshlWtLiVtEOkQ_e5PxgqNksM4T94Y=mo,Fake App i was add Money bud didn’t use my money Through Card.. I lost my Money.. O star the Wrost app ..,1,0,2.0.6,2022-09-22 00:01:42,,
71c8b410-0c8d-46ae-8ef5-db6e60550032,Sai Pranith,https://play-lh.googleusercontent.com/a/AGNmyxZtLnMONZQ-FJ3O9svVb9qitKDmEMchcxf2zJVi=mo,HOW I CONNECT TO GOOGLE PAY,1,0,2.0.6,2022-09-21 18:53:15,,
b83598dc-bc65-457e-a579-9ee9f54449a6,Jagdish Gondhankhede,https://play-lh.googleusercontent.com/a/AGNmyxYqmr6zcMK4Ha5QtqzN5D-ABOMObz0m_jOdhwz-=mo,How long time did card take to dilevery 🤬,1,0,2.0.6,2022-09-21 13:43:19,,
6f02085d-57cf-4431-bcbc-f5505b61eb5f,QUEMRUL ISLAM,https://play-lh.googleusercontent.com/a/AGNmyxabb417fi_cXouIi3LIUyTOTzGfAQ_gk3kW7GD-=mo,Very slow application...my problem is I'm open app but leave me for app 😤😐,1,0,2.0.6,2022-09-20 20:25:14,,
840e3c67-53d5-4a14-893d-70381004fa52,Pawan Kumar,https://play-lh.googleusercontent.com/a-/ACB-R5SHyCiMwZy5dqW6agwza55Ow_W3nxkCus_eQNe9kw,"I have not found my junio card No contect , no tracking for last two month Farziiiiiiiii",1,0,2.0.6,2022-09-19 12:42:37,,
ded05707-4c5f-4233-b948-80846fe91879,Prashant Mali,https://play-lh.googleusercontent.com/a-/ACB-R5SJkEZ5DhbYYiqKCTHZjGTW_-Bh-MiiSg57bxZ0_w,Referral code ?,1,0,2.0.6,2022-09-19 09:50:03,,
6e532ac8-030f-4d6d-95b5-6eabf67632e0,Vijay kumar,https://play-lh.googleusercontent.com/a/AGNmyxbddkL_6DyfY4RQTPpOE93EiCgwPn-AaSaQrS2M=mo,gij,1,0,,2022-09-18 16:11:12,,
5a0bc7b0-a10d-4c1f-907b-1cb9625fc245,Shivraj Dhakar,https://play-lh.googleusercontent.com/a-/ACB-R5ThjLadbP3O3hDZrZ_fxJ7oSbITzZpmmjvPzwj6pg,This is very bad 😞 app my payment not use Any app,1,0,2.0.6,2022-09-18 09:52:46,,
2c9b6b5a-a30e-47ae-acdc-c7d262e661b1,venkatareddy dasari,https://play-lh.googleusercontent.com/a/AGNmyxbIE52VSylv_rfAzzjsHHAF13fdX3_JrV5DkjvR=mo,No cashback offers. Swiggy and zomato. Then wts the use of migration. Akudo is best. Wt the use of new card when there is no cashback offers running?,1,0,,2022-09-17 14:47:50,,
2161dc42-1250-4ad9-a674-b70120f998a1,ஷத்ரியன் சொல்,https://play-lh.googleusercontent.com/a-/ACB-R5TfUwynI_jj3X8knGliXqHtUgWfZtYsdcVjjDKAtw,"It's was a good appo,but now they are migrating the service partner,so the balance gone zero,they may transfer To new account without asking us,but they not responding for chat...pathetic",1,4,2.0.6,2022-09-17 12:17:15,,
8e8c09f3-a0d3-4bdb-ad8e-815e3ff92df0,Ritik Kumar,https://play-lh.googleusercontent.com/a-/ACB-R5QHo7Zo1CjA6W-So9cmAxVS0Z_ZqjNJHxCrdleM,Most worst app in the world,1,0,,2022-09-17 09:43:27,,
2be5b884-a065-4cad-975f-6f1d51d97eff,Noob Gaming FF,https://play-lh.googleusercontent.com/a-/ACB-R5SGPaDoRfxJs26TPv9f4unH9Au1y3nMI6ZyhOyO,My card pin is not activating when I click confirm it is saying invalid url pls fix that problem,1,0,2.0.6,2022-09-15 22:51:17,Hi Noob! We need your number to get the issue debugged. Could you please reach out via the help section of the app? Thanks,2022-09-16 11:42:23
b2b48409-0044-4f8e-9ffc-9531cabc7d3b,RAHIT MONDAL,https://play-lh.googleusercontent.com/a-/ACB-R5TJOz0XBXefo_Owr0TgrRARaHLLsLCMPwOQbNbPNA,Very bad application full junk application,1,0,2.0.6,2022-09-14 23:53:12,,
05c48063-3810-4bca-8134-80c0077be96a,Vandan Mehta,https://play-lh.googleusercontent.com/a-/ACB-R5QJzJ5o3U3HGtnJxHRHs-GrTGFEbZi5KrfjTuUHtA,It doesn't have feature of paying to someone through mobile no and it also doesn't have scan and pay feature and when you try to transfer money from junio to any other app through UPI id then also the app doesn't get any approve notification in this app you can only order card and do card payment but most of the times local shops doesn't have the machine through which we can pay through card most of the times at local shop ther is QR code for paying online but as I told scan and pay is not,1,5,2.0.6,2022-09-14 11:23:54,,
a107ac10-95cd-46d9-b2f2-df477b6b7513,Rana Singh,https://play-lh.googleusercontent.com/a/AGNmyxb0sK8nA2NVwgg19YrGkQJiY27aOTeMHyGpMJTw=mo,Fake,1,0,,2022-09-13 18:34:12,Hi Rana! We are eager to know your concern. Could you please reach out to us via the help section of the app? Thanks,2022-09-16 13:49:35
1d589e60-1762-4f9d-9f66-2b0dd2b122a7,aman Kumar,https://play-lh.googleusercontent.com/a-/ACB-R5Sv_17B4JkqFjFVelmxQqhwA4w20R31pS5l9eG0Kg,Jakass,1,0,,2022-09-13 10:19:56,,
aea83710-4096-4ebf-b7b6-3f5b63ecabee,Sehaj Saluja,https://play-lh.googleusercontent.com/a-/ACB-R5RnFSTYd-iZl80YNB0xDEaPIpFx4OHPu4gGVol-Rw,Ekdum ghtia sabse bekar app ha koi bhi download mat karna card order kiya tha 14 aug ko aaj 12 sep haii abhi tak nhi ayea,1,1,2.0.6,2022-09-12 15:23:29,,
a66a9933-eb6c-4937-b514-ddd2421d2f55,Vikrant Jain,https://play-lh.googleusercontent.com/a-/ACB-R5T4XHr5vO0532bGVGv4RNXg8iR1PcDukUPaosLQfw,Very bad they screwed big time my money is now stuck and they want me to put the details for forced migration this is literally immature move from the company. You would have pushed the money is user's bank account or would have allowed to get it back in any of there active wallet account. Asking for migration and not sending the bank statement over email is not how the financial transactions are done.. not at all happy with thr company process.,1,12,2.0.6,2022-09-12 10:03:45,,
