video_title,video_id,video_url,views,likes,comments,caption,upload_date
Happy Diwali 2020 | FamPay,hiQ4nLVbqY4,https://www.youtube.com/watch?v=hiQ4nLVbqY4,2497,156,N/A,No caption available.,2020-11-14T05:05:55Z
Get Featured In Tanmay Bhat’s Next Video #shorts,YEK2T3YLT9M,https://www.youtube.com/watch?v=YEK2T3YLT9M,14725,786,N/A,No caption available.,2021-03-11T03:20:57Z
FamPay Explained To Parents | All about India's First Neobank for Teens,BTcwwlx5Xqk,https://www.youtube.com/watch?v=BTcwwlx5Xqk,371303,11755,N/A,No caption available.,2021-01-22T12:25:56Z
WE USED A METAL DETECTOR AND FOUND THIS 😳🤯,X9gwJqLJ6nE,https://www.youtube.com/watch?v=X9gwJqLJ6nE,4272,N/A,14,No caption available.,2022-10-20T06:43:15Z
How to activate your FamCard: step by step tutorial | India's first numberless card by FamPay,SKqJ2QFw3_I,https://www.youtube.com/watch?v=SKqJ2QFw3_I,19857,1397,N/A,No caption available.,2022-06-06T07:34:37Z
What’s Alina’s type? ft. FamCard,uXt4FZaoEE8,https://www.youtube.com/watch?v=uXt4FZaoEE8,11004,685,41,No caption available.,2021-09-27T05:43:46Z
Teenpreneur by FamPay: Sakshi Agarwal,IslotnQiaw8,https://www.youtube.com/watch?v=IslotnQiaw8,2179,168,N/A,No caption available.,2021-02-01T16:43:24Z
"Want to make, save and invest money, it’s time to Get Lit 😎",O9J_fVcjaCY,https://www.youtube.com/watch?v=O9J_fVcjaCY,3434,N/A,15,,2022-12-25T17:25:19Z
Why did @SamayRainaOfficial kidnap Aryan's dad? | Samay Raina | FamPay,JFcoJCMxcUw,https://www.youtube.com/watch?v=JFcoJCMxcUw,9294,795,80,No caption available.,2022-10-03T07:16:27Z
Take it And Go feat. Mermaid Scales 🥷,I1-kKFtA4Mc,https://www.youtube.com/watch?v=I1-kKFtA4Mc,18988,1279,40,,2021-08-24T06:06:28Z
Why doesn't Saloni want to do FamPay's Ad? | ft. @Salonayyy | Saloni Gaur,9-gTSSiHaxU,https://www.youtube.com/watch?v=9-gTSSiHaxU,14596,533,74,,2022-09-22T12:46:12Z
Does @GamerFleet have a new job? | ft. GamerFleet | FamPay,nbl4hHAJqFg,https://www.youtube.com/watch?v=nbl4hHAJqFg,12417,658,57,No caption available.,2022-10-20T06:20:04Z
OTP Olympics 🏃🏻‍♀️,qCbShiM_RvM,https://www.youtube.com/watch?v=qCbShiM_RvM,14660,891,64,No caption available.,2021-08-09T06:27:06Z
Take your FamCard With You,3lYgk-7UjBY,https://www.youtube.com/watch?v=3lYgk-7UjBY,11576,722,N/A,No caption available.,2021-01-03T18:05:23Z
Verify to upgrade your payments now!,dbDISvP8gjo,https://www.youtube.com/watch?v=dbDISvP8gjo,1590,179,N/A,,2023-02-25T14:19:57Z
FamCard- The Only Numberless Card For Teens by FamPay,tqBiHY6Cvyw,https://www.youtube.com/watch?v=tqBiHY6Cvyw,42599,2132,N/A,No caption available.,2020-12-03T15:56:48Z
Teenpreneur by FamPay: Kian Godhwani,rou31v2CC2w,https://www.youtube.com/watch?v=rou31v2CC2w,1581,104,N/A,,2021-02-20T15:29:58Z
BREAKING NEWS FOR TEENS! ft. @Saurabh_Ghadge | FamPay | Payments app for Teens,S43SA7xv08c,https://www.youtube.com/watch?v=S43SA7xv08c,3013,224,32,No caption available.,2022-10-11T11:15:29Z
Checkout what’s in Alina’s Bag 👀,Ksg8H2pnMYk,https://www.youtube.com/watch?v=Ksg8H2pnMYk,16235,517,32,No caption available.,2021-08-02T09:09:51Z
Mom Chronicles ft. Kusha Kapila,3KrKoSYMU7E,https://www.youtube.com/watch?v=3KrKoSYMU7E,49836,1921,19,No caption available.,2021-08-04T12:52:04Z
Stop Using Your Mother’s Debit Card #Shorts #FamPay,P4-BrKX0wto,https://www.youtube.com/watch?v=P4-BrKX0wto,8570,491,N/A,No caption available.,2021-03-19T07:12:32Z
"Aryan couldn't stop talking about THIS...| Aryan Katariya, Krisha Jain | FamPay India",ALlfJJIqPzg,https://www.youtube.com/watch?v=ALlfJJIqPzg,7321,385,153,,2022-11-17T11:12:56Z
FamPay VISA Arriving Now,bvcxdsPemlc,https://www.youtube.com/watch?v=bvcxdsPemlc,14855,667,N/A,No caption available.,2021-02-15T07:30:11Z
Take FamCard with you #FamPay #FamCard #Shorts,pAK7WOAjFUk,https://www.youtube.com/watch?v=pAK7WOAjFUk,11318,566,N/A,No caption available.,2021-03-26T03:31:39Z
FamCard Me- The Only Card You'll Ever Need. #FamCardMe #FamPay,XhKo3SeEVRo,https://www.youtube.com/watch?v=XhKo3SeEVRo,24893,729,244,,2021-08-05T16:53:29Z
When You Ask Parents For Money #Shorts,8aEK4IsZ_7c,https://www.youtube.com/watch?v=8aEK4IsZ_7c,9861,523,N/A,No caption available.,2021-03-11T17:00:35Z
Teenpreneur by FamPay: Aarav Garg,UDV-Kblb-yU,https://www.youtube.com/watch?v=UDV-Kblb-yU,3794,176,N/A,,2021-06-29T11:17:59Z
Introducing FamCard #FamCard #FamPay #Shorts,OUPMJvRuYcs,https://www.youtube.com/watch?v=OUPMJvRuYcs,3494,174,N/A,No caption available.,2021-03-26T03:31:22Z
2020 Internship Recap: What Interns Actually Do At FamPay | Apply Now!,7ysVrMYx1zM,https://www.youtube.com/watch?v=7ysVrMYx1zM,4873,137,31,,2020-09-03T16:46:14Z
I don’t care ft. FamPay 🤑,sOCcWsQwbtw,https://www.youtube.com/watch?v=sOCcWsQwbtw,7908,442,N/A,,2021-07-22T04:54:37Z
It's Debatable Finals LIVE - Day 2 FamJam 2.0,mAhotQFvPUQ,https://www.youtube.com/watch?v=mAhotQFvPUQ,867,59,5,,2020-11-30T01:12:24Z
Checkmate by FamPay | Online Chess tournament,LsxYVvU8K-4,https://www.youtube.com/watch?v=LsxYVvU8K-4,1347,60,5,No caption available.,2020-10-02T14:21:35Z
FamCard For Payments #shorts #FamCard #FamPay,zsOb7_MaXmo,https://www.youtube.com/watch?v=zsOb7_MaXmo,17233,663,N/A,No caption available.,2021-04-15T06:47:38Z
Hit The Streets: Friends And Funds,AMXCjOuBtXw,https://www.youtube.com/watch?v=AMXCjOuBtXw,1676,44,11,No caption available.,2020-08-12T04:48:13Z
Introducing FamCard Me - India's First Numberless Doodle Card For Teens,OpCpzXg8e-Q,https://www.youtube.com/watch?v=OpCpzXg8e-Q,954024,5790,490,No caption available.,2021-07-28T14:10:54Z
A teen’s ‘must have’ before leaving the house,6iRo1LjUzaE,https://www.youtube.com/watch?v=6iRo1LjUzaE,8828,388,N/A,,2021-06-11T05:19:30Z
Spending All My Money💸 #Shorts #FamPay,Apd6ffIjbJI,https://www.youtube.com/watch?v=Apd6ffIjbJI,11293,421,N/A,,2021-03-03T06:14:39Z
Introducing FamX- a spending account for everyone,x1dM8kx4bxk,https://www.youtube.com/watch?v=x1dM8kx4bxk,528,143,N/A,,2023-04-25T15:41:59Z
Day1 Part 2 - Workshop on Finding The Lost Cause - FamJam 2.0 India's largest digi-fest for teens!,1YC0Un5gzRw,https://www.youtube.com/watch?v=1YC0Un5gzRw,1251,55,7,No caption available.,2020-11-29T03:38:39Z
Teachers Day Nostalgia X FamPay,hZpyeyVudpc,https://www.youtube.com/watch?v=hZpyeyVudpc,10196,644,34,,2021-09-05T04:57:53Z
Who's More Likely To | Raksha Bandhan Special,QAVlTCGQe4Y,https://www.youtube.com/watch?v=QAVlTCGQe4Y,1999,64,9,,2020-08-03T05:02:21Z
Life of a student in Pandemic 😷,3cJZAaL94vc,https://www.youtube.com/watch?v=3cJZAaL94vc,10065,425,N/A,,2021-07-13T05:25:27Z
Teen.mp4 ft Rohan,J-eE9in_XGE,https://www.youtube.com/watch?v=J-eE9in_XGE,6329,465,69,No caption available.,2021-10-19T08:32:27Z
Teenpreneur by FamPay: Varun Arora,3KBdAGUNrvM,https://www.youtube.com/watch?v=3KBdAGUNrvM,3927,187,N/A,,2021-11-06T12:10:26Z
Truth or FamPay Ft. Teens & Moms | Mothers Day Special,GpiRiBs-txM,https://www.youtube.com/watch?v=GpiRiBs-txM,3882,149,N/A,No caption available.,2021-05-09T11:33:07Z
Actor Sushant Singh Recommends FamPay,s2pIuTLhBVo,https://www.youtube.com/watch?v=s2pIuTLhBVo,49614,2028,N/A,No caption available.,2020-11-24T18:27:10Z
Kaun Banega Coinpati by FamPay: Episode 1,jOgkrWLWDdY,https://www.youtube.com/watch?v=jOgkrWLWDdY,2359,141,0,,2021-04-24T13:43:55Z
Pitch Please Finale LIVE - Day 2 FamJam 2.0,T-55gXx2eHE,https://www.youtube.com/watch?v=T-55gXx2eHE,1650,60,6,,2020-11-29T20:49:42Z
Become a #Teenfluencer @FamPay,e8OACqLOBec,https://www.youtube.com/watch?v=e8OACqLOBec,3511,106,15,No caption available.,2020-07-21T16:43:28Z
Teens Recreate Their Father's Photo,N1W-fEdA7Q8,https://www.youtube.com/watch?v=N1W-fEdA7Q8,2986,128,N/A,No caption available.,2021-06-20T04:28:23Z
Story of FamPay ft @TanmayBhatYouTube and FamPay Founders,F8hAJikezko,https://www.youtube.com/watch?v=F8hAJikezko,10297,474,N/A,No caption available.,2021-10-23T17:11:20Z
Unboxing FamCard by GenZ | India’s first numberless card by FamPay,Gcs-W_5fduQ,https://www.youtube.com/watch?v=Gcs-W_5fduQ,26504,1118,N/A,No caption available.,2020-10-29T15:24:55Z
Thank You FamPay from FamStars,zVhyVz5rnqs,https://www.youtube.com/watch?v=zVhyVz5rnqs,7634,270,N/A,,2021-06-19T16:36:38Z
Indian Teens & Fathers: How well do you know each other? | Father's Day Edition,ILlsSuW5QYA,https://www.youtube.com/watch?v=ILlsSuW5QYA,6988,254,11,,2020-06-21T07:39:30Z
Dil se Shukriya: A Tribute By Friends of Fam | Teachers Day Special,8V81ur6M5N8,https://www.youtube.com/watch?v=8V81ur6M5N8,1684,83,N/A,No caption available.,2020-09-05T07:29:32Z
And The Winner Of Our PS5 Giveaway is ......... ft. @TanmayBhatYouTube,C03LR7qML0Y,https://www.youtube.com/watch?v=C03LR7qML0Y,26420,1358,N/A,,2021-12-30T13:46:44Z
Goodbye 2020: A FamPay Recap,E9-FOeQz0Ss,https://www.youtube.com/watch?v=E9-FOeQz0Ss,5144,309,N/A,,2020-12-29T17:50:22Z
Introducing FamCard for teens | India’s first numberless card by FamPay,IW20vNCuV5E,https://www.youtube.com/watch?v=IW20vNCuV5E,685672,18011,N/A,,2020-10-12T15:13:20Z
Presenting FamJam 2.0 - India's Largest Digi-Fest for Teens By FamPay!,VkyiMlFhhFg,https://www.youtube.com/watch?v=VkyiMlFhhFg,3159,157,N/A,,2020-11-03T18:02:27Z
Teenpreneur by FamPay: Manasi Patil,uCSFQuOwwk8,https://www.youtube.com/watch?v=uCSFQuOwwk8,1976,132,48,No caption available.,2021-09-23T16:14:20Z
Day1 Part 1 - FamJam 2.0 - FamPageant & Workshop on The Art of Journaling,OV-MPV6G6fs,https://www.youtube.com/watch?v=OV-MPV6G6fs,1875,43,N/A,No caption available.,2020-11-28T09:59:16Z
Closing Ceremony (Prize Distribution and Vote of Thanks) LIVE -  FamJam 2.0,JMEVYXF1tLY,https://www.youtube.com/watch?v=JMEVYXF1tLY,6684,376,8,,2020-11-29T17:13:06Z
Kaun Banega Coinpati by FamPay: Episode 2,wVDjBp1AGBE,https://www.youtube.com/watch?v=wVDjBp1AGBE,3057,169,0,,2021-04-25T13:43:52Z
Workshop on Writing A Comedy Sketch LIVE - Day 2 FamJam 2.0,Ah8UjvD0ywg,https://www.youtube.com/watch?v=Ah8UjvD0ywg,695,32,13,No caption available.,2020-11-29T23:32:24Z
F for Fame and Comicsteen Finale LIVE - Day 2 FamJam 2.0,FcTLoUt5MIE,https://www.youtube.com/watch?v=FcTLoUt5MIE,2182,102,22,No caption available.,2020-11-30T03:01:22Z
BTS ka BTS - PVR x FamPay BTS Concert,D-NYnRpexDI,https://www.youtube.com/watch?v=D-NYnRpexDI,7499,402,N/A,,2022-05-11T13:55:15Z
