reviewId,userName,userImage,content,score,thumbsUpCount,reviewCreatedVersion,at,replyContent,repliedAt
cff96511-055d-4844-bbcb-0f89e5a2edab,shashi kumar,https://play-lh.googleusercontent.com/a/AGNmyxbmXCfWMMoy1TWBVognr4e77rfDOzLyPE6D3Buw=mo,Everytime I am starting a transaction it says error oops something went wrong I reinstalled it five to six times and in various other mobiles it is not working... May be time to ditch this app,1,0,176.1.2 (arm64-v8a_release_flutter),2023-04-18 18:00:18,"Uh-oh. We're sorry, Shashi. Please ensure that you're using the app with a stable internet connection. Some more information that can help: https://goo.gle/2EwevX6. For further assistance, reach out to our support team. Here's how: https://goo.gle/2PQQFuc.",2023-04-18 18:10:21
06d06a4f-b75d-4c4b-84d5-73afec3bcb60,Pritam Giri,https://play-lh.googleusercontent.com/a-/ACB-R5TQA9g5Gw_jvGFQ8Yuz2M76p5H_5CNbhvIepnvX1Q,pd,1,0,151.1.2 (arm64-v8a_release_flutter),2023-04-18 17:50:57,,
d3cf1fa0-8624-44ab-995f-b1fb1826a7ba,GOTTIPATI VAMSHI,https://play-lh.googleusercontent.com/a-/ACB-R5T2m76OThJzcgILi4Qvy9SAHy069OP9ZqMVdEJ0bg,"Worst app, waste app",1,0,164.1.2 (arm64-v8a_release_flutter),2023-04-18 17:50:13,,
5baaf298-568d-41c2-b8e0-a65267487ece,KENJA TANTHRY,https://play-lh.googleusercontent.com/a-/ACB-R5T-DAed2nFkfwiDS16qMdWzr5_8O53XDWAJIL8w6Q,Not came to my spot inspite of phone request.,1,0,175.1.4 (arm64-v8a_release_flutter),2023-04-18 17:37:08,,
cd4b9868-d833-4343-ab33-d32eefdb0d6f,Sanjay Adhikari,https://play-lh.googleusercontent.com/a/AGNmyxYI3sZpM4gYjx9KVyTNlKCjrx66a8iJg-r5I5z3=mo,"After update app isnt even responding, its stuck on first page.",1,0,172.1.7 (arm64-v8a_release_flutter),2023-04-18 17:28:13,"Regret the inconvenience, Sanjay. Please ensure that you're using the app with a stable internet connection. For more info, check out our Help Center: https://goo.gle/3aQkQu3. For further assistance you can reach out to our support team: https://goo.gle/2PQQFuc.",2023-04-18 17:35:40
5810b184-7be1-4e25-86c6-a3d2e8121e64,Swastic Choudhary,https://play-lh.googleusercontent.com/a-/ACB-R5S3qdSfhag9T6bd3wvQLWFf_m1AFt3PmmJETAnI1A,Google play not money transfer help me 🙏,1,0,,2023-04-18 17:04:13,"Regret the inconvenience, Swastic. We suggest you contact our specialist team for assistance on this: https://goo.gle/2PQQFuc . Our team would be happy to help.",2023-04-18 17:27:19
5a23afea-3f36-4e4c-944e-4d841c34949a,A Google user,https://play-lh.googleusercontent.com/EGemoI2NTXmTsBVtJqk8jxF9rh8ApRWfsIMQSt2uE4OcpQqbFu7f7NbTK05lx80nuSijCz7sc3a277R67g,Good,1,0,20.0.001_RC05 (armeabi-v7a),2023-04-18 16:59:15,,
eb23a310-bfac-4876-b3c4-05367ac7aa81,karjum gamkak,https://play-lh.googleusercontent.com/a-/ACB-R5TRTS7NPBth_8fpecp_TxCEBcq1jugh27sNxG8n,somerime this app don't work when I want to check my current account balance.,1,0,173.1.4 (arm64-v8a_release_flutter),2023-04-18 16:49:53,"Sorry about that, Karjum. Please ensure that you're using the latest version of the app. For more info, check out our Help Center: https://goo.gle/3aQkQu3. For further assistance, reach out to our support team. Here's how: https://goo.gle/2PQQFuc.",2023-04-18 17:05:32
52611d32-3870-452b-b682-40641c6cff86,Jigar Patel,https://play-lh.googleusercontent.com/a-/ACB-R5QR0PjP51cV1qdVdyDFqsr39qtxryFsy3v7pUE58w,"Not safe for your data safety even our competition committee also file case for creating monopoly against Google, basically it's a foreign server app, Paytm, bhim upi, phonepe are far better and safer than this platform. (My rating is 0 star but there is no option so for appearing I gave 1 star.)",1,0,150.1.5 (arm64-v8a_release_flutter),2023-04-18 16:49:50,,
6eae5ed5-a3e0-4df2-b6f8-d9fa933824fd,Manohar Patil,https://play-lh.googleusercontent.com/a-/ACB-R5QZpXcP9-9nsdGS5GWainNdb1x33Di8FW3KuIfS_g,"Q😣3 mbb82 2,,28*",1,0,157.1.3 (armeabi-v7a_release_flutter),2023-04-18 16:44:35,,
995d7c3c-f0d0-4ad2-af9c-36b6d5ee3ff0,Mini Kurian,https://play-lh.googleusercontent.com/a-/ACB-R5SSi-iJsTWDNvtBAPCGz9iNHTnZkA6dW_vTD9xZ3A,Annoyed,1,0,173.1.4 (armeabi-v7a_release_flutter),2023-04-18 16:43:17,,
af0d65b6-397e-4da0-b46d-16a988417551,4045-ROHITH.A,https://play-lh.googleusercontent.com/a-/ACB-R5RW2v-TJecnbI6dK6GQ0K-c8fT1ohuPaMWJVfkFRw,no cashback,1,0,175.1.4 (arm64-v8a_release_flutter),2023-04-18 16:40:48,,
def17060-5d2d-46a8-bbc0-aa592771157c,Gaurav Jadhav,https://play-lh.googleusercontent.com/a/AGNmyxadMMU37Qt65516pNahm2Wp7IKYCNG9xVaFuTMC=mo,Cannot add debit or credit card due to error. I have emailed Google technical team. The issue is still not resolved.,1,30,175.1.4 (arm64-v8a_release_flutter),2023-04-18 16:38:39,"Sorry about that, Gaurav. We suggest you contact our specialist team for assistance on this. Here's how: Call our support: 1-800-419-0157 between 8 AM to 12 AM. More details: https://goo.gle/2PQQFuc. Our team would be happy to help.",2022-11-10 12:47:07
654d8541-7b1a-4a4e-8cdc-934586c7ad54,Sur a,https://play-lh.googleusercontent.com/a-/ACB-R5RhDnK6qkusb1zttjOETLqOtY0DOQMzmTtdbSrQ6Q,When I selected my gramin bank the configuration message went to axis Bank etc etc then reply from their server not from my bank. How this happened?,1,0,176.1.2 (armeabi-v7a_release_flutter),2023-04-18 16:02:02,We understand your concern. Multiple SMSes are sent out in order to increase the success rate of adding your bank account. Hope this info helps.,2023-04-18 16:09:34
126bf6ed-7c43-4d29-86cc-e419ad01b7f5,Renuka jeevan Poojary,https://play-lh.googleusercontent.com/a-/ACB-R5QyC_-ULv3wXFNn7v4h2Yp0hZaqVnn8dldHHyNS-g,Bad service,1,0,,2023-04-18 15:53:45,,
c57bca98-c8fc-41d5-a730-ce3cac339a46,sujit singh,https://play-lh.googleusercontent.com/a-/ACB-R5TasLbd_iZlC4nZ7FXqbUbciW60anobxQUKUb41KJU,Waste app waste service poor service,1,0,175.1.4 (arm64-v8a_release_flutter),2023-04-18 15:52:11,,
7b1b26a1-8483-4833-950d-c796c5c1e3b7,mubeen Aati,https://play-lh.googleusercontent.com/a-/ACB-R5TIGxWZUg30z7mhjOoodWDmzc1cFbXluezfa77RLA,Respectful becasue anytime number change stil we can youse,1,0,126.1.2 (armeabi-v7a_release_flutter),2023-04-18 15:36:22,,
5f05ba9e-d406-4be7-a9a1-57a93c26f23b,RAGHAV RAHI,https://play-lh.googleusercontent.com/a-/ACB-R5S3nyCxky37FhZEe3jjTnvVx_QLI2g3qdkS7WrEsQ,Not upto mark,1,0,176.1.2 (arm64-v8a_release_flutter),2023-04-18 15:33:32,,
8f84f824-7bc6-4926-9380-01de6a309d10,Rajendran K,https://play-lh.googleusercontent.com/a-/ACB-R5RpAXXVbFB1uh3XBmkteOMbRZEGynQDXHKtJWme,Now Day's very poor performance.,1,0,175.1.4 (arm64-v8a_release_flutter),2023-04-18 15:28:06,,
cd8277f3-3358-4162-bdc2-6e71b9680b33,Naresh Kumar,https://play-lh.googleusercontent.com/a-/ACB-R5Tx-y5i0mLQexYJFUKykyJx4KuFvw_oVTi9D3iC,Mere phone me gpay nahi chal raha haiji,1,0,176.1.2 (arm64-v8a_release_flutter),2023-04-18 15:23:05,,
edec9029-27ae-40d9-ae80-0e08d3ecd414,Sunil Kakade,https://play-lh.googleusercontent.com/a/AGNmyxY86z0xQcXYtZ-I3Y0-tTMwx14mk427bYl2GAcq=mo,Unable to pay using app. It is resetting bank settings everyday. Not sure what the problem is. Quick and early help is highly appreciated. It is connecting to bank accounts which are not active too.,1,3,175.1.4 (arm64-v8a_release_flutter),2023-04-18 15:22:32,"Regret the inconvenience, Sunil. We suggest you contact our specialist team for assistance on this: https://goo.gle/2PQQFuc . Our team would be happy to help.",2023-04-18 15:44:33
c7142f8c-db8e-4188-82b6-af975c5b7d81,Neheru Patel,https://play-lh.googleusercontent.com/a-/ACB-R5Q_OgOFeMbwqfIiEArqsK8zO6fuhb15RVfd-n_M,Please uninstall this app in my Devais,1,0,144.1.3 (arm64-v8a_release_flutter),2023-04-18 15:10:46,,
6d904bc7-2cc2-400b-bf55-988130e25570,Hiten Savla,https://play-lh.googleusercontent.com/a/AGNmyxZE9Y1BY08ypTesQn9PJ9d_pBkV_rbgQFo-7A6INw=mo,Every 2day bank verification after talking with call center same problem facing again.,1,0,,2023-04-18 15:07:33,,
118915e1-481f-4a85-a3a9-0ac44dfaa1f2,Subhash Pande,https://play-lh.googleusercontent.com/a-/ACB-R5T4w7FZ3tslhqqlltHLZ0fZ_3uVcFgtIPQEJXaneYY,Continuously failing the transactions.. money debited from bank account but not credited to receiver account. But using same bank account i can transfer amount easily theough PhonePe app,1,0,176.1.2 (arm64-v8a_release_flutter),2023-04-18 15:04:41,"Uh-oh. We're sorry, Subhash. Please check if you're on the latest version of the app and have a stable internet connection. Some more information that can help: https://goo.gle/2EwevX6. For further assistance, reach out to our support team. Here's how: https://goo.gle/2PQQFuc.",2023-04-18 15:20:58
79273fca-fc93-44c0-bbec-14ecfa1df0a6,Nadem Molla,https://play-lh.googleusercontent.com/a-/ACB-R5QuLg8EzP6o50JoC8a73EXQWQHjTgfoq-uUO1C8xQ,Mera 3 refer bonus nahin mila hai mein customer support se help mang raha hun lekin phone cut kar de rahe hain please help,1,0,176.1.2 (arm64-v8a_release_flutter),2023-04-18 15:04:08,,
9dc617c8-1551-42c4-94a5-c1e86647972d,L P,https://play-lh.googleusercontent.com/a-/ACB-R5Rjnd2Mx-H2Pi_-mi7WVPSBvj16Q32egYCn24tPBw,"Unable to add axis , icici in manage upi section",1,0,175.1.4 (arm64-v8a_release_flutter),2023-04-18 14:22:01,Regret the inconvenience. We suggest you contact our specialist team for assistance on this: https://goo.gle/2PQQFuc . Our team would be happy to help.,2023-04-18 14:51:00
1ee161db-2741-4cbc-85bc-6a0da7573741,Jitender Tomar,https://play-lh.googleusercontent.com/a-/ACB-R5SyljF-pBcK6DDXFc-MToTRaxCmfM_9s2ZdKSv_Ew,bakwash reward nhi milta h,1,0,,2023-04-18 14:06:26,,
1574ea08-d251-4347-9e7c-db87dfff4b6d,Pradeep Sharma,https://play-lh.googleusercontent.com/a-/ACB-R5RQeczpEUTCcLMPoeSLbGv3HPbenv8xzlVg12qY3Q,Wrong service,1,0,175.1.4 (arm64-v8a_release_flutter),2023-04-18 13:56:20,,
53558169-e02f-4bfd-adcb-39e7559f9c64,Amol Mote,https://play-lh.googleusercontent.com/a/AGNmyxbod32wV5JxJmF1qyphnk1I1n85x7BEPPvOoD21=mo,Activated bank problems .... Sms verifieng problem 😓😓😓😓,1,0,175.1.4 (armeabi-v7a_release_flutter),2023-04-18 13:55:38,"Regret the inconvenience, Amol. Please check that the phone has enough storage, the date/time & the SMS settings are correct. Try restarting your device once. More info here: https://goo.gle/2sG1zLq. For further assistance you can reach out to our support team: https://goo.gle/2PQQFuc.",2023-04-18 14:14:32
b8d8a540-9b47-47a3-835a-481079dd98c5,SACHIN HEGDE,https://play-lh.googleusercontent.com/a-/ACB-R5Q2CYVVzJDAzTXORBOLmv3L3Ij4LKishBLO2ySBvA,"After the recent update, I have lost all the transactions for the last 8 months from the history. Transactions before that and after the update are only available. This is ridiculous!",1,0,175.1.4 (arm64-v8a_release_flutter),2023-04-18 13:54:13,"Regret the inconvenience, Sachin. Our team is already working on resolving the same at the earliest. We suggest you try again after a few hours. Appreciate your understanding.",2023-04-18 14:13:32
f810b3a3-e08e-40f5-97f4-cfac3e86fb62,Sk Ekramul,https://play-lh.googleusercontent.com/a/AGNmyxY5jzIfbWXpKfYv30lIdBJJwRN8GMtI-5c71pYt=mo,Very good app,1,0,173.1.4 (armeabi-v7a_release_flutter),2023-04-18 13:40:28,"Hi Ekramul. We'd love to earn a 5 star rating from you. 5 stars are the best in our rating system, please let us know what we can do to get there. We appreciate your feedback!",2023-04-18 13:52:37
7d637ef0-91fd-4dd7-915a-c9cce6cbc37a,Amani Sailu,https://play-lh.googleusercontent.com/a-/ACB-R5Tctdd7nuf2U7sdev4KTjhC1hYtEoJZm_NxKDX-_g,"Whenever I open this app,its getting stuck.. I've reinstalled it many times but still happening the same..",1,0,175.1.4 (arm64-v8a_release_flutter),2023-04-18 13:35:55,"Sorry about that, Amani. Please ensure that you're using the app with a stable internet connection. For more info, check out our Help Center: https://goo.gle/3aQkQu3. For further assistance, reach out to our support team. Here's how: https://goo.gle/2PQQFuc.",2023-04-18 13:55:27
434726d3-b81a-45bf-b659-34a65313c7fc,Aadil mohi deen,https://play-lh.googleusercontent.com/a-/ACB-R5QxkPMQNaZQEYoJNzdSvQMYPBlXFBY0xpDXwDdkkw,Worst app I have ever seen,1,0,175.1.4 (armeabi-v7a_release_flutter),2023-04-18 13:29:46,,
e992ae90-2c74-4ff6-a764-7c2d8d055f35,hitesh chaturvedi,https://play-lh.googleusercontent.com/a-/ACB-R5QmaflyW5C3dBcqdd3cjnSSatEza2jndkO6oJxvnA,Bakwas,1,0,173.1.4 (arm64-v8a_release_flutter),2023-04-18 13:26:39,,
63033e36-cac0-43d4-9afa-6ca1d28f1eda,Velu Ramu,https://play-lh.googleusercontent.com/a/AGNmyxb5RT99yPo93jB5YfxtEOmWPRi8cf5OVGddGMc5=mo,Bp,1,0,,2023-04-18 13:26:08,,
3e89eaaa-d19e-4e67-9def-05cee283ce0c,Jyoti Raut,https://play-lh.googleusercontent.com/a-/ACB-R5R5UvZgMa5Mycu6L9HyDd8FxNEPAjid7CvZNT2IBA,Best,1,0,175.1.4 (arm64-v8a_release_flutter),2023-04-18 13:09:16,,
3efe1efd-0000-466a-b328-9ff0acc350e6,vinothkumar A,https://play-lh.googleusercontent.com/a/AGNmyxaaR9zIh0dd-hqjsrZosIwSY8sAAF6ol7iu5WGY=mo,After update app not yet all opening,1,0,175.1.4 (arm64-v8a_release_flutter),2023-04-18 13:01:20,"Regret the inconvenience, Vinothkumar. Please ensure that you're using app with a stable internet connection. For more info, check out our Help Center: https://goo.gle/3aQkQu3. For further assistance you can reach out to our support team: https://goo.gle/2PQQFuc.",2023-04-18 13:22:23
349c2b62-a45e-494a-8c54-77f282113962,abdul wajeed,https://play-lh.googleusercontent.com/a/AGNmyxa32nOZ_c5XnPvt4oUQ4J1X5fkhDtgRn3wyohM=mo,Sorry,1,0,175.1.4 (arm64-v8a_release_flutter),2023-04-18 12:58:18,,
af15dd82-12ee-44da-aada-f0360face9ce,Shajith Seethangoli,https://play-lh.googleusercontent.com/a-/ACB-R5SCOt1RXcQLMBGaX_Wb-KB7s-2zIbQzFs3EWbfvPQ,"After update unable to link my bank details, phone pay paytm all working only G pay not working",1,1,175.1.4 (arm64-v8a_release_flutter),2023-04-18 12:54:39,"Sorry about that, Shajith. Please check if you're able to send an SMS, and also ensure that the phone number you have for Google Pay is the same one that's linked with your bank account. More info: https://goo.gle/3s7UHlf. For further assistance, give us a call at 1-800-419-0157.",2023-04-18 13:20:54
4685a824-b606-4868-869a-aab2512b2e45,Guda SatyaNarayana Reddy,https://play-lh.googleusercontent.com/a-/ACB-R5SCcxdwxoWzazo6ixiG57QV9aANwbCE7gO85sA5Jw,Worst Service After Reactivation Of My Google Pay Its Not Working Properly even it's Not showing my account balance,1,0,175.1.4 (arm64-v8a_release_flutter),2023-04-18 12:49:29,"Sorry to hear that, Guda. Please ensure that you're using the latest version of the app. For more info, check out our Help Center: https://goo.gle/2s0B7w5. For further assistance, reach out to our support team. Here's how: https://goo.gle/2PQQFuc.",2023-04-18 13:14:28
3d65ef06-161d-403c-8a10-304f4e607b83,Latiful Hossain,https://play-lh.googleusercontent.com/a-/ACB-R5RWdbKAa0oMFeZ1S9vo1Kb0gKOvWdwYkTSXU54s8w,Not providing cashback like Amazon pay.,1,0,175.1.4 (arm64-v8a_release_flutter),2023-04-18 12:45:23,,
b83cb31b-a1cf-40a7-80f3-e3c53408856b,Gayanendra Shahi,https://play-lh.googleusercontent.com/a-/ACB-R5QWFj0eDwNgkwTR3eQ6KaK_KVfdJav9VVUyl_8mug,nice,1,0,175.1.4 (arm64-v8a_release_flutter),2023-04-18 12:43:16,,
7a4242f5-f4d9-4ebe-95cf-54a3f69766ca,Bhavnesh Thakur,https://play-lh.googleusercontent.com/a-/ACB-R5TSh6ErLIN6dh9uuVPi-TnoUwjTvDpoqZ5RGRoEyA,It takes an hour to open sometimes. happening after update,1,0,175.1.4 (arm64-v8a_release_flutter),2023-04-18 12:24:28,"Regret the inconvenience, Bhavnesh. Please ensure that you're using the app with a stable internet connection. For more info, check out our Help Center: https://goo.gle/3aQkQu3. For further assistance you can reach out to our support team: https://goo.gle/2PQQFuc.
",2023-04-18 12:29:14
ccbb6c4e-86e8-49e6-a0ee-7b1d468a3cd6,Saddam Hussein Saddam Hussein,https://play-lh.googleusercontent.com/a-/ACB-R5SDytTTXfOQh4nq_oqD2scfNwdsfbxBTEJpASrBKg,Open Google pay,1,0,175.1.4 (arm64-v8a_release_flutter),2023-04-18 12:23:51,"Sorry to hear that, Saddam. Please ensure that you're using the latest version of the app. For more info, check out our Help Center: https://goo.gle/3aQkQu3. For further assistance, reach out to our support team. Here's how: https://goo.gle/2PQQFuc.
",2023-04-18 12:27:49
c00dfcae-a0d1-4b71-ab50-be6decfd3ad8,Farha Naaz,https://play-lh.googleusercontent.com/a-/ACB-R5Qra7zA_6mF6BMv2sOwoYQvlnKmnoIvSkXC1m0tQxo,It's been 5years I am using this app but after my debit card was expired and when i tried to update new debit card it's not going furture steps taking my debit card details after getting otp also page wont move it will be the same and shows 'oops something went wrong try later'. I am trying it from past 3 days its stio the same i wanted to give 5star but now they disappointed me by this. I was very much happy because of this app. But now I am very much upset.,1,2,175.1.4 (armeabi-v7a_release_flutter),2023-04-18 12:23:00,"Regret the inconvenience, Farha. We suggest you contact our specialist team for assistance on this: https://goo.gle/2PQQFuc . Our team would be happy to help.",2023-04-18 12:43:15
e16026e3-4f6e-43e0-bd64-ade1bdddb71c,Surendar Babu,https://play-lh.googleusercontent.com/a-/ACB-R5T3bQdudx8HKPRAl4HC0RlMlnmbu6VMXaTGRItkqg,"Had an worst experience with the app and customer service. How can a disabled or illiterate person can access your customer care and reporting feature? What if a dumb or illterate person want to raise a concern or query? Only a relative or trusted person can help them, but the c.care representative is so strict that, they can only speak with the account owner and they have less patience. We can understand your nombs but the same time service provider also should consider the user situations.",1,0,156.1.2 (arm64-v8a_release_flutter),2023-04-18 12:20:52,,
1709f254-e0b6-40d0-bb11-6c4cc92651d5,Swati R Kumar,https://play-lh.googleusercontent.com/a-/ACB-R5QDssVYZNK87fJ1C4ir3ZD7mTGlF8Is13cMwA8t,After updated the app it's work like jerk want to remove this but it's not unitall also,1,0,145.2.1 (arm64-v8a_release_flutter),2023-04-18 12:01:32,"Sorry about that, Swati. Please ensure that you're using the app with a stable internet connection. For more info, check out our Help Center: https://goo.gle/3aQkQu3. For further assistance, reach out to our support team. Here's how: https://goo.gle/2PQQFuc.",2023-04-18 12:19:45
36bd5829-064b-4fdb-b764-904abb08ffe1,abdul rashik,https://play-lh.googleusercontent.com/a-/ACB-R5Q_oWrm_Dc0S3D6SvdkGnj___LGOvT5MeXvY5EY,Not working properly after the update,1,0,49.0.003_RC07 (armeabi-v7a),2023-04-18 11:56:55,"Regret the inconvenience, Abdul. Please ensure that you're using the app with a stable internet connection. For more info, check out our Help Center: https://goo.gle/3aQkQu3. For further assistance you can reach out to our support team: https://goo.gle/2PQQFuc.",2023-04-18 12:14:34
b0297880-d6f5-4efe-bf15-6947957735c7,Amlan Jyoti Deka,https://play-lh.googleusercontent.com/a/AGNmyxao8bnh5FJoG7c0ra0j0CiUF21V1kHULypoqAwp=mo,"Today 18/04/2023, when I opened gpay, I found none of my bank accounts were linked, although I used gpay 3 days ago to make payments. Is this some kind of fraud or hacking?",1,0,175.1.4 (arm64-v8a_release_flutter),2023-04-18 11:14:41,"Regret the inconvenience, Jyoti. Please ensure that you're using the latest version of the app. For more info, check out our Help Center: https://goo.gle/3aQkQu3. For further assistance, reach out to our support team. Here's how: https://goo.gle/2PQQFuc.",2023-04-18 11:56:15
7aa4580d-3825-48af-a4fe-6413cec5a310,lekh Singh,https://play-lh.googleusercontent.com/a/AGNmyxaF1yvECK5lt4q8jR76gHzP5uIVjcmKozpm2kRv=mo,EZ in PM tV,1,0,173.1.4 (arm64-v8a_release_flutter),2023-04-18 11:09:40,,
2af9d307-2a5f-4a37-999b-57672ada0364,Abhishek Samantaray,https://play-lh.googleusercontent.com/a-/ACB-R5SdJVE1YrC7BNcFC4x3SMXSJOiQ324HMW5XKemq,There are a lot of bugs in the app. As when you do the payment it gets stuck and says it's processing. Please do fix this issue.,1,0,175.1.4 (arm64-v8a_release_flutter),2023-04-18 11:07:23,"Uh-oh. We're sorry, Abhishek. Please check if you're on the latest version of the app and have a stable internet connection. Some more information that can help: https://goo.gle/2EwevX6. For further assistance, reach out to our support team. Here's how: https://goo.gle/2PQQFuc.",2023-04-18 11:45:47
b362823e-aacb-4faa-8169-47a664bb8b26,Vishnu Rv,https://play-lh.googleusercontent.com/a-/ACB-R5SC2hkAfM-E_4k1pbRoqKY44rQZ27E_S3p4__bu,Now Facing a new problem app is logouting and i starter all over again,1,0,175.1.4 (arm64-v8a_release_flutter),2023-04-18 11:01:27,"Regret the inconvenience, Vishnu. Our team is already working on resolving the same at the earliest. We suggest you try again after a few hours. Appreciate your understanding.

",2023-04-18 11:06:50
f7bf7311-650d-418a-b72d-969909e6b868,Jay Darji,https://play-lh.googleusercontent.com/a-/ACB-R5SRyaTqCi_BoDW-B4jsOUdpkZDgrdk4Tmq4ltS2,MY account money debited but receiver money not receive.. 😔 please so please google support team solving the problem and back the money please🙏 🥺,1,0,175.1.4 (arm64-v8a_release_flutter),2023-04-18 10:19:19,"We're sorry you had to go through all that trouble, Jay. Please follow these steps for assistance: Google Pay app - Show transaction history - Select the transaction - Having Issues - Payment issue - Follow on-screen instructions. We'd also like to remind you that Google Pay will never ask for any personal information.",2023-04-18 10:48:44
25ef5ccf-665b-4c6d-95b0-eb8e7794941c,Bina Dkhar,https://play-lh.googleusercontent.com/a-/ACB-R5SK8IkJVIpiTrQmSwl9yCcGMiFiVUCl-IRwRdNi,never get cash back,1,0,172.1.7 (arm64-v8a_release_flutter),2023-04-18 10:00:41,"Uh-oh. We're sorry. We want everyone to get rewards on Google Pay. However, rewards are user-specific, so everyone may not get the same ones. You can always check for existing offers and in the Offer section. In case you want to know more click here https://goo.gle/2RZNN10 or, reach out to our specialists who are just a tap away.",2023-04-18 10:15:27
326917f5-1e83-44d2-9074-219c60e62a82,Magna Carta,https://play-lh.googleusercontent.com/a-/ACB-R5QMd8aAByWl1UEfnFIG-PDYeXheoP823Nh2IS2u,Usually no offer for recharge and utility bills. Not as user friendly as other similar apps. No customer service,1,0,,2023-04-18 09:55:52,,
59a90ca3-aefb-462c-addc-b285b7ae1ef9,yash komple,https://play-lh.googleusercontent.com/a/AGNmyxaLQuSDRUP7rviPuYxD7uDV8CT0sDO37QGCp55U=mo,The new update thes app will not open or pement,1,0,175.1.4 (arm64-v8a_release_flutter),2023-04-18 09:52:05,"Regret the inconvenience, Yash. Please ensure that you're using the app with a stable internet connection. For more info, check out our Help Center: https://goo.gle/3aQkQu3. For further assistance you can reach out to our support team: https://goo.gle/2PQQFuc.",2023-04-18 10:07:07
e0dce8e2-3ade-4c7b-b30c-a4ddd26a5988,GANESH SHARMA,https://play-lh.googleusercontent.com/a-/ACB-R5SQ1lLJUxzKU_MpM2LWgL_YsBbDBIukbFLv3OJdqw,Discusting,1,0,175.1.4 (arm64-v8a_release_flutter),2023-04-18 09:37:12,,
92362b5f-119b-402f-baf7-7bcdbd15f2d2,Subham Karmakar,https://play-lh.googleusercontent.com/a-/ACB-R5Q0nelVKpMbygPMNQrHkUfzWY99DrSHWniKreGAFw,"Used to be my primary UPI app but I don't know what happened to Gpay now, I was using it fine but suddenly it says my phone has no sim card in it and stopped working. While all the other apps like PhonePe are working seamlessly. The customer support also didn't provide any solution. Now I have to switch to PhonePe because of this",1,3,175.1.4 (arm64-v8a_release_flutter),2023-04-18 09:26:58,,
decc4ec5-ee49-491e-8b4f-8a0c4e63a3c5,Pro- Mode,https://play-lh.googleusercontent.com/a-/ACB-R5S-DAXCJe4GMrtFhv4v5f929_oJsOKnvR7hMyvMNQ,"Fruad g pay i have done jio recharge of 239 rs , money debited from my account but payment fail and still no refund from g pay, recharge done on April 2 , 2023 at 19:19 pm . I have even rise a issue talk with their representative they said they will refund the money , today it's 18 April no reply or refund from g pay , Kick out this Google thief from India 🔥",1,0,173.1.4 (arm64-v8a_release_flutter),2023-04-18 09:24:49,,
b394d8da-3ec6-400a-ba8c-2c3fab68f6df,Mohamed Kasim,https://play-lh.googleusercontent.com/a/AGNmyxagocbGFcA056hAwcb5Vyk0YrZeQ3mit8u4V4AF=mo,Gpay should allow me to choose my preferred mail id instead of picking default on its own.,1,0,,2023-04-18 09:16:22,"Regret the inconvenience, Mohamed. We suggest you contact our specialist team for assistance on this: https://goo.gle/2PQQFuc . Our team would be happy to help.",2023-04-18 09:53:46
1a00a990-a76a-4161-84e0-55719fe172d4,Raju Thula,https://play-lh.googleusercontent.com/a/AGNmyxaFuAJA0khyXkUlAvIlTXPZurR9WGBXbb0ogHSf=mo,Worst experience this not sending SMS in my account iam troubling for this,1,0,175.1.4 (armeabi-v7a_release_flutter),2023-04-18 09:10:37,"Sorry to hear that, Raju. Please check that the phone has enough storage, the date/time & the SMS settings are correct. Try restarting your device once. More info here: https://goo.gle/2sG1zLq. For further assistance you can reach out to our support team: https://goo.gle/2PQQFuc.",2023-04-18 09:18:42
5ddf177c-b250-445c-9aec-faa385109ced,kapil Tiwari,https://play-lh.googleusercontent.com/a-/ACB-R5TWotvcpKypqwep0ocOkw6WzfaAit-45IfT4yXJ,New user ko tofaa or old user ab bus intajaar kar raha ki use koe gift milee,1,0,,2023-04-18 09:03:58,"Asuvidha ke liye khed hai, Kapil. Humara sujhaav hai ki aap iss par sahayata ke liye humari support team se sampark karsakte hai. Humare support team ko call karein: 1-800-419-0157 subah 8 baje se raat 12 baje ke beech. Adhik jankari: https://goo.gle/2PQQFuc. Dhanyavaad.",2023-04-18 09:15:27
9eae437d-6443-499b-9c25-a37f92f2e482,Dino Chakma,https://play-lh.googleusercontent.com/a/AGNmyxbZitjJFb7wyuHdTCPqfPnH5zzsAf2PSgimrPIZ=mo,rewards are froud,1,0,169.1.8 (armeabi-v7a_release_flutter),2023-04-18 08:39:10,,
