reviewId,userName,userImage,content,score,thumbsUpCount,reviewCreatedVersion,at,replyContent,repliedAt
9223440b-5f51-44ea-b079-66007336a955,SAGE S,https://play-lh.googleusercontent.com/a-/ACB-R5RRyHNTfQD-oXzlanpF8Rg8E4knhNlr8GaIJmPS,It deserves 0stars worst app I've ever used,1,0,,2023-04-20 16:07:59,,
6f0b938e-ffb2-4fb4-a819-29d4ccaff7a9,Adv. Amrinder Singh Dhillon,https://play-lh.googleusercontent.com/a-/ACB-R5Si2M1HoAMo0u3yJxM3Ppx1OjlmOboGO6Aa7B0F,"I've only ever used this app for all my transactions. But from the last few days, I'm unable to scan any QR code. Camera is running but it doesn't fetch the payment window. It has caused a lot of inconvenience. There is no option in the get help menu to fix this. Please resolve this issue.",1,10,176.1.2 (arm64-v8a_release_flutter),2023-04-20 15:46:26,"Regret the inconvenience, Amrinder. Our team is already working on resolving the same at the earliest. We suggest you try again after a few hours. Appreciate your understanding.",2023-04-20 16:11:11
b9dfe581-3b28-4ad4-96c7-dc301c563a58,OIBEK SHOKIROV,https://play-lh.googleusercontent.com/a/AGNmyxZNZBUjyL2psGKheR0lr4zDYnKFXgIOnOfdSv-8=mo,Why this app still doesn't support material icon?,1,0,176.1.2 (arm64-v8a_release_flutter),2023-04-20 15:33:45,,
8022a8c5-785b-4ccf-b7c1-0029e16f0477,Emolic Saliq,https://play-lh.googleusercontent.com/a-/ACB-R5Tv8V3OikSNr4k6DgiA1gbG7BWZs_9LM1mnVJH76LM,Can't guaranteed rewards,1,0,176.1.2 (arm64-v8a_release_flutter),2023-04-20 15:28:39,,
36a256ac-90d6-4d82-8f13-6254da5c42d4,Birendra Kumar,https://play-lh.googleusercontent.com/a/AGNmyxYBfhehR789RjoN9EkpvQPC-B8rniBUuVz0wjis=mo,super app,1,0,173.1.4 (arm64-v8a_release_flutter),2023-04-20 15:15:03,,
aea83703-6227-46b3-89a9-33c83aacc02c,M Gowrish,https://play-lh.googleusercontent.com/a/AGNmyxYR6bQ3SUP02EQ1A0b_NctpV7h81PQ-2qBwZH2F=mo,M Gowrishs,1,0,173.1.4 (arm64-v8a_release_flutter),2023-04-20 15:09:18,,
168a2939-ec27-41dc-974a-37b0d5d0926a,Irshad Belim,https://play-lh.googleusercontent.com/a-/ACB-R5R_hhB0b47xdPDc4gyA8RU4kKlw19DirIzjoJnM,I never use this aap 😔 many of time my money was stuck ...phone pe is best never ever hold my money,1,0,175.1.4 (arm64-v8a_release_flutter),2023-04-20 14:47:06,,
265ef78b-2745-4d20-a446-05accbc87496,Sujan kumari,https://play-lh.googleusercontent.com/a-/ACB-R5RZMZi74c6Sfu79PUbnWN3KnuAiTkBtczghnaRhKg,Terrible experience... Most of the time huge amount is getting failed and money getting debited. How pathetic!! You need to wait for your money I want my refund any how. Give my money back,1,0,176.1.2 (arm64-v8a_release_flutter),2023-04-20 14:45:04,"We're sorry you had to go through all that trouble, Sujan. Please follow these steps for assistance: Google Pay app - Show transaction history - Select the transaction - Having Issues - Payment issue - Follow on-screen instructions. We'd also like to remind you that Google Pay will never ask for any personal information.",2023-04-20 15:02:10
26796afb-5b66-4891-bcc3-aa3925a09856,SUREKHA GUPTA,https://play-lh.googleusercontent.com/a-/ACB-R5QQ_gosfN-mTzQxRPogIL2hPuqiNyV7Rvb3ueujsw,Pathetic service It's bn 3 working days my transaction has been failed but money got debited .. They mention in their query section that any money debited would reverse in 3 working days ... I srsly don't know who's working on this issues Google pay is not been the same as they used to be in their services Alrdy submitted bank stmnt detail in the Application Stll they r wrking on it Amnt mght be big or small bt it is actlly imprtnt to the prson Stp tking ths mch time fr solutions,1,0,176.1.2 (arm64-v8a_release_flutter),2023-04-20 13:59:02,"We're sorry you had to go through all that trouble, Surekha. Please follow these steps for assistance: Google Pay app - Show transaction history - Select the transaction - Having Issues - Payment issue - Follow on-screen instructions. We'd also like to remind you that Google Pay will never ask for any personal information.",2023-04-20 14:30:43
87d0a969-4051-4e17-b291-14b6f690ef64,PARTH PANCHAL,https://play-lh.googleusercontent.com/a-/ACB-R5QrWsVYO6PNPGpYC5kzFDzCFJIFuF3Ox3-hniWJStk,Not warking my application,1,0,176.1.2 (arm64-v8a_release_flutter),2023-04-20 13:44:50,"Hi Parth. Please ensure that you're using the latest version of the app. For more info, check out our Help Center: https://goo.gle/3aQkQu3. For further assistance, reach out to our support team. Here's how: https://goo.gle/2PQQFuc.",2023-04-20 14:02:53
908ca1b4-6764-4fa7-96e1-71d2b3405b4b,Bhaijaan ali,https://play-lh.googleusercontent.com/a/AGNmyxZPL15si5KZKoVrarcilpY7NMoOf5qPag16q0Bg=mo,Ok,1,0,,2023-04-20 13:32:10,,
654eda35-04cf-45f9-a91d-98d2b2cdd4ae,Pradip Thite,https://play-lh.googleusercontent.com/a-/ACB-R5TawAAT6onsOX7wWskBfllPt6a7ctzybW3wzPWBDQ,Google pay is very nice app,1,0,176.1.2 (arm64-v8a_release_flutter),2023-04-20 13:21:48,"Hi Pradip. We'd love to earn a five-star rating from you. Five stars are the best in our rating system, please let us know what we can do to get there. We appreciate your feedback!",2023-04-20 13:26:22
ca8bf2d8-6bad-4167-919d-216eab6885b6,Owais Shaikh,https://play-lh.googleusercontent.com/a-/ACB-R5TFSUdIjq1iVPSubFmI1jF7NaQAkfWdVmbjOykTLw,"Now everyone will be banned from Google Pay, why are you charging APP charges? You guys are very fat.",1,0,173.1.4 (arm64-v8a_release_flutter),2023-04-20 12:57:37,"Hi Owais. Google Pay is a consumer app and there are no hidden charges while using the app itself. However, you can still incur charges when using different payment methods (which is dependent on the bank). For further assistance, reach out to our support team. Here's how: https://goo.gle/2PQQFuc.",2023-04-20 13:25:33
d01e58ea-d25c-463f-9fbe-ad898ae46878,shubhajit dua,https://play-lh.googleusercontent.com/a-/ACB-R5S-ApTPQY0FSCYnPoX07WwyO6Cki72Js4_ORxJ2,"I have made a payment of 75,000 that got failed and still my account got debited , I haven't got refund yet ..don't use this app ...it may eat your hard earned money",1,0,175.1.4 (arm64-v8a_release_flutter),2023-04-20 12:56:30,"Sorry about that, Shubhajit. We can help you with this. Please follow these steps for assistance: Google Pay app > Show transaction history > Select the transaction > Having Issues > Payment issue > Follow on-screen instructions. Remember, Google Pay will never ask for any personal information over the phone, email, or any other channel.",2023-04-20 13:22:10
36100fcc-9260-4c32-8551-c962cb353777,Jagmohan Singh,https://play-lh.googleusercontent.com/a-/ACB-R5Svsv9ROegjfDoGM8lvHSi_9Iuxvk9vpjBx6U2U7A,good,1,0,175.1.4 (armeabi-v7a_release_flutter),2023-04-20 12:41:00,,
2bc45bd3-e36b-40b3-bac1-b5ef84d901f9,Adarsh,https://play-lh.googleusercontent.com/a-/ACB-R5Q8tk4oWeEhe0EkpCIJ5aV0mhiYlwYgNHiKpk2Oy_k,Not its really a bad app,1,0,176.1.2 (arm64-v8a_release_flutter),2023-04-20 12:33:36,,
5e130d03-875f-4207-9f5c-e6393f6b408a,Maya Bhagat,https://play-lh.googleusercontent.com/a/AGNmyxbLAA8obpJwofbb-mnA1S_cs6tn66iGNsPLsOOF=mo,No getting refral bonus,1,0,176.1.2 (armeabi-v7a_release_flutter),2023-04-20 12:27:21,"We'll surely get you that reward, Maya. Firstly, please ensure that the person you invited has registered using the link and their transaction was successful. Another thing to check is the eligibility of the referral reward here https://goo.gle/36NF6Le. If you need more assistance, our support team can be reached here: https://goo.gle/2PQQFuc.",2023-04-20 12:39:47
a298ec40-705d-4884-a663-f0841acbc7d1,Shweta dolly Tiwari,https://play-lh.googleusercontent.com/a-/ACB-R5RHIYNFqgUCePfRJRhOOvrvFTcKY6SKpDmdAk2TG6c,Many prbm with aap,1,0,168.1.3 (arm64-v8a_release_flutter),2023-04-20 12:10:51,"Regret the inconvenience, Shweta. We suggest you contact our specialist team for assistance on this: https://goo.gle/2PQQFuc . Our team would be happy to help.",2023-04-20 12:16:03
a80ae9f4-9123-4669-8ecc-d48fd23ffb0a,Ramesh Sharma,https://play-lh.googleusercontent.com/a-/ACB-R5RsiIDBV9b0teE779B3Umtkp3MavxP4y9e7W5D1Q9Q,"Worst application i have ever seen, my payment of Rs.3000 stuck 5 days ago but yet no response or amount received from Gpay, i also submitted bank statement. Paytm is best application camparing to Gpay.",1,1,176.1.2 (arm64-v8a_release_flutter),2023-04-20 12:03:17,"No worries, Ramesh. We can help you with this. Please follow these steps for assistance: Google Pay app - Show transaction history - Select the transaction - Having Issues - Payment issue - Follow on-screen instructions. Remember, Google Pay will never ask for any personal information over the phone, email, or any other channel.

",2023-04-20 12:09:58
d9d4f87c-0095-47b1-8073-2e1184fce7ca,alpesh damor,https://play-lh.googleusercontent.com/a/AGNmyxY5YUWqGbYz3jP7e6m2p0A5sbfeOwMSkDQY-3Kk=mo,Update nhi ho raha hei,1,0,,2023-04-20 11:58:41,,
7750862e-57ff-4368-bbbe-f4608f20b5a8,Mridul Mech,https://play-lh.googleusercontent.com/a-/ACB-R5Q70OgNk1XXooLRaGA0ulyHlZrWCYW3QJKILUwv,Why I use this app I don't know...need cash back,1,0,175.1.4 (arm64-v8a_release_flutter),2023-04-20 11:53:45,,
3dc1b873-c53c-4b79-8869-e42b93736635,Prem Shankar Chaurasiya,https://play-lh.googleusercontent.com/a-/ACB-R5T98t0CdpLygYUVw0hZCi_qPE48BbXm4J5qGm-K_sg,Payment ho gya fir bhi failed likh kar aa rha hai Wrost app,1,0,175.1.4 (arm64-v8a_release_flutter),2023-04-20 11:20:09,"Asuvidha ke liye khed hai, Prem. Hum aapaki samasya ko samajhate hain, lekin hum aapaki madad jaroor kar sakte hain. yaha apna ticket banayien: Google Pay app > Show transaction history > Select the transaction > Having Issues > Payment issue > Follow on-screen instructions.

",2023-04-20 11:30:32
b6ca7c43-f3fa-4e0d-9663-be2f3ca07a42,Srithi Sri,https://play-lh.googleusercontent.com/a-/ACB-R5TPfWTEIVhBjnEdEdphF71ow6Z0RXQWg-a8bKuZPQ,"Yesterday I paid one person, payment was failed, but my amount was debited, that person not received payment emergency payment this, plz fix it",1,0,175.1.4 (arm64-v8a_release_flutter),2023-04-20 11:05:16,"No worries, Srithi. We can help you with this. Please follow these steps for assistance: Google Pay app - Show transaction history - Select the transaction - Having Issues - Payment issue - Follow on-screen instructions. Remember, Google Pay will never ask for any personal information over the phone, email, or any other channel.
",2023-04-20 11:18:35
00d9549a-5691-4e53-b45e-7160fad78d7a,shiv Electrical & light decoration,https://play-lh.googleusercontent.com/a-/ACB-R5QYRy7eqUQm96skeOScKRv2oykHxC2EqwM5OL2fIg,Not good,1,0,176.1.2 (arm64-v8a_release_flutter),2023-04-20 10:40:14,,
deb2b207-fe74-48e6-90cc-06d5ea3cce40,Gourav Gandhi,https://play-lh.googleusercontent.com/a-/ACB-R5TLeMxKOFnaHNMWtrqxL0jDXPJ0vWJ3qziL5dlzqg,Barcode was not good ...,1,0,145.2.1 (arm64-v8a_release_flutter),2023-04-20 10:25:15,,
e4832a62-e248-4bb0-9170-da33c91ceb74,Nilesh Pasarnikar,https://play-lh.googleusercontent.com/a-/ACB-R5SAf2ig3ultzu2-S9Ia_YUWdf0M-Bk_qZ9RBhYYdBA,Poor app. Most of the time payment got stuck and we have to pay from other means. Suddenly app got suspended so removed the app from mobile permanently. Using other better apps,1,0,175.1.4 (arm64-v8a_release_flutter),2023-04-20 10:05:08,"Sorry to hear that, Nilesh. Thanks for reaching out. We would recommend to fill the account verification form https://goo.gle/2UEqJ7R to get your Google Pay account reactivated.",2023-04-20 10:54:19
5a452b54-a108-4357-b87b-6e048415d703,Rakshith Bp,https://play-lh.googleusercontent.com/a-/ACB-R5QorXWjFQH_4FDkAC1ut0jtMvM03rywQUpB8HYX-Q,After new update scanner not working,1,0,176.1.2 (arm64-v8a_release_flutter),2023-04-20 09:34:56,"Regret the inconvenience, Rakshith. Please ensure that you're using the app with a stable internet connection. For more info, check out our Help Center: https://goo.gle/3aQkQu3. For further assistance you can reach out to our support team: https://goo.gle/2PQQFuc.",2023-04-20 09:49:32
2b5273e1-2936-4b38-adc3-f090a8611e0f,S P Bhattacharjee,https://play-lh.googleusercontent.com/a-/ACB-R5R9jHfzZbHepZXbJTMjhixcGzvfuz5-wKN1DB0F2A,Nice!,1,0,176.1.2 (arm64-v8a_release_flutter),2023-04-20 09:25:38,,
44605589-df39-4f14-88f8-cb610de6a0a9,Rupan Suriya,https://play-lh.googleusercontent.com/a-/ACB-R5QQekiouTmLT69N3xFRce4DYEvAxtSKEjvDt8LK,I can't log in or unistall. It was loading over a day. I want to delete this app.,1,0,176.1.2 (arm64-v8a_release_flutter),2023-04-20 09:16:04,"Regret the inconvenience, Rupan. Our team is already working on resolving the same at the earliest. We suggest you try again after a few hours. Appreciate your understanding.",2023-04-19 15:01:17
582ed6d6-7d1c-4dc6-8212-08f1774d30b0,Katie JCMercyGrace,https://play-lh.googleusercontent.com/a-/ACB-R5S_fi8rinOn8i_ZHNJQmK3C4bfhzaaMtTk3X1QqJ-Q,"I've tried to make in app purchases in two different apps using my linked payment information. Both the apps indicate it's the linked payment info, but the linked payment customer service said it's this pay app. Idk why making a purchase is so difficult. This is google pay in USA",1,0,176.1.2 (armeabi-v7a_release_flutter),2023-04-20 09:05:21,"Sorry about that, Katie. Please let us know if you are referring to the Google Wallet or Google Pay app as well which country you're using the app in. This will help us understand how to best support you.",2023-04-20 07:50:02
90667dcc-449b-4ddf-9e33-cbe7ab00c9ad,Sulochani Sakthivel,https://play-lh.googleusercontent.com/a-/ACB-R5SzufIrTx1jT4_CAkF5GVlorbXiOB708lu2fp0xlA,It's such a horrible thing.... Why this frequently asking for an mobile verification and it shows like logged in with another mobile... Feeling so insecure about using this app!,1,0,175.1.4 (arm64-v8a_release_flutter),2023-04-20 08:58:37,"Sorry to hear that, Sulochani. Please ensure that you're using the latest version of the app. For more info, check out our Help Center: https://goo.gle/3aQkQu3. For further assistance, reach out to our support team. Here's how: https://goo.gle/2PQQFuc.",2023-04-20 09:34:58
8d933f7b-d579-44cf-bf10-84112793508d,Manikandan Chokkalingam,https://play-lh.googleusercontent.com/a/AGNmyxbCAI9oioqPJOma7r7TvndEFVVZXAPO9Ie-g7Zt=mo,its very bad service,1,0,176.1.2 (arm64-v8a_release_flutter),2023-04-20 08:57:31,,
1f7b957e-9e85-4ea3-963a-d0cd7197fa3a,JIGAR DAVE,https://play-lh.googleusercontent.com/a-/ACB-R5TAINWzyyVb2mNRm7KNDM10IIV815RX1Zj-NuXsnJI,Starting me aacha Cash back aata tha but abhi unused copon Aate hai,1,0,175.1.4 (arm64-v8a_release_flutter),2023-04-20 08:46:43,,
5c621e17-25c2-44d2-a653-620b1b461231,Manabendra Nath,https://play-lh.googleusercontent.com/a/AGNmyxZy8i55sGFCmrNUzB4WpwvRrEJXSQPe33Fn4cb4_Q=mo,"Sometimes get problem to load account balance, Server did not responding problem.",1,1,175.1.4 (arm64-v8a_release_flutter),2023-04-20 08:41:20,"Sorry about that, Manabedra. This might have happened due to heavy traffic experienced by the bank servers. Please ensure that you're using the latest version of the app with a stable internet connection. More info: https://goo.gle/3aQkQu3. For further assistance you can reach out to our support team: https://goo.gle/2PQQFuc.
",2022-08-24 21:23:39
0c00bbf9-cef2-43a7-b86f-9fedf880edf4,Vishnu Gurjar,https://play-lh.googleusercontent.com/a-/ACB-R5TX_wVnZy8ZmUL6A_c7tq7RvzCoZ0sRSkauhPsrZQ,declining payments and failed payment are formal now.,1,0,176.1.2 (arm64-v8a_release_flutter),2023-04-20 08:39:18,"Uh-oh. We're sorry, Vishnu. Please check if you're on the latest version of the app and have a stable internet connection. Some more information that can help: https://goo.gle/2EwevX6. For further assistance, reach out to our support team. Here's how: https://goo.gle/2PQQFuc.",2023-04-20 08:49:22
993d88d5-19b2-4dd2-8076-8e8a41588ac4,Tufani Chaudhary,https://play-lh.googleusercontent.com/a/AGNmyxajJYylMjhXkUEhCydVY1djFoU2XCDCFYGro7yp=mo,Tufani.chudhary,1,0,144.1.3 (arm64-v8a_release_flutter),2023-04-20 08:33:26,,
a89ec558-dd3d-42a0-b2c7-547329e83526,A Google user,https://play-lh.googleusercontent.com/EGemoI2NTXmTsBVtJqk8jxF9rh8ApRWfsIMQSt2uE4OcpQqbFu7f7NbTK05lx80nuSijCz7sc3a277R67g,Since i cant swear 😠😡😤🤬,1,0,176.1.2 (arm64-v8a_release_flutter),2023-04-20 08:26:57,,
25e55729-e35b-4759-8cdc-9ccbf001dcef,Dhanush JD,https://play-lh.googleusercontent.com/a-/ACB-R5SStGoMXJ12o8JZCI5-z6IaPUh0FPHAdr7Ysdy0Ow,Very poor and their is no cashback. Just they give better luck next time. this is so Bad,1,0,176.1.2 (arm64-v8a_release_flutter),2023-04-20 08:17:58,,
393662e4-e556-450b-8e2d-677934529985,SUMAN BHAI,https://play-lh.googleusercontent.com/a-/ACB-R5SnkjkPYILbQxmB8W7xCTAV3128ISeC1Vw_lMi6jQ,Bad experience more then 3 times my cash debited,1,0,126.1.5 (arm64-v8a_release_flutter),2023-04-20 08:08:40,"Regret the inconvenience, Suman. We suggest you contact our specialist team for assistance on this: https://goo.gle/2PQQFuc . Our team would be happy to help.",2023-04-20 08:25:02
16b44844-f5d8-4da7-b0cc-0bc8400bd3d6,Ria Paul,https://play-lh.googleusercontent.com/a-/ACB-R5TVod3eCybmFR5osM8H2OlvX9BA3Rs2DMkGMJrmTg,During The past few days I have tried hundred times to transfer money but It was showing error occurred... Whenever I tried to open It was not opening or Automatically I had been logged out... Please fix this prblm ASAP..,1,0,176.1.2 (armeabi-v7a_release_flutter),2023-04-20 07:51:28,"Regret the inconvenience, Ria. Our team is already working on resolving the same at the earliest. We suggest you try again after a few hours. Appreciate your understanding.",2023-04-20 08:13:32
c9ad45d1-8c8e-437a-86f7-e4c5a6050232,Sumit Bishnoi,https://play-lh.googleusercontent.com/a-/ACB-R5TbNw4Wzchyc1LtLbemXgOtOQXhikV8N1k_WnN0Ig,Amount debited from my account and not credited to receiver. It's been more then 20 days.,1,0,176.1.2 (arm64-v8a_release_flutter),2023-04-20 07:15:04,"No worries, Sumit. We can help you with this. Please follow these steps for assistance: Google Pay app - Show transaction history - Select the transaction - Having Issues - Payment issue - Follow on-screen instructions. Remember, Google Pay will never ask for any personal information over the phone, email, or any other channel.",2023-04-20 07:28:25
a5db5495-4e88-463f-a774-44ab89c3ca6c,Dr. Ajay Mandhotra,https://play-lh.googleusercontent.com/a-/ACB-R5RdCtR1KgZyWYfBZvxGEZF-6683N5LxRT4WkiiT,not able to do any transaction,1,0,176.1.2 (arm64-v8a_release_flutter),2023-04-20 06:56:03,"Uh-oh. We're sorry, Ajay. Please check if you're on the latest version of the app and have a stable internet connection. Some more information that can help: https://goo.gle/2EwevX6. For further assistance, reach out to our support team. Here's how: https://goo.gle/2PQQFuc.",2023-04-20 07:29:02
5487fe70-93eb-459f-9dec-698831482e16,PRIYA MISHRA,https://play-lh.googleusercontent.com/a/AGNmyxa7DgLS6T6fsqw4NncEZSPey4dKfi5XAr1490Tl=mo,Very bad,1,0,176.1.2 (arm64-v8a_release_flutter),2023-04-20 06:36:42,,
d8508c1e-26ae-4f66-8788-6daa2c00542e,Majhia Hembram,https://play-lh.googleusercontent.com/a-/ACB-R5QOhZxWoFpP_QHhvxY2rEUHLDUaie0r9A6JTF-3JA,Its very confusing new version and old one most of the time is requring updates and update .......only what is this useless,1,0,175.1.4 (armeabi-v7a_release_flutter),2023-04-20 05:32:26,,
1912690c-acef-4b62-9de6-61bb7de23c2c,Sangram Singh,https://play-lh.googleusercontent.com/a/AGNmyxanxJkDF-xxzVMOzWNT9mQDxPzSNE9NfwGjHJw2=mo,Mera payment bekar gaya kya refund ho sakta hai ye payment meine Zoey thakur jaisi bakwas ke liye nahi ki,1,0,172.1.5 (arm64-v8a_release_flutter),2023-04-20 05:05:51,,
3d697a76-9cfc-40ba-b302-b6a5bc3f4bfd,Umang Bhanushali (U G),https://play-lh.googleusercontent.com/a-/ACB-R5STzaXLh5FEdi_AVzY19Y_YKLANPgYCO8qhWCRC_g,Vedy bad app dont download this app for your transactions bcz this app struck with transactions on pending and many times transaction failed .......,1,0,173.1.4 (arm64-v8a_release_flutter),2023-04-20 01:13:49,"Uh-oh. We're sorry, Umang. Please check if you're on the latest version of the app and have a stable internet connection. Some more information that can help: https://goo.gle/2EwevX6. For further assistance, reach out to our support team. Here's how: https://goo.gle/2PQQFuc.",2023-04-20 01:19:21
b43e88ab-ae8e-48e6-8225-ca2d2a627468,G Kumar,https://play-lh.googleusercontent.com/a/AGNmyxYuOX_bsrzLvUH0LvXSVn7YjbQMkPTCzNUWBXMX=mo,2w9Walw2@2)oww,1,0,176.1.2 (arm64-v8a_release_flutter),2023-04-20 01:00:10,,
f006c58e-ce5d-4c8d-9f78-1e8493a2b095,Naresh Kumar,https://play-lh.googleusercontent.com/a/AGNmyxaHVhp7Yi_zA8E0W6OCyrPyLZd2ym8Ac8zeV30z=mo,Refund policy is not good. Hdfc app is very good Pay TM love 😘😘😘 Hate g pay 🤢🤢,1,0,175.1.4 (arm64-v8a_release_flutter),2023-04-20 00:52:30,,
bcdc3baf-fb1b-450e-9b26-1acc59b9f95d,Memostan,https://play-lh.googleusercontent.com/a-/ACB-R5TnGTuAqHe3LllMneGuSpMhU_huKSXiGz-de604,"I downloaded it few days ago and it was working fine but now suddenly i am not able to scan UPI QR codes, i checked other app and it's working fin their so it's clearly not my camera or mobile's fault. Please help me if you can",1,0,,2023-04-20 00:52:19,Regret the inconvenience. Our team is already working on resolving the same at the earliest. We suggest you try again after a few hours. Appreciate your understanding.,2023-04-20 01:10:12
4a65ec2a-517a-4424-93db-fc7780fe9e36,Joyner Smith. Jr,https://play-lh.googleusercontent.com/a/AGNmyxbJ9nKLE7cQO_4yvyxtSr_k79xakLtdrEtcMmwaVg=mo,I had more than (4) four unauthorized charges on my credit card and contacted refund department several times only to have each and every one of them denied. Who else or what else can I do to regarding this? Can I complain to a government agency? If so how do I get it started!,1,0,176.1.2 (armeabi-v7a_release_flutter),2023-04-20 00:39:13,,
bcef9b55-cd89-4e17-9c9f-f1ed6fc66f50,vivek tiwari,https://play-lh.googleusercontent.com/a/AGNmyxaKqhJrhwdawxsZBLW9L2vvPuUoCRQWXKGx89hp=mo,Fake don't use,1,0,29.0.001_RC04 (arm64-v8a),2023-04-20 00:34:20,,
5b4543bb-bd1f-4856-afa8-911d79373ab4,Bunty Singh,https://play-lh.googleusercontent.com/a/AGNmyxaJQlA4K1YhrUZBmfHKZxSTnECkz9cKmR-jJR5t=mo,Chal nhi rha he,1,0,176.1.2 (arm64-v8a_release_flutter),2023-04-20 00:11:13,"Asuvidha ke liye khed hain, Bunty. Kripiya check karein ki aap Google Pay ka latest version use kar rahe hain. Iske alawa,ek baar Google Pay app ko apne phone se uninstall karein aur dobara install karke dekhein. Adhik jaankari yahan: https://goo.gle/3aQkQu3. Aur adhik sahayata ke liye humari support team ko sampark karein: https://goo.gle/2PQQFuc.",2023-04-20 00:19:23
30d006a0-ef46-46da-8d22-c515edfcdb2c,Farooq Mohammed,https://play-lh.googleusercontent.com/a-/ACB-R5ScXdUAGthN0lRnY8sK46iEAoj-iDnR4KHFr1EMAg,Logs out unnecessarily,1,0,176.1.2 (arm64-v8a_release_flutter),2023-04-20 00:01:35,"Regret the inconvenience, Farooq. Our team is already working on resolving the same at the earliest. We suggest you try again after a few hours. Appreciate your understanding.",2023-04-20 00:07:13
bc9f734f-6e99-4587-9e8d-8015be6aa08a,Sourav Naskar,https://play-lh.googleusercontent.com/a-/ACB-R5RofkfIp6Q6b080Mer6mCH-PGEt2mMJ1bsIj8F7,"Useless app. I can't check my transactions history, and i also booked a complaint to the google pay but no action taken by google pay.",1,0,176.1.2 (arm64-v8a_release_flutter),2023-04-19 23:43:07,,
09764c92-aa52-4c3f-bade-2978d8e6aae7,Prince Kumar,https://play-lh.googleusercontent.com/a-/ACB-R5Ttry6Iw11E0m9SFTEkYop82fgUqKI9suplwucc,I want this app in my phone but google installed already. Worst app,1,0,158.1.4 (arm64-v8a_release_flutter),2023-04-19 23:34:55,,
e60bce71-3dac-44ac-9b0d-93a48cb958d3,swapnil patil,https://play-lh.googleusercontent.com/a/AGNmyxZQvFFibIeXBAf8PqSxOv0PjxhL1xKYGFTAM-Pa=mo,I am getting logged out daily. I have to activate and do all the login process daily happening from last one month.,1,1,175.1.4 (arm64-v8a_release_flutter),2023-04-19 23:22:46,"Regret the inconvenience, Swapnil. Our team is already working on resolving the same at the earliest. We suggest you try again after a few hours. Appreciate your understanding.",2023-04-19 23:27:41
8e617f7e-4545-4dfe-ae84-8bfa987a739d,Azad Khan,https://play-lh.googleusercontent.com/a/AGNmyxa67VpMtm6oyMq3NzJe_eaAZ8uEpga17GLSohzo=mo,Rg,1,0,69.0.001_RC03 (armeabi-v7a),2023-04-19 22:48:49,,
2f5349ec-15ff-456d-9503-a760e029d7d2,gurpreet gulati,https://play-lh.googleusercontent.com/a-/ACB-R5RiGOkg8MTiP0IAvDT-Pmg57jiLmymD7y-IbUybiw,You will get 5 star but better luck next time..... 😉,1,0,168.1.3 (arm64-v8a_release_flutter),2023-04-19 22:22:54,,
7273fc8a-722e-474f-8283-03ad91597998,Sagar Dhurwey,https://play-lh.googleusercontent.com/a/AGNmyxZV2hzXzrD547fz1uaxpAcJNQ-0SzZ0WulM82ZJ=mo,Fd H,1,0,122.1.4 (arm64-v8a_release_flutter),2023-04-19 22:19:46,,
6f15661e-33a1-4f9f-b3d0-bd0980dc8cfa,Bapi Mallick,https://play-lh.googleusercontent.com/a-/ACB-R5SaC4sJeoRDW7yKeKKVjBuBE2SG3eagII94sfYJRQ,Very bad experience.,1,0,176.1.2 (armeabi-v7a_release_flutter),2023-04-19 22:01:11,,
964ede44-10a4-4911-8bed-bd858b90df45,Yeddula Anusha,https://play-lh.googleusercontent.com/a-/ACB-R5T_rNPyLkqpDiUYfoYlZJdIF3b25gb6qb8kgaZo,Owpql,1,0,149.1.1 (armeabi-v7a_release_flutter),2023-04-19 21:58:43,,
270bce41-596f-419d-9011-d4fac3208b36,THE Villagers,https://play-lh.googleusercontent.com/a-/ACB-R5RiiZCCZvdvmwKSAkFe56AOByZ1JYeGnWTdw-nHvg,It's very bad app Reward 😒😒😒,1,0,175.1.4 (armeabi-v7a_release_flutter),2023-04-19 21:36:00,,
46a5571e-b6dd-4ef6-adeb-9bbd436f9190,Thara Shri,https://play-lh.googleusercontent.com/a/AGNmyxZ7r6VM0mR9wQc9AB6eHNhg9aFqm_DWSn-X_XdO=mo,Worst,1,0,176.1.2 (armeabi-v7a_release_flutter),2023-04-19 21:17:49,,
