reviewId,userName,userImage,content,score,thumbsUpCount,reviewCreatedVersion,at,replyContent,repliedAt
85d41447-f515-4b05-b98e-50c761ed56c8,Lokaram Alle,https://play-lh.googleusercontent.com/a/AGNmyxZBWwHxdkVKHa8h05HfOcx_Q8iDTPyHe9OXWEyt=mo,"Not receiving OTP, to verify phone number",1,0,176.1.2 (arm64-v8a_release_flutter),2023-04-22 11:36:42,"Hi Lokaram. Please check that the phone has enough storage, the date or time, and the SMS settings are correct. Try restarting your device once. More info here: https://goo.gle/2sG1zLq. For further assistance you can reach out to our support team: https://goo.gle/2PQQFuc.",2023-04-22 11:46:54
8e67ef26-dc70-4ecb-9c1f-c27be6039183,Togmin Pertin (Toko),https://play-lh.googleusercontent.com/a-/ACB-R5QO9ZcZChe24_-b_QaTH7hS6iGXO1XZbLHX-gsrqQ,"I am facing an issue where even though I have money in my bank account, Gpay shows all my accounts to have 0 balance. Bankers tell me that they can't resolve any issue related to any payment apps. So I haven't been able to use this app to make payments since the last 6 months",1,0,176.1.2 (arm64-v8a_release_flutter),2023-04-22 11:17:53,"Hi, there. We are sorry that you continue to have this experience. In this case, we would encourage you to contact our support team directly: goo.gle/3Q7Hcg7. Many greetings.",2023-04-22 14:53:58
8ec826d7-8723-477f-9e64-71daaa97cc47,Anjali Dey,https://play-lh.googleusercontent.com/a/AGNmyxaC052FI0hNYQ3TLpQJzUxCahXH7LHKXUy1B4L2=mo,"Dear sir/Mam, I would like to draw your attention regarding my payment issue. Please reply me, will discuss the issue on mail. Thankyou",1,0,175.1.4 (arm64-v8a_release_flutter),2023-04-22 11:14:13,"Regret the inconvenience, Anjali. We suggest you contact our specialist team for assistance on this: https://goo.gle/2PQQFuc . Our team would be happy to help.

",2023-04-22 11:34:52
48ec38ef-2264-4ce9-9d98-534e044d5d03,Kanabhai Jatiya,https://play-lh.googleusercontent.com/a/AGNmyxY1tOSy783Qgm4-QEcNGTvSDSWQDzyvsCCORZab=mo,Account could not be added problem h or Google pay costumer cair me call Kiya lekin no response 😡😡😡😡 what is this?????😡😡,1,0,176.1.2 (arm64-v8a_release_flutter),2023-04-22 10:25:30,,
916bc1c1-1645-455c-b4e7-959f62fba892,Kunwar Virendra Singh jhala,https://play-lh.googleusercontent.com/a-/ACB-R5RbTfiPDdQIaK5X-R7LUqErtOY2asto4-3BvrwFcw,i am invite my friend but g-pay dont give me a cashback bekar hai yaar useless app very worst application Don't use it Every time this say Better luck next time Every time 👎🏻👎🏻👎🏻👎🏻👎🏻,1,0,176.1.2 (arm64-v8a_release_flutter),2023-04-22 10:15:13,"Hi there. We'll surely get you that reward. Firstly, please ensure that the person you invited has registered using the link and their transaction was successful. Another thing to check is the eligibility of the referral reward here https://goo.gle/36NF6Le . If you need more assistance, our support team can be reached here: https://goo.gle/2PQQFuc.",2023-04-22 10:46:32
9c6919da-49c1-4251-b9b5-012b0603f8fb,Pravin Tule,https://play-lh.googleusercontent.com/a-/ACB-R5SuWjuMWqNrgX9_g28epesuIFYVZeOmK6qSs52XRQ,Good,1,0,176.1.2 (armeabi-v7a_release_flutter),2023-04-22 10:08:42,,
0f7bc24e-2714-4c92-bde7-aa46adb5f608,vishwash rukwal,https://play-lh.googleusercontent.com/a/AGNmyxYlxd4aUDBCx8v5zPPhsYCuG9rJao8k3bQZbDoW=mo,Better luck next time,1,0,175.1.4 (arm64-v8a_release_flutter),2023-04-22 10:05:36,,
b8557cd7-9193-4e31-aafa-6b4093977e0c,Ramesh kumar,https://play-lh.googleusercontent.com/a-/ACB-R5QknAMPNtOgpR4SK5vrCJP9FcNHBZi6KA-w8q4c-A,no proper information to downlaoad on pc,1,0,176.1.2 (arm64-v8a_release_flutter),2023-04-22 09:59:58,,
f969a6d1-07ba-4dae-ab29-ac4f207e118a,Kiran Patil,https://play-lh.googleusercontent.com/a-/ACB-R5Q6uAeKIZVQ8LDaLVg1-A6UmmibH73quXDp-LlSBg,Scanner works like camera only doesn't proceed ahead. 😒,1,0,69.0.001_RC04 (arm64-v8a),2023-04-22 09:50:54,"Regret the inconvenience, Kiran. Our team is already working on resolving the same at the earliest. We suggest you try again after a few hours. Appreciate your understanding.",2023-04-22 10:05:32
c4e92aad-37b1-4cb0-a175-cfa289c0cebb,Sujeet Kumar,https://play-lh.googleusercontent.com/a-/ACB-R5QNMl5ql3x054y-X5tcqre1WhhYjCJiDxheiVai,super 👌 app,1,0,175.1.4 (arm64-v8a_release_flutter),2023-04-22 09:50:08,"Hi Sujeet. We'd love to earn a five-star rating from you. Five stars are the best in our rating system, please let us know what we can do to get there. We appreciate your feedback!",2023-04-22 09:59:41
c319b22b-363f-46e9-9675-585ff68a5e19,Khatri Ravi,https://play-lh.googleusercontent.com/a-/ACB-R5Rvr80IhDfqP_XEaFypztj2r7Np-BVvwXWAle3f5w,"Worst app to use at night, it shows payment is stuck for couple of hours. Then I have to pay other person by other app/cash. Then Gpay will also complete the transaction. I end up paying double amount. Then they don't accept their mistake on customer support. 😰😰",1,0,176.1.2 (arm64-v8a_release_flutter),2023-04-22 09:43:48,,
f9f265ce-1f38-4c88-ab6d-7d0d25c599b2,Yash B,https://play-lh.googleusercontent.com/a-/ACB-R5Qd-_hg2h6HWYYSM6uUoRZpA7EQWBuODurY_vMpig,Qr scan not working,1,0,176.1.2 (arm64-v8a_release_flutter),2023-04-22 09:36:49,"Regret the inconvenience, Yash. Our team is already working on resolving the same at the earliest. We suggest you try again after a few hours. Appreciate your understanding.

",2023-04-22 09:47:13
34881c03-1024-4a63-855d-6f2bbc11c693,Rinku Sk,https://play-lh.googleusercontent.com/a-/ACB-R5TjSrC_RCD1Uf8vh6dnraSr5VelmwkwEcTPtKbs,Good,1,0,176.1.2 (arm64-v8a_release_flutter),2023-04-22 09:29:48,,
5e6299c5-6f7a-4798-aac5-9f0c74a2182c,Gourav Dhakad,https://play-lh.googleusercontent.com/a/AGNmyxaGlHgnD9UicOKBDDgmN-it4Ss8elvTMnwNab6V=mo,op,1,0,169.1.8 (arm64-v8a_release_flutter),2023-04-22 09:29:36,,
7cc30d1c-54fe-4ee3-b745-1b1897d120de,Aryan Gupta,https://play-lh.googleusercontent.com/a-/ACB-R5RIYOwM7aprgA6dxL2lJr6IjJNvwcIIEqh1wf7b,Very good app,1,0,,2023-04-22 09:17:25,"Hi Aryan. We'd love to earn a five-star rating from you. Five stars are the best in our rating system, please let us know what we can do to get there. We appreciate your feedback!",2023-04-22 09:37:08
b95b9b8d-0ed3-441d-9ae5-2dc0035504cc,Nazeer Hussain,https://play-lh.googleusercontent.com/a-/ACB-R5Rlxm5KWZk7_eYlMeTy3WaRk-lAos3Z1RMcXEP_D2s,"After the recent update, the QR code scanner is not working, it just doesn't nothing, other apps are working fine with the same scanner",1,0,176.1.2 (arm64-v8a_release_flutter),2023-04-22 09:15:51,"Regret the inconvenience, Nazeer. Our team is already working on resolving the same at the earliest. We suggest you try again after a few hours. Appreciate your understanding.",2023-04-22 09:38:32
c7202702-1d49-46b7-ac39-6f4ee64a64da,Mohit Verma,https://play-lh.googleusercontent.com/a-/ACB-R5SVvsETu4JEcZFW058lDsjyrUxlbD1tvpdNmFPA4Q,I am using it since 3 years. There was no problem but since few days a lot of problem is coming. Actually the app is logging out automatically and is crashing many times which is causing me a lot of trouble.,1,0,176.1.2 (armeabi-v7a_release_flutter),2023-04-22 08:51:25,"Regret the inconvenience, Mohit. Our team is already working on resolving the same at the earliest. We suggest you try again after a few hours. Appreciate your understanding.",2023-04-22 09:03:53
4c8b4364-4e46-4438-9777-b3bdf82d6ad2,Ꭰᴋ᭄ɢᴀᴍɪɴɢ᭄,https://play-lh.googleusercontent.com/a-/ACB-R5T6cqH1jXwB_k54KpxKiVtaFH113uxQpl99hIGT,Gpay has stolen my amount as 1798 rs give back my amount 😡😡😡😡,1,0,176.1.2 (arm64-v8a_release_flutter),2023-04-22 08:42:53,Regret the inconvenience. We suggest you contact our specialist team for assistance on this: https://goo.gle/2PQQFuc. Our team would be happy to help.,2023-04-22 08:49:15
297495e4-eb38-41ca-a504-4a72660dc07c,Vijay patel,https://play-lh.googleusercontent.com/a-/ACB-R5RQCL1lobksHZ-A5HBh1LMKSN4jFD94vj_Dr1rHww,Tat Tat is is.. GB Gtg,1,0,176.1.2 (armeabi-v7a_release_flutter),2023-04-22 08:33:11,,
67950e56-9b97-4edc-a6ad-1f54019e1bd9,Harish K,https://play-lh.googleusercontent.com/a/AGNmyxasHZYY9afE5cIeKeRKkUwl5xP5ic_-z5SVABgAvvQ=mo,SIGNED OUT FOR NO REASON AFTER YOUR HACKING ACTIVITY. CHECKED WHICH PLAN I TOOK AND REMOVED ACCOUNT,1,0,176.1.2 (arm64-v8a_release_flutter),2023-04-22 08:32:53,"Regret the inconvenience, Harish. We suggest you contact our specialist team for assistance on this: https://goo.gle/2PQQFuc. Our team would be happy to help.",2023-04-22 09:15:06
e7849360-4ed0-46fc-a2b5-ea3af5995312,RAHUL GUPTA,https://play-lh.googleusercontent.com/a-/ACB-R5SseE0DAujyOZ-0YBUHRcGNemPAhUpD3iiGY81L,no any reward 😕,1,0,164.1.2 (arm64-v8a_release_flutter),2023-04-22 08:23:24,,
afde620c-de8b-4128-9f19-e8f5800c63dc,Shagun sharma,https://play-lh.googleusercontent.com/a-/ACB-R5QJQnX93lnkwMoxRoHFQofFYrvr2kK9Xwweh1hA,❤❤❤❤❤❤,1,0,176.1.2 (armeabi-v7a_release_flutter),2023-04-22 08:23:09,,
2e150045-161f-4c4d-bbe8-3e5cd0b243a9,trupti panigrahi,https://play-lh.googleusercontent.com/a-/ACB-R5TI03kLiWXbmd_0Vrjr_hNido4KEzgx_2ItmPYitg,Account activation is not working,1,0,131.1.1 (arm64-v8a_release_flutter),2023-04-22 08:10:18,"Regret the inconvenience, Trupti. We suggest you contact our specialist team for assistance on this: https://goo.gle/2PQQFuc. Our team would be happy to help.",2023-04-22 09:13:24
bad21ce8-82cd-4f97-a7b0-8545e43a86f5,Sreedeep Sen,https://play-lh.googleusercontent.com/a-/ACB-R5RBYwAk-dunsBofGFM6SnuEbL6Cx7FW1mqI75fWIps,"Unable to use the QR scanner after last update. No issues with hardware, as other payment apps are able to read the QR code",1,0,176.1.2 (arm64-v8a_release_flutter),2023-04-22 07:31:30,"Regret the inconvenience, Sreedeep. Our team is already working on resolving the same at the earliest. We suggest you try again after a few hours. Appreciate your understanding.",2023-04-22 07:57:48
f2b94be6-00ad-44a4-ade2-cee4c2c420a2,BALAN P. THARUR,https://play-lh.googleusercontent.com/a-/ACB-R5T9hmIoPPnLUpuYquMTYCY29-BQ00GCqXRj2Om9D3Y,my a/c app,1,0,176.1.2 (arm64-v8a_release_flutter),2023-04-22 07:02:58,,
7e2c4825-d229-4209-89b1-6593d8f00010,Santosh Vadiraj Acharya,https://play-lh.googleusercontent.com/a-/ACB-R5R32GIhlsKx1huwKzJ9zrQbfZE9NtLMSQefwKSe2w,After update Gpay Hanging Problem And When Scanning QR Code Torch Is Not Working,1,0,176.1.2 (armeabi-v7a_release_flutter),2023-04-22 06:18:14,"Regret the inconvenience, Santosh. Please ensure that you're using the app with a stable internet connection. For more info, check out our Help Center: https://goo.gle/3aQkQu3. For further assistance you can reach out to our support team:

",2023-04-20 07:04:49
f6631ee9-3ac5-4fcb-9383-593ecdd3face,Harish Patel,https://play-lh.googleusercontent.com/a/AGNmyxYopiX8eqnwF2whGMZTLFFavkNguo7X_cf9ML-V=mo,Bekar app mene galti se unstall batan kya daba Diya na to install ho Raha hai or na to unstal,1,0,176.1.2 (arm64-v8a_release_flutter),2023-04-22 06:08:05,"Hi Harish. Currently, Google Pay is compatible with Android 5.0 or higher devices only. Also, to ensure financial security, Google Pay app works only on secured devices and not on rooted ones or on custom ROMs. For further assistance you can reach out to our support team: https://goo.gle/2PQQFuc.",2023-04-22 06:58:07
4b438f16-8af8-48cf-b75e-8272a29b9182,Tejaswini Reddy,https://play-lh.googleusercontent.com/a-/ACB-R5TrvHgi9KnaZqV2XbVcB2BEFEyrUhAG2eclNW9QHQ,We don't get code,1,0,144.1.3 (arm64-v8a_release_flutter),2023-04-22 05:47:26,,
d44eb0c2-e592-4367-8ecf-9f433744af17,Priya Sai,https://play-lh.googleusercontent.com/a/AGNmyxZYm36aYKD7YW9Ki_9YIuFqp65zwBrODxIm40C3=mo,rewards very bad,1,0,174.1.3 (arm64-v8a_release_flutter),2023-04-22 05:28:17,,
05b3034b-f9ae-4cb6-9e43-2d0088d86cde,Delon Roberts,https://play-lh.googleusercontent.com/a-/ACB-R5SA_Sm5ats-HK5w5hwJwaLIipWqqtRU9d0ETpT7,Still not able to access credit with google. I want to buy now and pay later! Please help.,1,0,175.1.4 (arm64-v8a_release_flutter),2023-04-22 05:26:17,,
be2b9f9b-2ea7-4ce9-ab47-767b97a59a5e,Faizal M.I.,https://play-lh.googleusercontent.com/a-/ACB-R5TsIb8AyD4HGlKO8O3neyUu3BDkLIJKuM2aaAH-ig,"After Gpay updated, unable to scan QR code",1,4,176.1.2 (arm64-v8a_release_flutter),2023-04-22 05:00:45,,
fe327256-aa43-4c7c-bf22-39fdec9ba8e3,Sebu Kumar,https://play-lh.googleusercontent.com/a/AGNmyxa9E3GwB4_NGH2yWJfIyuT-4rUq6vomR_IFm6Q_=mo,सेबु कुमार,1,0,,2023-04-22 04:56:35,,
ff5c2a46-4189-455e-accf-a5fb9f8d4da0,Gaurav King,https://play-lh.googleusercontent.com/a/AGNmyxa0RB9yYhXC1qQMB3m4hi6fnB5gA0ABngCXCUDI=mo,Bad app ya link netbank not yaar,1,0,166.1.5 (armeabi-v7a_release_flutter),2023-04-22 03:13:57,,
81762e7c-2b56-4972-b059-45f720899d62,Rachit Arora,https://play-lh.googleusercontent.com/a-/ACB-R5SSc96yinmilw1x8UK871R0xDiyFUiLZa6ek72xbg,Used to be super rewarding to use but not anymore. GPay: I got a bad review. GPay Users: Better Luck Next Time. GPay: Getting the taste of its own medicine.,1,0,176.1.2 (arm64-v8a_release_flutter),2023-04-22 03:08:06,,
3d6b7b09-4c25-4757-8290-9917e868351e,ARJUN RANTUNGA,https://play-lh.googleusercontent.com/a-/ACB-R5RSVwdXNVAMrcTr9q6tPiIu0ksxJqA_1UgFuXSM,Most irritating payment app,1,1,176.1.2 (armeabi-v7a_release_flutter),2023-04-22 02:55:25,,
aa9784a5-dffc-41d1-87ed-3f9e1f840f9d,Amit Mumru,https://play-lh.googleusercontent.com/a/AGNmyxbURl8UHcwL6QcWG92E7tjpfv-972pdb6hPwB4-=mo,Nice,1,1,,2023-04-22 02:36:43,,
81d3c000-2589-450e-8bb1-260a88b74467,Ansari Md Haider,https://play-lh.googleusercontent.com/a-/ACB-R5TlZUJYCVh7e9OgQRVq3O0BfTaPq6xZIZYgLJ3A5Q,After Update My Qr Scanner Is Not Working Please Google Team Do Something........,1,0,176.1.2 (arm64-v8a_release_flutter),2023-04-22 02:20:21,"Regret the inconvenience, Ansari. Our team is already working on resolving the same at the earliest. We suggest you try again after a few hours. Appreciate your understanding.",2023-04-22 02:33:13
6fa02d27-5303-47c8-8dc9-4396c74ecd07,Susan Snyder,https://play-lh.googleusercontent.com/a-/ACB-R5Qs3qiodaK4T0RPR9uGfHEDThYRh5TZXJXx01_ffg,It keeps changing access and won't pay,1,0,175.1.4 (arm64-v8a_release_flutter),2023-04-22 01:55:34,"Regret the inconvenience, Susan. Our team is already working on resolving the same at the earliest. We suggest you try again after a few hours. Appreciate your understanding.",2023-04-22 02:30:53
1321e98f-a8ed-4e8b-be82-122d83ad3c92,Dishant kaushik,https://play-lh.googleusercontent.com/a-/ACB-R5Rrgrsu_zobCMz7tzRjw5Ofi8c62YcSbxevrAPW,Its reffing systems does not work,1,0,176.1.2 (armeabi-v7a_release_flutter),2023-04-22 00:44:17,,
a3a4c280-f697-475e-95b0-6549e87653cc,Ayaan Jariwala,https://play-lh.googleusercontent.com/a-/ACB-R5RkzXAHixZGddN07VdipZ1AxOiGgGjrnPxV3F-uFbo,Payment gets stuck specially in urgent situation amt get deducted but not credited,1,0,176.1.2 (arm64-v8a_release_flutter),2023-04-22 00:43:48,"No worries, Ayaan. We can help you with this. Please follow these steps for assistance: Google Pay app - Show transaction history - Select the transaction - Having Issues - Payment issue - Follow on-screen instructions. Remember, Google Pay will never ask for any personal information over the phone, email, or any other channel.",2023-04-22 00:52:29
21b5c7d9-2a8c-4483-a807-85ab267b8491,Vishal Wankhede,https://play-lh.googleusercontent.com/a-/ACB-R5SlGZniZon_BJD0GzkIu30sj3w00wzPVGQL-jwa8w,"Issue: QR code scanner is not working (Scan or upload from gallery) after recent updates, giving ""Oops, Something went wrong!"" Message. Not working after restart, cleaning the cache. please check this bug or suggest any workaround.",1,0,176.1.2 (arm64-v8a_release_flutter),2023-04-22 00:43:03,"Regret the inconvenience, Vishal. Our team is already working on resolving the same at the earliest. We suggest you try again after a few hours. Appreciate your understanding.",2023-04-22 00:50:04
0aa36c0d-76d9-4257-9356-63d080c784a1,jasmeet singh,https://play-lh.googleusercontent.com/a/AGNmyxb-SEcKUFzPvy_VTT5bsF0-OMZvl-LcWqCW8LIC=mo,App clash when using scanner by showing error Something went wrong when open flash light This is happening after update...,1,0,176.1.2 (arm64-v8a_release_flutter),2023-04-22 00:20:54,"Regret the inconvenience, Jasmeet. Our team is already working on resolving the same at the earliest. We suggest you try again after a few hours. Appreciate your understanding.",2023-04-22 00:28:50
4e21b0ad-6eaa-4bac-a527-5f155cc7d040,Rakshith Malpe,https://play-lh.googleusercontent.com/a/AGNmyxZavzAbRalVvLCemrZ3fd41Kibmt3Pcp7siC9OF=mo,Please brothers and sister deactive this app,1,0,171.1.4 (armeabi-v7a_release_flutter),2023-04-22 00:03:05,,
52836c87-1958-40c3-b031-a78d3339d6a6,Mainak Mukherjee,https://play-lh.googleusercontent.com/a/AGNmyxb0JTzOn-ewsJpWtwiG9SUJsBJWgy4nCKyiqph-Bg=mo,After latest update app is not working.,1,0,176.1.2 (arm64-v8a_release_flutter),2023-04-21 23:54:29,"Sorry about that, Mainak. Please ensure that you're using the app with a stable internet connection. For more info, check out our Help Center: https://goo.gle/3aQkQu3. For further assistance, reach out to our support team. Here's how: https://goo.gle/2PQQFuc.",2023-04-21 23:59:48
29bcf738-6a51-400e-8d2b-92ea98ceaa60,DHIRENDRA Kumar,https://play-lh.googleusercontent.com/a/AGNmyxYiLI0QMXN0nx6WQ9GYnYOCC1KvkJfzRMfSrjEa=mo,"मैंने किसी को रेफर किया मगर मुझे रिवाड नहीं मिला,जबकि उसने रेफर कोड भी डाला और दो टान्जेक्सन भी किया, फिर भी रिवाड प्राप्त नहीं हुआ। मैने कस्टमर केयर से भी बात की मगर कोई फायदा नहीं ।",1,0,176.1.2 (armeabi-v7a_release_flutter),2023-04-21 23:45:23,,
60795843-6b89-4530-9ad9-92bcf0109ea7,vinoth vimal,https://play-lh.googleusercontent.com/a-/ACB-R5TUZcrabOhWUhP1qThoyT3GLi54olXMPYD-ukbB,"After re insert my sim, gpay not working properly and I am not done any transaction, asking and showing 24hrs time limit, but it's showing after 3 days. Please check it",1,1,176.1.2 (arm64-v8a_release_flutter),2023-04-21 23:08:24,"Regret the inconvenience, Vinoth. We suggest you contact our specialist team for assistance on this: https://goo.gle/2PQQFuc . Our team would be happy to help.",2023-04-21 23:40:17
90d88904-fd8a-482a-a29e-855e49ca76f2,Rutuja Jagtap,https://play-lh.googleusercontent.com/a-/ACB-R5SIdcGfi8q6Fqy7yZ6DHA0cwpxhEmouXjbG-S9aKA,Never gave me a single rupee in a scratch card.. This app is trash,1,0,169.1.8 (arm64-v8a_release_flutter),2023-04-21 23:04:16,,
6e6f8312-8847-4ef2-832c-18606e84a50a,Richard Shaw,https://play-lh.googleusercontent.com/a/AGNmyxavqkHj4uW3aT41dSJrIxatFj1YYEl1wpu8hM37=mo,"Got an email that my account was being locked due to not having a birthday on file, and to use tap to pay it was required that I use a lock screen on my phone. These have rendered the service/app useless, the app is now more of a hassle than just getting out my debit card. Could you find a way to make Google pay even worse?",1,0,173.1.4 (arm64-v8a_release_flutter),2023-04-21 22:18:27,"That's not the experience we want you to have, Richard. Have a look at this article on how to verify your identity: https://goo.gle/2Jy7DLk. If you still need assistance, we're happy to help you directly here: https://goo.gle/2rva9fU. Thanks for reaching out.",2023-04-21 22:49:01
e8aa3282-587e-4b30-ad05-f449d571fc21,Zitron Computers,https://play-lh.googleusercontent.com/a/AGNmyxYPiiQqbC7x1zwxlBlUM105J4qEn-jO215D9L-4=mo,when ever I get scratch card it shows me better luck next time no matter what Eva high amount I transfer very hopeless,1,0,175.1.4 (arm64-v8a_release_flutter),2023-04-21 22:10:35,,
da989aa8-b154-4051-9738-1e9d0e1b4cf4,Servjeet Singh,https://play-lh.googleusercontent.com/a-/ACB-R5RyZ64yjerwxSMpyzhP89tKen7SYL5p2dwJGqFrnQ,Battery draining very fast after latest updates.,1,0,,2023-04-21 21:53:18,,
8754ebae-65da-4a45-b549-de1121279314,Sujal Bhesare,https://play-lh.googleusercontent.com/a/AGNmyxaPnpA2IqB8Mt5F18cPgeTthDb1WkclUEQDutm2=mo,Card type not accepted in rupay credit card or debit card please solve the problem,1,0,,2023-04-21 21:51:51,"Thanks for reaching out, Sujal. We've noted your feedback and passed this along to the team to look into it. Appreciate it.",2023-04-21 22:15:39
980a43d0-c14c-4908-b1ba-8619ed0d18c7,Satendra Singh,https://play-lh.googleusercontent.com/a-/ACB-R5QWVGecWUkmbY5VTRFyNbQQiOjiaX96L3Zkn9bTNw,Phone QR scanner not able to read the QR and even upload of QR not accepting. Always has error - oops! Something went wrong.,1,1,176.1.2 (arm64-v8a_release_flutter),2023-04-21 21:51:35,"Regret the inconvenience, Satendra. Our team is already working on resolving the same at the earliest. We suggest you try again after a few hours. Appreciate your understanding.",2023-04-21 22:18:18
74cdd306-371b-48ae-b47a-746290a0a17f,Shivani Pansare,https://play-lh.googleusercontent.com/a-/ACB-R5TN75NCvtac2XXx_Nfpz3Cv72uLc1S3GyzNcv_27g,After updating app I am not able to scan QR code from gallery..,1,1,176.1.2 (arm64-v8a_release_flutter),2023-04-21 21:51:20,"Regret the inconvenience, Shivani. Our team is already working on resolving the same at the earliest. We suggest you try again after a few hours. Appreciate your understanding.",2023-04-21 22:15:29
09e8714a-acdd-422d-9dbf-bcff0f975497,Rohit Thakur,https://play-lh.googleusercontent.com/a/AGNmyxZ1gAQ72uGkoj7paJX7UB-u3M9DdaI0k6-aqt9m=mo,Very poor and slow,1,1,,2023-04-21 21:41:01,"Sorry about that, Rohit. Please ensure that you're using the latest version of the app. For more info, check out our Help Center: https://goo.gle/3aQkQu3. For further assistance, reach out to our support team. Here's how: ﻿https://goo.gle/2PQQFuc.﻿",2023-04-21 22:01:34
3461afaa-026a-4295-98c7-29aa5823dfa2,aman thakur,https://play-lh.googleusercontent.com/a/AGNmyxbUiIap1v_kKsg0pgpdGwyr2_fOABpEyoCpr2LbpA=mo,"hi, after update QR code scanner not working.Please look into this issue ASAP.",1,1,176.1.2 (arm64-v8a_release_flutter),2023-04-21 21:39:55,"Regret the inconvenience, Aman. Our team is already working on resolving the same at the earliest. We suggest you try again after a few hours. Appreciate your understanding.",2023-04-21 21:46:45
ea09f5f6-c524-4279-9f6f-8868557df358,Ramesh bhesare,https://play-lh.googleusercontent.com/a-/ACB-R5QYglNEG-P7ysqMcnGAudodlwkSo_9g5C3i4ln3Aw,Card type not accepted that's problem,1,0,176.1.2 (arm64-v8a_release_flutter),2023-04-21 21:31:09,"Regret the inconvenience, Ramesh. We suggest you contact our specialist team for assistance on this: https://goo.gle/2PQQFuc . Our team would be happy to help.",2023-04-21 21:41:52
5627e411-217c-46ef-b7ae-2de1b120d6c4,Neetika Verma,https://play-lh.googleusercontent.com/a/AGNmyxZ_3P9JIAB12-1kxc8MZ42DID1S0wYRoFfWEnyZ=mo,"I am using this app before 4 year. It was working great at that time but now it works very badly, please don't use this app.",1,1,176.1.2 (arm64-v8a_release_flutter),2023-04-21 21:14:36,,
393599d0-99ae-4f14-8cbe-0d69742548d1,DINABANDHU GORAI,https://play-lh.googleusercontent.com/a-/ACB-R5QeW4f_D1VVTF4BrRIS8KC6lGlJdSsCw-l2HIpR,I did a fund transfer on 17.04.2023 at 12:24 PM of 30K but it failed.Still now the amount has not been credited to my account.I lodged a complaint to the customer support with bank statement but no response has been provided from their end.Horrible incident.careless unethical unprofessional attitude.Needs to use more professional and reliable platform instead of GPay.Be careful users...,1,1,176.1.2 (armeabi-v7a_release_flutter),2023-04-21 21:11:40,,
b34e5133-7acc-4bb4-a83b-7532affcff27,Amar Ukhalkar,https://play-lh.googleusercontent.com/a-/ACB-R5TP5S9RBygTKB6ZNLiMWbWOInWXWFMzYnM4YUCqIow,"After last update, QR scan stoped working.",1,1,176.1.2 (arm64-v8a_release_flutter),2023-04-21 21:01:48,"Regret the inconvenience, Amar. Our team is already working on resolving the same at the earliest. We suggest you try again after a few hours. Appreciate your understanding.
",2023-04-21 21:05:55
7498c9ba-0b5e-4814-91d7-25f0ddc1f28c,Roshan Tambe,https://play-lh.googleusercontent.com/a-/ACB-R5QWnKUWR2HDsgqOSvCIg39E794vWL7mUxMX2RSaPEQ,Bugs while Scanning QR codes,1,0,176.1.2 (arm64-v8a_release_flutter),2023-04-21 20:26:04,,
368a3d3d-4839-44cc-8ef7-6fd2d8ff5ffe,Murtaza Saifuddin Paperwala,https://play-lh.googleusercontent.com/a-/ACB-R5TlDIiXLo-bP2uzArKLpdtnhyUULbVxbu1Zc7Ex05g,not able to scan the QR code for payment after the latest update,1,0,176.1.2 (arm64-v8a_release_flutter),2023-04-21 20:21:32,Regret the inconvenience. Our team is already working on resolving the same at the earliest. We suggest you try again after a few hours. Appreciate your understanding.,2023-04-21 20:26:35
23233b9d-1ac0-4c32-9b0e-63a3036fb5a9,Antony samy Samy,https://play-lh.googleusercontent.com/a/AGNmyxZAOtwFQ-JxGLc_JZjrdScYJh1WHccfKvmHnJmQ=mo,7⅞7,1,0,143.1.1 (arm64-v8a_release_flutter),2023-04-21 20:14:02,,
b60b0d1f-0605-4d9c-8feb-6dbdbfbd27cf,Sathis Kumar,https://play-lh.googleusercontent.com/a-/ACB-R5TvuLm4WxJI72AI_z1cSTNlMVY3mppgYFDRqR3ohA,no useful rewards.& no cash back. waste,1,1,173.1.4 (arm64-v8a_release_flutter),2023-04-21 20:06:23,,
6262f478-dc89-4601-9fc3-b1eb8c632b05,Prachujyo Sarmah,https://play-lh.googleusercontent.com/a/AGNmyxZg0iRTeUdcc910lr5SfnDQoXceyOtTVtv7saxz=mo,Cannot scan QR code anymore wth,1,0,157.1.3 (arm64-v8a_release_flutter),2023-04-21 19:54:04,"Regret the inconvenience, Sarmah. Our team is already working on resolving the same at the earliest. We suggest you try again after a few hours. Appreciate your understanding.",2023-04-21 19:59:30
