reviewId,userName,userImage,content,score,thumbsUpCount,reviewCreatedVersion,at,replyContent,repliedAt
271c4a17-2a2f-4fff-879e-bf58c910f28e,kiranmai nekkanti,https://play-lh.googleusercontent.com/a-/ACB-R5TfFHsSjDdg_-0aeoOBxOFrijfbHm_OSd1qpkWKbw,Fraud app.... Iam paid the credit card 11000/- payment. But i entered worng credit card number. My amount is not refunded and help center also neglected this issue. Fraud,1,0,22.58.0,2023-04-24 10:45:04,"Hi Kiranmai, that's not good. Please connect with us via feedback@mobikwik.com and let us know about your experience. It will help us to serve you better. Thanks!",2023-04-24 14:49:05
8b306506-86eb-4a0d-a288-f85a52546db3,Dhanraj Suryawanshi,https://play-lh.googleusercontent.com/a-/ACB-R5RGrJ62C5o-CMlUgoEvDOq1j2Wl1uYO2mVoeyN7OA,Faltu,1,0,22.58.0,2023-04-24 10:40:11,"Hi Dhanraj, we want to what went bad. Kindly share your contact details at feedback@mobikwik.com so that we can assist you better. Thanks!
",2023-04-24 13:15:17
53a5a969-6db6-4ebe-b23a-a4a3980392f5,Pavan boxer,https://play-lh.googleusercontent.com/a-/ACB-R5R6MMnLiWkTLHPTYNwsZTZF-x1GSr5ETBkOWLPE,Verey bad experience loan amount was 60k 30k i withdraw March 4th still today April 24 loan amount still not received my account they told technical issue in Fullerton india company in Last 2 months all most 20.30 coustomer care not responding praporlly vaishali still telling call ayega maneger se all coustomer care told me this but no response supervisor Neha lali store manager not responding still at 24th today,1,0,22.58.0,2023-04-24 10:31:15,"Hi Pavan, we want to know what went wrong. Kindly connect with us via feedback@mobikwik.com and let us know about your experience. It will help us to serve you better. Thanks!
",2023-04-24 14:34:33
fa5ec166-b8f9-4dbc-9a79-b8fc75fc565a,Atul Modani,https://play-lh.googleusercontent.com/a-/ACB-R5T8Sh_5fLXo5nmBwML1hqnOqOlbJFUqH_GU4LaPSA,Worst app. Charges exorbitant penalty and charges.,1,0,22.58.0,2023-04-24 10:17:58,"Hi Atul, we would like to know what went wrong. Kindly connect with us via feedback@mobikwik.com and let us know about your experience. It will help us to serve you better. Thanks!
",2023-04-24 14:28:49
e13b0d39-cd6f-403c-93cf-cfbe1f1ad643,Srikanth Nayak,https://play-lh.googleusercontent.com/a-/ACB-R5QuKjpE1GFptuLEYfauL8TsoNnMpxAFiYqOpn90Hg,"Unable to withdraw the loan amount. When Calling customer care, our number goes to a fraudsters and they will call us try to access our accounts. There are much more fake customer supports available for Mobikwik in Twitter and Google and many more places. Everything is happening fraud all around the world.",1,0,22.59.0,2023-04-24 10:12:29,"Hi User! Apologies for the trouble caused. We are here to assist you. Please write your concern at feedback@mobikwik.com. We'll get back to you promptly.
Team MobiKwik
",2023-02-28 15:02:17
5026e0aa-1922-421a-8939-c8ca61030e32,Sameer Khan,https://play-lh.googleusercontent.com/a-/ACB-R5S0Ghky-ct1mFyt5gOdaS6q6WZ2SepWN3irSCs3mQ,this is froud aplication i paid credit card payment but my payment is no upadte my credit card where is my money...,1,0,22.58.0,2023-04-24 10:03:38,,
e3964d84-084a-4821-85d8-ecd9576c6d6d,Srinivas panem,https://play-lh.googleusercontent.com/a-/ACB-R5Rs0BSIQs2cWNuBL3zwGR_n_ffJCGWMAQEKr0NzwQ,"Worst app, no customer care, high interest, even after paying the dues they keep sending messages. Please don't use this app. I don't want to give single star also.",1,0,22.58.0,2023-04-24 09:47:44,,
359ca10a-89fb-47fa-8a76-79c902a48313,Teri jaan Yt,https://play-lh.googleusercontent.com/a-/ACB-R5Rv-PLFytVR6UVKpnQ2jF1JF62wgNtBvb7-P-K3,Good,1,0,22.59.0,2023-04-24 09:30:14,,
2be9724c-6c7a-4113-b406-f85f2d1283c4,Sk.Zubair Ali,https://play-lh.googleusercontent.com/a-/ACB-R5RzOLx1q3n84Ah8TqCBf471-I1WyR81aqAds2m8yg,Worst app not able to get another loan after completing my first loan not recommended.,1,0,22.59.0,2023-04-24 09:01:41,,
11c26e82-9511-4d8a-a201-a14b825b0bbb,Deepak Kabra,https://play-lh.googleusercontent.com/a-/ACB-R5TsSQbn6X_SyX2Ji2ER2mh4KeWvbpFCtiP9QIFOeg,Money deducted but not received to merchant... After many complain no reply.. They told talk with merchant... Please reply where's my money... Poor customer care services,1,0,22.58.0,2023-04-24 08:36:19,,
e2717234-cc3c-47f4-af78-3ea1da114353,Jayakumar gnanaprakasam,https://play-lh.googleusercontent.com/a-/ACB-R5SqeGTAmhoLUXfv8HkGp6u6jSUdAzsWMa-O2B1vdg,Hi Team... I have paid rent using my debit card.. Amount got debited from my account it's not credited to my landlord account.. it's going to be more than 12 hours.. Still the request showing it's pending,1,0,22.58.0,2023-04-24 08:28:08,,
84af6c07-2ba2-48d8-aeb9-0bef6d9e860d,Sharad Ighare,https://play-lh.googleusercontent.com/a-/ACB-R5R7DE3gA-2ysupYL_pTTWkD6r54FJBx2cwP4QZrnw,Cheap.....Do not use this app.,1,0,22.58.0,2023-04-24 08:07:00,"Hi Sharad, we would like to know what went wrong. . Request you to kindly connect with us via feedback@mobikwik.com so that we can assist you better. Thanks!
",2023-04-24 16:59:42
9ffba7f2-181e-4ef7-a9ad-3cbca56caa20,john cas,https://play-lh.googleusercontent.com/a/AGNmyxaQ5oHvEkldHk0lNhK6E434Fvbrsl1Su3os4etO=mo,Worst app paid all my emi last year only but unable to get new loan offer,1,0,22.51.1,2023-04-24 08:04:31,"Hi John, that's not good. Please connect with us via feedback@mobikwik.com and let us know about your experience. It will help us to serve you better.

",2023-04-24 16:19:40
37e0cea6-b201-4f17-b10e-7e638d2b7269,محمد علیم الدین,https://play-lh.googleusercontent.com/a-/ACB-R5S08lODumKcZLZLO719x30dAJPN0XkiM1xf-ujF3g,Since 1 year zip services are down I am unable to use zip,1,0,22.55.1,2023-04-24 07:30:44,,
69de4e13-22e5-4733-8caf-12998e300cd2,Vijay Kumar Verma,https://play-lh.googleusercontent.com/a-/ACB-R5Rz_I4MRs-2n_HlLExit7R8veOCeIbiE_OkNN5MsJY,Very poor service,1,0,22.58.0,2023-04-24 07:18:58,,
1fe3a21e-1775-4b75-beab-c9097254036f,Grhfbfb Xvcvg,https://play-lh.googleusercontent.com/a/AGNmyxb-YfSwy5EjxHFNoQl_mXMH8XCpSqJG35t59_2B=mo,3 days done lone approved but money not added in my account...,1,0,,2023-04-24 05:19:08,"Hi, we would like to get this checked. Kindly connect with us at feedback@mobikwik.com with your complete concern so we can check and enhance your experience with us. Thanks!
",2023-04-24 14:45:12
f7007d6d-a841-4e61-86d0-47954b1fc65d,Sandeep Shirke,https://play-lh.googleusercontent.com/a/AGNmyxZbfghFo6dlHe4unSq1GpWWvY2ksiIfKRC94_vN=mo,Mobikwik is a pathetic app not able to transact any amount to any UPI ID. When you are changing more than 2.5 to 3% per transaction then why there is only 50 transfer limit per month.Actually I wanna give 0 stars out of five.,1,0,22.58.0,2023-04-24 03:11:33,"Hi Sandeep, we'd like to learn more about your experience to improve our service. Request you connect with us via feedback@mobikwik.com It will help us serve you better.
",2023-04-14 18:00:27
7cd210da-d638-4d3b-ae1a-8802f83f47fa,Varaprasad Kambhampati,https://play-lh.googleusercontent.com/a-/ACB-R5SMV2HY1E0IWoYjqpH6wrSQ25imKoF67w3t-vFirS8,I paid all my dues in mobikwik zip emi loan.. after paying you guys not offer a loan to me.. cheating me..,1,0,22.31.6,2023-04-24 01:53:55,"Hi Varaprasad, we would like to get this checked. Kindly share your contact details with us via feedback@mobikwik.com so that our team can reach out and discuss this with you. Thanks!
",2023-04-24 14:13:48
5f50acd4-b990-4614-ae88-a307510d3a7d,Rasho and Pantu,https://play-lh.googleusercontent.com/a/AGNmyxZN_U0ZsZVIGuSkWSUUIB7b1RLExnvZ6cPPEHo=mo,My money in wallet and I am supposed to pay fees to transfer to my own bank account. Such apps must be banned.,1,0,,2023-04-24 01:42:46,"Hi Rasho, we would like to get this checked and help you further for your concern. Moreover, request you to kindly connect with us via feedback@mobikwik.com so that will help assist you better. Thanks!",2023-04-24 14:54:38
4d7aa152-2469-4cd1-97da-a09326b49ddf,Kaif Baig,https://play-lh.googleusercontent.com/a-/ACB-R5Q9tVe4S-f4tTy8wNb7W3haSBH1h1QMUTw59w-B,Bahot kharab apk hai,1,0,22.58.0,2023-04-24 01:19:47,"Hi Kaif, we are always working towards customer satisfaction. Please connect with us via feedback@mobikwik.com so that we can assist you further. Thanks!
",2023-04-24 16:18:13
1476c861-998b-47a9-a5d9-0ca871acb2b3,dhirendra pathak,https://play-lh.googleusercontent.com/a-/ACB-R5Q2mo1KQqYFsJMcDWBYptKKev4gYtLheXueINZ4,Chor bank hai customer ka Paisa kaat ke returned nahi karta hai,1,0,22.58.0,2023-04-24 00:17:00,"Hi Dhirendra, that's not good. Please connect with us via feedback@mobikwik.com and let us know about your experience. It will help us to serve you better. Thanks!",2023-04-24 16:36:07
bee64e15-cea5-447d-beb6-d6e2347dd770,Vicky nani,https://play-lh.googleusercontent.com/a-/ACB-R5SmzVlcCLLAlWp6UFEPX9CtfJUWJ5ZQ-A603gcdyw,"Zip is very bad experience. If we use mobikwik as payment gateway automatically zip balance is utiliing in ajio app. So, immediately i cancelled the order refunded back in with in 7days that is 22nd 23rd April 2023, With in 6days i got due date 20th april and after 1day due date 700rs above penality daily daily late fee charges. For 3800rs 14th April used by zip automatically in ajio app. I contacted somany times customer care, they saying don't have option to waiver penality charges. Very bad",1,0,22.59.0,2023-04-24 00:04:50,,
b9dd9128-41b2-4ddf-836c-b79e287acde9,Sarfraz Patel,https://play-lh.googleusercontent.com/a-/ACB-R5Q_yTCLXSeR4pJr_e9SvTJG1kdOCH4FYXQmUFXnpQ,Dont use aap i paid but steel company call me.and thay take my data and blackmail and dirty image to send my family pls don't use i have all screen shot to payment pls don't use this aap..,1,0,22.58.0,2023-04-23 23:50:53,"Hi Sarfraz, we would like to get this checked. Please help us with your registered wallet details on feedback@mobikwik.com so that we can get this checked and assist you further. Thanks!",2023-04-24 13:19:10
c7f00e12-cafc-476b-be4d-05ec5108e7e8,PAVAN KUMAR,https://play-lh.googleusercontent.com/a-/ACB-R5Qe0WGWum-A8NqVYZwRTznEtWcS1lqTYTgZeBwZcPg,"मेरे द्वारा उपयोग किए गए सबसे खराब ऐप में से एक। कोई उचित ग्राहक सेवा नहीं। जिप लोन के संबंध में, जब हम जिप से कोई लोन लेते हैं और कोई फोरक्लोजर विकल्प नहीं होगा (3 महीने के बाद भी)। जिप लोन को फोरक्लोज़ करने के लिए लिंक प्रदान करने का अनुरोध करने के लिए हमें कई बार ग्राहक सेवा के लिए कॉल करने की आवश्यकता होती है। फिर भी वे लिंक नहीं देंगे और एक ही बात कहते रहेंगे जैसे ""हमने इस मुद्दे को आगे बढ़ाया है""। बेहतर होगा मोबिक्विक के इस्तेमाल से बचें, क्योंकि मोबिक्विक से बेहतर कई छोटे ऐप हैं।",1,0,22.58.0,2023-04-23 23:18:49,"Hi Pavan, Hum iske jaanch karavaana chaahenge. krpaya apane panjeekrt volet vivaran ke saath hamaaree sahaayata karen taaki ham isakee jaanch kar saken aur aage aapakee sahaayata kar saken. dhanyavaad!",2023-04-24 16:34:57
ecae0f39-bc49-4ea2-ba67-cb5f7f0804b7,Tanvi Kamboj,https://play-lh.googleusercontent.com/a/AGNmyxbFe8olz8KSRvaMtsdNM0IkujLzEKZGV2cwfq9s=mo,Ghatiya app hai. Mera upi nahi chal rha or na hi Inka customer support achha hai. Mene net se number leke call Kiya to 26 min hold pe bithane ke bad call uthaya or bta diya ke app mein jake help & support pe jake aise complaint raise karlo or us complaint ko bhi 3 din ho jayege kal wo bhi abhi tak pending hai isliye 1 se niche star hota to wo deti is ghatiya app ko,1,0,22.59.0,2023-04-23 22:37:42,,
cab77464-50d4-4e30-8a45-7aeda12d24c8,abhishek anurag,https://play-lh.googleusercontent.com/a/AGNmyxYcyHbrB15SrxTml_m8s4XgAV2ET7y1pWlMBWDi=mo,Worst service. For every cashback you have to file a complain. They will not provide any cashback. Even if you follow all the t&c then also you will not get the cashback. Even after providing the screenshot of the transaction and many more they told the t&c is not followed.,1,0,22.38.4,2023-04-23 22:25:03,"Hi Abhishek, we want to know what went wrong. Please help us with your registered wallet details via feedback@mobikwik.com so that we can get this checked and assist you further. Thanks!",2023-04-24 16:32:51
bc48870d-1d39-4e6b-8d00-089238e868a1,Suri Surya,https://play-lh.googleusercontent.com/a-/ACB-R5TdlSZ1RBT5We66aIxBjVYfblOZrwHHhyuDW63Foz8,My mobikwik is not showing electricity bill payment option. Doing this is very difficult for Mobikwik users,1,0,22.58.0,2023-04-23 19:36:19,"Hi Surya, we would like to get this checked. Please help us with your contact details with us via feedback@mobikwik.com so that our team can reach out and discuss this with you. Thanks!
",2023-04-24 16:00:15
5d1e9517-cc73-4be1-a1af-aa0791e4a762,Durgesh Tiwari,https://play-lh.googleusercontent.com/a-/ACB-R5RCcq2EBbWRnq5XwqtPZFT1Y6M_JlaCHNaU4CNiYg,Bad application I am experience last 2 months aplication not proper work not touch pad work any opinions in mobikwik application,1,0,22.58.0,2023-04-23 18:52:20,"Hi Durgesh, we are always working towards customer satisfaction. Be rest assured, we will get this issue sorted at the earliest. Please connect with us via feedback@mobikwik.com so that we can assist you further. Thanks!
",2023-04-24 14:17:23
3726127f-efb3-43dd-bbb1-9cd2c89184bc,Jagadish saren,https://play-lh.googleusercontent.com/a-/ACB-R5R1Q_fkSX3kRSRhGyxZFFaZ8wO7EXse7X3lTqCb,Zip payment system is not good.... We need full month bill ..not semi month bill,1,0,22.58.0,2023-04-23 18:01:10,"Hi Jagadish, we have taken note of your feedback and the same will be shared with our respective teams. Moreover, you can connect with us via feedback@mobikwik.com with any other concern. Thanks!",2023-04-24 14:37:47
8ceaf77d-fd6e-4f3a-a15a-1b5c59a6eba8,Vicky Veera,https://play-lh.googleusercontent.com/a-/ACB-R5QCA1JC5CBvqkkSPjmk1jwEjcwJP_z1CrBSSEcYhg,Thiruttu thevudiya paiya app,1,0,,2023-04-23 17:56:57,,
543affd3-6c95-4b92-b034-453c486454ea,Vinod Kumar,https://play-lh.googleusercontent.com/a-/ACB-R5SYL67j6FO6U1mD94eXo6q7YXA4z_aKpqkMRf1NNA,Very bad experience block my zip account 6 month,1,0,22.58.0,2023-04-23 17:55:34,"Hi Vinod, please help us with your registered wallet details via feedback@mobikwik.com so that we can get this checked and assist you further. Thanks!",2023-04-24 15:14:26
6d56c901-a2b9-417e-b872-19588d55792d,Deepak Mahaur,https://play-lh.googleusercontent.com/a-/ACB-R5QkccIHNdrhmPblpC8sgQwxCOaUf7zidjsQ8Ytq,"21/03/23 and 21/04/23 I had do two transactions and applied a full payment coupon code with before completing a transaction.and I am already registered a complaint on your customer care number. His is say ,sir I forwarded your complaint to cashback department.but I am got any type of cashback. So it wasted time and worsted application.",1,2,22.58.0,2023-04-23 17:19:55,"Hi Deepak, we are always working towards customer satisfaction. Be rest assured, we will get this issue sorted at the earliest. Please connect with us via feedback@mobikwik.com so that we can assist you further.
",2023-04-24 13:24:20
5c74ced7-f152-4062-a172-8d1e9d17a394,Pihu Roy,https://play-lh.googleusercontent.com/a-/ACB-R5RksElhyTU_azvn1ObqAlzbDUnCD-7XI9j0Eh-S5Q,Literally charged Rs 300 for 1 day delay fee.. and there was barely any notification.. stupid app😒,1,1,,2023-04-23 17:14:46,"Hi Pihu, we would like to get this checked. Please connect with us via feedback@mobikwik.com and let us know about your experience. It will help us to serve you better.

",2023-04-24 13:17:01
580610f7-11d5-424e-8d38-80af805228b0,RANJEET SINGH,https://play-lh.googleusercontent.com/a-/ACB-R5ShkWPasrt_cgzRfjViGCWmDCFKab9DIUZIlTtY,good,1,0,22.58.0,2023-04-23 17:14:35,"Hi Ranjeet, we are concerned about the low rating. Kindly connect with us via feedback@mobikwik.com and let us know about your experience. It will help us to serve you better. Thanks!
",2023-04-24 16:36:58
67bdfe37-ec48-40d3-9168-31a5f1023ed2,Ankit Baswal _0741,https://play-lh.googleusercontent.com/a-/ACB-R5Q6gW5KjQQ1Bde5l7lmGJw5iOtfAHSicAcbBK2u,"Worst app experience I'm trying to disable zip pay from 1 year but it is not disabling, else they are sending text messages and emails regarding zip money payment and late charges etc .",1,0,,2023-04-23 16:58:34,,
7b54d9b2-7936-4e2f-b073-39e3b830a321,SRIDHAR SAHU,https://play-lh.googleusercontent.com/a/AGNmyxZcxzWp9FZiAF1KoGlpEX3eW-11waeJHcGVmuF3=mo,BEKAR APP FULL,1,0,,2023-04-23 15:39:23,"Hi Sridhar, we want to know what went wrong. Kindly connect with us at feedback@mobikwik.com with your complete concern so we can check and enhance your experience with us. Thanks!
",2023-04-24 15:13:10
000de169-af4b-4359-bbb3-5cc077155374,Buddala Reddy,https://play-lh.googleusercontent.com/a-/ACB-R5SX6atx0olWLVep6i0GgJLgMYI6K1Ur1d-GVm9C,One of the worst app. I am not able to restore my bank account,1,0,22.59.0,2023-04-23 15:22:54,"Hi Buddala, we want to know what went wrong. Please help us with your registered wallet details at feedback@mobikwik.com so that we can assist you further. Thanks!",2023-04-24 13:35:03
4bfc337e-6f88-4d3d-a601-00bc3a0023a1,VADDE VENKATESULU,https://play-lh.googleusercontent.com/a-/ACB-R5QHzMfyb5TyVXn-_dsGJTiND1KIjOEI4S5VCghgKGQ,worast app this is Prod app don't use this app I'm use this app loose money please don't use this app 🙏🙏🙏,1,0,22.52.3,2023-04-23 15:00:51,"Hi Venkatesulu, we want to what went wrong. Please connect with us via feedback@mobikwik.com so that we can assist you further. Thanks!",2023-04-24 13:13:56
8b40744a-de8b-484a-b329-acc5b5dc9d21,raushan,https://play-lh.googleusercontent.com/a/AGNmyxZKnvMXMW4f2f3B_LuYUANYNPh3Z2bV-HLtL5y-=mo,"Credit cards notificationssssssssssss🔔🔔 बहुत बार आता हैं। इस app का mobile recharge +others recharge g pay, paytm se महंगा है l Please इसे downlod ना करे और कर लिया है तो मेरी तरह आप भी ऐसे exprieance share करे 🙏🙏 !!",1,1,22.58.0,2023-04-23 14:15:42,"We regret the inconvenience caused and are here to make things right for you. Kindly share your contact details at feedback@mobikwik.com so that we can assist you better.
",2023-04-22 23:21:44
fce76c11-cf88-4927-b6c0-1c74cb774e6d,Ravindra Ravi,https://play-lh.googleusercontent.com/a-/ACB-R5RIp18CkcE4aj5XpUXg2PCi9r8c_EEQQjzkihNPfQ,Data cannot be deleted worst thing,1,0,22.55.1,2023-04-23 13:50:40,"Hi Ravindra, we would like to get this checked. Please connect with us via feedback@mobikwik.com so that we can assist you further. Thanks!
",2023-04-24 16:28:04
e55c01b4-f889-4c4d-b107-f930ed79c742,Saif Saif,https://play-lh.googleusercontent.com/a-/ACB-R5TQFKl5n5v46PMA0cZjBRvVd6tK_IkZj8OJeQ8CBQI,My loon problem,1,0,22.58.0,2023-04-23 13:42:49,"Hi Saif, we are here to resolve your problems. Please connect with us via feedback@mobikwik.com so that we can assist you further. Thanks!
",2023-04-24 13:32:19
2ed0d3c1-1e41-494a-85a0-6c20130b7c65,pankaj vashisht,https://play-lh.googleusercontent.com/a/AGNmyxbyHbltrTGD95LTBqcY39EYrc2GoIZVlpRgGIB5=mo,Fraud application I have done transation of 165 rupee in which he included 199 rupee activation and my bill generated on 16 of month it's my first time I thought it was like Amazon pay aur flipkart pay but they give mein penalty after 4 days after generation of bill and the penalty amount is 301 so I just gave 665 rupees for my 165 rupee tranctions,1,0,,2023-04-23 13:26:35,"Hi Pankaj, we would like to get this checked. Please connect with us via feedback@mobikwik.com along with your registered wallet details so that we can assist you further. Thanks!",2023-04-24 13:36:45
70402993-9de5-4dd4-8272-ff45ecd99d70,Komal Vijay,https://play-lh.googleusercontent.com/a/AGNmyxZ0X_DA8vuqp1dmg7Osr6qcbrFO1Ar7THdd7oK_=mo,Frustrating Start Up with Mindless Policies and Customer Care They don't reply or provide any resolution all time customer care team says you will get email SMS Pending partner Lendbox is a fraud like Mobikwik and same method to collect money without service zip emi loan not letter forclose at all hence do not use it,1,0,22.58.0,2023-04-23 13:20:04,"Hi Komal, this is not good. Please connect with us via feedback@mobikwik.com so that we can assist you further. Thanks!
",2023-04-24 13:33:34
40ea98ea-36e0-4476-bff1-ce503998c734,Balaji online,https://play-lh.googleusercontent.com/a-/ACB-R5Qb93jYm2CowiclO5NtQeYygOftqNiDeOEkclFj,Sabse bakwas app hai koi use Mt karna,1,0,,2023-04-23 13:09:38,"Hi, that's not good. Please help us with your contact details with us via feedback@mobikwik.com so that our team can reach out and discuss this with you. Thanks!
",2023-04-24 14:04:38
89c842af-6fc6-4866-b0df-fbe5e2aa8c2f,SUROJIT BHADRA,https://play-lh.googleusercontent.com/a-/ACB-R5QDGiPG0J7qnK_yHvuTQd8nr5DSHACrYwgAAowL,Very bad app,1,0,,2023-04-23 12:51:42,"Hi Surojhit, we are always working towards customer satisfaction. Be rest assured, we will get this issue sorted at the earliest. Please connect with us via feedback@mobikwik.com so that we can assist you further. Thanks!
",2023-04-24 15:05:28
be540810-b77e-4c3e-8d07-1898666681cd,Ramu Ch,https://play-lh.googleusercontent.com/a/AGNmyxa8JQdPAlSYlhEiMxL8zxlktVxgss1JKcy0gS8C=mo,Very very bad experience with this app... Not safe. Don't use it,1,0,22.58.0,2023-04-23 12:44:04,"Hi Ramu, this is not good. Please connect with us on feedback@mobikwik.com so that we can assist you further. Thanks!
",2023-04-24 13:51:58
88435800-b759-465e-902c-b82a9cdee2f2,Lal krishan Singh,https://play-lh.googleusercontent.com/a/AGNmyxaF52pxRiuoFdSw4IHZLEAIMKGAgAfm5oST4Irb=mo,Fake offers,1,0,22.58.0,2023-04-23 12:36:32,"Hi Krishan. we want to know what went wrong. Kindly connect with us via feedback@mobikwik.com and let us know about your experience. It will help us to serve you better. Thanks!
",2023-04-24 13:50:51
93aab33f-c88c-4c0b-b26b-1cbc26f570ae,Sanjeev Kumar,https://play-lh.googleusercontent.com/a-/ACB-R5T4U2suikhcT21EZfz9B1Z6pw9q9XSuwOMJBE982Q,"The worst than worst app ever I used. They do not care about users. I am unable to perform my KYC and their customer care said that they could not help on it. Indirectly they said ""do not use this app just move on"". Rediculous. I would rate it in minus 5.",1,0,,2023-04-23 12:33:18,"Hi Sanjeev, we are here to help you. Request you connect with us via feedback@mobikwik.com It will help us serve you better. Thanks!
",2023-04-24 13:49:54
e7371bad-016a-45a2-a911-031b83c548c1,Uvathidesigner vlog93,https://play-lh.googleusercontent.com/a/AGNmyxYGRAnymZ3xqVPiYV1STD3mhJHS2VcIoII5DFCi=mo,Totally waste.. could not accept kyc and any document.. need to improve lot.. don't waste our valuable time.. want to grown up.. not be a kinder garden guys.. 0 rating,1,0,,2023-04-23 12:22:36,"Hi Uvathi, we would really like to get this checked. Request you connect with us via feedback@mobikwik.com to help us serve you better. Thanks!
",2023-04-24 14:03:30
bfeadaa0-0d49-4787-8dce-70e151fcb1e6,Only Neet,https://play-lh.googleusercontent.com/a-/ACB-R5TBK18zLkUmOf4nw7l5fsldFZDw2vErso7Ds2JF,Bakwas,1,0,,2023-04-23 12:16:32,"Hi, we want to know what went bad. Please connect with us via feedback@mobikwik.com so that we can get this checked and assist you further. Thanks!",2023-04-24 14:01:11
cad41928-6f0a-4fe9-b486-e7f3f77cfa2b,a m songs,https://play-lh.googleusercontent.com/a-/ACB-R5SST_4MweLzivlpO0HV-GFnq4BrQT7KDL8VdQx8,Ye mobikwiik mera credit report khrab parstut karta he,1,0,22.58.0,2023-04-23 11:33:03,"Hi, we would like to get this checked. Please connect with us on feedback@mobikwik.com so that we can assist you further. Thanks!
",2023-04-24 13:40:26
51b712f7-6877-461f-bf57-abc581c7bd73,Manveer Kulhari,https://play-lh.googleusercontent.com/a/AGNmyxala_hRhM4Oqt6CL7Izuue2sj9wAu6h7OD-a8s0=mo,Fraud app. Never use this cheater app Always showing credit card payment status pending ( why they mention instant),1,0,22.59.0,2023-04-23 11:29:02,,
7eb3f6fe-892f-4c86-b84d-85657cef14c3,Subhadip Das,https://play-lh.googleusercontent.com/a-/ACB-R5QzdcclToUt1R4AUbKZBDm7G6FgpPhaT-Ry0MzRLw,Don't use this app very worst...if you failed to pay zip money 1 day they charged high penalty.... don't use this,1,0,22.58.0,2023-04-23 11:26:07,,
8e19c976-dd8f-42a6-9749-4b88c05a21f1,Hindustan Studio,https://play-lh.googleusercontent.com/a-/ACB-R5TjuBjOjTraQZXVB8zZVRel_VkMK727G7l2LBeA,Worst app,1,0,,2023-04-23 11:17:24,"Hi, we would like to know what went wrong. Please let us know our areas of improvement via feedback@mobikwik.com to. It will help us improve our services. Thanks!",2023-04-24 16:39:15
be2b8d05-a401-4c1e-83ae-f8df60a20cc4,akshay dabhade,https://play-lh.googleusercontent.com/a-/ACB-R5SQvyobfbX-admLx0-Vc6pUT1eenSM-ZZNqhmwwmg,Very bad aap ..speen weel jitni baaar ghumao niklega vaucher very fake aap 10 bar gumaya phir bhi mila kya vaucher bus dikhava hai not installed this aap 27/03/2023 aaj bhi speen Kiya to Mila kya vaucher 😠😠😠 very very very very very very very fake this mobhi kivi aap speen well dely gumata hu Milta hai only vaucher tumhare pass hi rakho wauche ....fake aap totaly ........ Aj date 23/04/2023 ko fhir speen ghumaya mila only beto vaucher ye pura fraod aaplicatin hai ok eske upr tranjaction nahi,1,0,22.58.0,2023-04-23 11:11:41,"We are concerned about reading the review, Akshay. Please connect with us on feedback@mobikwik.com so that we can assist you further.",2023-04-10 12:34:04
