reviewId,userName,userImage,content,score,thumbsUpCount,reviewCreatedVersion,at,replyContent,repliedAt
b539c3a1-a481-42df-a83e-0199bfcaa13c,Bgmi Ka18,https://play-lh.googleusercontent.com/a-/ACB-R5S7whI1r0imgwKUWsSa-yJXWmcqx5_pitJoiKrT,"Don't even think to invest, 12%pa per year. I can keep my money in my bank, they pay me 5 to 6% every month,",1,0,22.58.0,2023-04-16 21:49:43,"Hi User, we are here to make things right for you. Request you to get in touch with us via xtra@mobikwik.com so that we can learn about your concern and assist you better with the same. Team Mobikwik.",2023-04-17 11:32:02
7776ab70-a14b-4bba-9b3a-5bf924036ef5,Rajesh suthar,https://play-lh.googleusercontent.com/a-/ACB-R5Tdfr551kQlU6ZrVMURxZmKRkhbFh0QaJhkPklcYw,Worst app,1,0,22.58.0,2023-04-16 21:18:08,"Hi Rajesh, we are here to make things right for you. Kindly elaborate on the issue so that we can look into the matter and resolve it for you. Please write to us at feedback@mobikwik.com. Team Mobikwik.",2023-04-17 11:25:25
9f4463dc-12c0-410a-a6e5-ae6b4d13f576,Ghanshyam jangid,https://play-lh.googleusercontent.com/a/AGNmyxa0Z_my1eoxKI97lo36QtOt2_i0lIOQOA8uzIRz=mo,धोका देने वाला अप है । पर डे एसएमएस आता हे अप डावनोलोड करो जैसे ही एक्टिव करते है 220 एक्टिव चार्ज लगा लते है बाद मे जमा के लिए क्रेडिट कार्ड से पे मांगता है अगर किसकी के पास क्रेडिट कार्ड नहीं हो क्या करगा उसका पैनिल्टी चार्ज 220 का 4500 कर लेता है कोन पे करगा ऐसे सिबिल डाउन हो जाती हैं में कोर्ट में केस करुगा अगर हे जुटी पैनल नही हटाया तो चोर अप रोज पैनल लगा अब कल कोर्ट मे केस करता हूं बोत बार रिक्वेस्ट कर ली,1,0,22.53.3,2023-04-16 21:09:40,"Hi Ghanshyam, this is certainly not the experience we want our customers to have with us, we would definitely like to address the issue further. We request you kindly connect with us on feedback@mobikwik.com with your registered wallet details so we can assist you further with your concern. Team MobiKwik.",2023-04-17 11:21:15
f354bf42-acef-487b-b013-f00a5d5dd02b,Vinaykumar Vishwas,https://play-lh.googleusercontent.com/a-/ACB-R5RKTm9tZgAOVfeyf30yJigam5ldI3LnrT59GIQqyg,Bad hai ya,1,0,22.58.0,2023-04-16 21:03:35,"Hi Vinaykumar, we are here to make things right for you. Kindly elaborate on the issue so that we can look into the matter and resolve it for you. Please write to us at feedback@mobikwik.com. Team Mobikwik.",2023-04-17 11:24:05
b3917a44-789c-44a8-9969-658ccec20649,Amit Yadav,https://play-lh.googleusercontent.com/a/AGNmyxbJybjayhF-sviUjnkRar4rxm3vzXaE1ZFGnGG88w=mo,Very bad aap and bad management,1,0,22.58.0,2023-04-16 21:02:18,"Hi Amit, we are here to make things right for you. If you have encountered any problems, can you please send your feedback to feedback@mobikwik.com. We'll get back to you promptly. Team MobiKwik",2023-04-17 11:23:14
5f30fa32-4876-4323-99e1-9934ca193b88,Kannan Bharathy,https://play-lh.googleusercontent.com/a-/ACB-R5Sfe8d5bqFS9N3mE5wrbtqRIe5nOYH2rAyBLdyAOQ,Just sending false messages you are eligible. Please dont do it,1,0,,2023-04-16 20:09:07,"Hi Kannan, we certainly did not want you to have such an experience. Kindly share your wallet details with us via feedback@mobikwik.com It will help us to assist better. Team Mobikwik.",2023-04-17 11:03:57
58c89f6d-a234-4ef2-8ec3-f564b9f0ec3b,suheal pasha,https://play-lh.googleusercontent.com/a/AGNmyxYPl5Tv9355dUp-HL7FwSP8Ke_kIZlf6-KaVMsT=mo,This is worst service ever from mobikwik they promise to waiver late payment charge my salarie was dealy and thay started harassment me and my family & stole my contact and calling & msging them and harassed after I received my salary i payed the amount 05/april till date payment not clear really this is torture they send official mail also now iam calling them not response,1,0,22.57.0,2023-04-16 19:56:56,"Hello suheal, we would like to take a closer look at the issue and assist you better. Kindly contact with us via feedback@mobikwik.com so that our team can reach out and discuss this with you. Team Mobikwik.",2023-04-17 10:53:22
07f41295-c632-40f4-be8a-898ba2e83d5c,Karthick A Rao,https://play-lh.googleusercontent.com/a-/ACB-R5QXIKYbioDNYHBIUarheBCF1bzfkZA7c5Vzwz2i9A,"Using this app is like a maze, need to close multiple popup windows/ads in different places and then finally can arrive actually page looking for. This is worst then the newspaper ads. Freecharge is far better in this regards, atleast they don't torture the users like this.",1,0,22.58.0,2023-04-16 19:31:55,"Hi Karthick, we realize your experience hasn't been at par with your expectations. Connect with us via feedback@mobikwik.com. along with your complete concern so we can assist you. Team Mobikwik.",2023-04-17 10:49:27
9da3b954-c7fc-4911-bea2-6871106b3e06,Nalinikanta Patra,https://play-lh.googleusercontent.com/a-/ACB-R5RC3LaqCUeo2kW694ndxlT2FkTIdkl5BmW9axIFjoI,Absolutely waste matlab bilkul bakwas. Mobile recharge karlo phir 3 days baad hi repayment karna hai warna 600 keliye 4000 se bhi jyada hojata hai yeh. 😔😔😔😔😔😔😔😔😔😔😔😔😔😔😔😔😔😔😔😔😔,1,0,22.58.0,2023-04-16 19:19:50,"We are concerned about reading the review, Nalinikanta. Please connect with us on feedback@mobikwik.com so that we can assist you further. Team Mobikwik.",2023-04-17 10:41:53
8cf33009-a326-44b1-b723-c8e861313f3f,Aman Choudhary,https://play-lh.googleusercontent.com/a-/ACB-R5TU0mzF6l9ZQLh-bJI6uXSqEkbpAIR_2uxA-4Vrdw,Xtra department is totally Fraud they don't pay my money of 5000 rupees and also not replying to my messages please don't install this app either you can losse your money many better applications are available for that,1,0,22.58.0,2023-04-16 19:15:26,"Hi Aman, we are here to make things right for you. Request you to get in touch with us via xtra@mobikwik.com so that we can learn about your concern and assist you better with the same. Team Mobikwik.",2023-04-17 10:45:27
3a19c8c6-fb2f-45b2-a437-11d1d235a0b4,anusha varghese,https://play-lh.googleusercontent.com/a/AGNmyxZ2RVWjY9Spk9tiIHWk7YuFRhnbqlDNUg79H7dP=mo,Im not able to withdraw amount it says it cannot be supported in this device. Have been using it now since a few months but this happens the first time .have been raising the query since a week and there isn't a response from anyone,1,0,22.58.0,2023-04-16 18:34:45,"Hi Muskaan, we are here to make things right for you. Kindly share your wallet details on feedback@mobikwik.com so that we can assist you better. Team Mobikwik.",2023-04-17 10:27:58
a97bea9b-50ca-4b27-8bb8-c0dae1fceca1,Nakul Dhoke,https://play-lh.googleusercontent.com/a/AGNmyxbfOdT6V627JiFKk8qTNRStWyZVxWUYJSH0Wc3F=mo,Fraud app it's big scam,1,0,,2023-04-16 17:53:03,"Hey Nakul , we're sorry to learn this. Request you connect with us via feedback@mobikwik.com to help us serve you better.
",2023-04-16 18:08:05
0840a484-441f-486d-94fe-8865ab39ccc6,Prasad Purohit,https://play-lh.googleusercontent.com/a-/ACB-R5R16hlhherdskWhGIswUuhnAc-3mRaP3ANxEWKK5Q,Why I can't login?? User disable showing,1,0,22.58.0,2023-04-16 17:46:37,"Hey Purohit, we're sorry to learn this. Request you connect with us via feedback@mobikwik.com to help us serve you better.
",2023-04-16 18:07:39
79c666da-d8e2-48a0-bbe0-09d66033c8ff,g subramanyam,https://play-lh.googleusercontent.com/a/AGNmyxY0VLiyMmgSANVp3-5gb1roYJaHbMKy3pf6Gf_c=mo,Froud app i never seen this type of app i make the payment ontime when i paid bill amount it was showing successful a later 3-4 hrs it is showing unsuccessful again they charged 50% of penalty on our bill amount we don't proper communication channels for This worst app plz don't use this app.,1,0,22.58.0,2023-04-16 17:34:32,"Hi subramanyam, this is not the kind of experience we desired for you. We request you to get in touch with us via feedback@mobikwik.com so that we can learn about your concerns and assist you better with the same.
",2023-04-16 18:08:38
c1e065ef-7d79-4ae2-a63d-44fd4ea9655b,Shubhasis Chandra Das,https://play-lh.googleusercontent.com/a-/ACB-R5QklqwKudjpoJYFXI3zHPYepdTYKbPSSZNwgBxZQg,This stupid collection agency people didn't send my data that I already paid my amount in full... Now they call me everytime and penalty charges has been increasing since then. I want a fix to this.,1,0,22.39.5,2023-04-16 17:26:42,We certainly did not want you to have such an experience. Kindly share your contact details with us via feedback@mobikwik.com so that our team can reach out and discuss this with you.,2023-04-16 18:10:14
4677172b-9abb-4336-9eee-614d7af2d511,Pritam Kumar,https://play-lh.googleusercontent.com/a-/ACB-R5TV1mPFTYDjCSVLDgMzwDOw6PcbdI4WBA3mYrJjqA,Dhatiya,1,0,22.51.1,2023-04-16 17:21:55,"Hi Pritam , this is not the kind of experience we desired for you. We request you to get in touch with us via feedback@mobikwik.com so that we can learn about your concerns and assist you better with the same.
",2023-04-16 18:09:41
e0870908-9c48-4c8b-a836-50ba80f40213,Navin Prasad,https://play-lh.googleusercontent.com/a/AGNmyxagsSNJeCc0BJq56YwPJQdjru_EH5OuxPm-tGRP=mo,This app are very froud app i request not use app,1,0,,2023-04-16 17:16:31,"Hi Navin , we regret the inconvenience caused. Kindly elaborate on the issue so that we can look into the matter and resolve it for you. Please write to us at feedback@mobikwik.com.Team Mobikwik.",2023-03-02 15:09:40
b0057853-afba-4092-846c-adac67bfdaee,TANMOY DEY SARKAR,https://play-lh.googleusercontent.com/a-/ACB-R5RhnDtzJn-ttmpuCOuNHDw-WizBz9YMbn95spcnZA,The credit card that was Movie Quick has been closed even after getting married like Time. Tell me why it was done. Even after paying 06 january 2022 petkatta is blocked why tell me a little,1,0,22.58.0,2023-04-16 16:22:04,"Hey TANMOY , we're sorry to learn this. Request you connect with us via feedback@mobikwik.com to help us serve you better.
",2023-04-16 18:11:16
ccb66e9a-08f2-4c37-8892-59701e3f7871,hema surya prasada rao,https://play-lh.googleusercontent.com/a/AGNmyxbwrynllckgB4TDHPp7r9LtCyA2TBcXbJkMc_5Bvk8=mo,Very dissatisfied.No customer care.No response for query.I did wrong payment of 1099 for prepaid bill but that amount has not come to me until now.It's been almost 1 year.worst service,1,0,22.58.0,2023-04-16 16:20:32,We certainly did not want you to have such an experience. Kindly share your contact details with us via feedback@mobikwik.com so that our team can reach out and discuss this with you.,2023-04-16 18:10:47
e5bf0c5f-bd3f-4336-8a91-8f8fe6d50e3b,Mahesh Mahi,https://play-lh.googleusercontent.com/a/AGNmyxYYcl-14o4IL3y2OFuCyfNrN8nDu32es-TVKaDY=mo,Worst appp,1,0,22.48.6,2023-04-16 16:11:41,"Hey Mahesh , we're sorry to learn this. Request you connect with us via feedback@mobikwik.com to help us serve you better.
",2023-04-16 18:12:41
47d13a80-82bd-4d9d-b9c7-8162b255ae06,Pritam Das,https://play-lh.googleusercontent.com/a-/ACB-R5Si8J5iL93yKYHdAwLTWSJaRlWHKNwfWnx6RaUggw,"One of the world's number one corrupt Application , don't open an account here, they will trap you and take everything you have.",1,0,22.58.0,2023-04-16 16:00:22,"Hi Pritam , this is not the kind of experience we desired for you. We request you to get in touch with us via feedback@mobikwik.com so that we can learn about your concerns and assist you better with the same.
",2023-04-16 18:12:21
0da09880-536c-4526-8019-77ba62d1e5c8,Bahar Laskar,https://play-lh.googleusercontent.com/a-/ACB-R5TxJFIvIzFfB81PDacuM_qsh0pzPFi-RX7XQcD_4w,"Worst App, I paid my Electricity Bill of 2500, Payment was failed but my money was deducted. I got no response from customer service. Also they will give you pay later for 6 days which is useless. After that they will charge you the same amount as late fees every week.My bill of 300 turned into 1200 in 20 days",1,0,22.52.3,2023-04-16 15:15:43,"We certainly did not want you to have such an experience. Kindly share your contact details with us via feedback@mobikwik.com so that our team can reach out and discuss this with you.
",2023-04-16 18:13:26
172501e2-586b-489e-8786-bf5848c2cbcb,Suraj Singh Chandravanshi,https://play-lh.googleusercontent.com/a-/ACB-R5RDvBgnhu_9YUrFu1vqNIB7pzA4A-_sl8dtDQIQAg,Fraud app. Why i'll pay your zip activation charge. 1500 ka zip diya jisme 199 activation charge krke khud hi rakh liye or ab us pr bhi intrest Waah & hum uska bhi bhugtan kre. Why? 1500 Total do n. And us paisa ko transfer kr rha kisi or bank me to wo bhi fail ho ja rha.,1,0,22.58.0,2023-04-16 15:05:53,"Hi Suraj , this is not the kind of experience we desired for you. We request you to get in touch with us via feedback@mobikwik.com so that we can learn about your concerns and assist you better with the same.
",2023-04-16 18:15:55
02c3e05e-f37a-485b-ba21-8c1bdd1736f5,Firoz Khan,https://play-lh.googleusercontent.com/a-/ACB-R5S3IMTxKZcF-cGzWrF6iyBXKwh6LB9mKv_yasGDeA,kya farzi app hai 7 din se roj try kar rha hun kyc ke liye adhar no daalte hi processing pe lag jata hai uske baat koi response nahi,1,0,22.58.0,2023-04-16 14:55:05,"Hi Firoz , this is not the kind of experience we desired for you. We request you to get in touch with us via feedback@mobikwik.com so that we can learn about your concerns and assist you better with the same.
",2023-04-16 18:16:17
72ab818d-adcd-401a-9131-07f5ecbc3924,Deepak Somani,https://play-lh.googleusercontent.com/a-/ACB-R5RXhG1ieI_vxP6FBCEjmooFz3xFWbzqwJagInYQ,Farzi app no customer support,1,0,22.58.0,2023-04-16 14:19:12,"Hey Deepak , we're sorry to learn this. Request you connect with us via feedback@mobikwik.com to help us serve you better.",2023-04-16 18:16:46
684bf13a-163b-4bc7-b528-26a2e7ab6163,Dhyan Prasad,https://play-lh.googleusercontent.com/a/AGNmyxYAzAbrPP2YO7KacC_YxtvdtI7isoDiFg0Gtqnf=mo,Poora Lon close ho gaya fir bhi app me purana lon so kar rha hai fake aap hi,1,0,22.58.0,2023-04-16 14:05:50,"Hey Dhyan, we're sorry to learn this. Request you connect with us via feedback@mobikwik.com to help us serve you better.
",2023-04-16 18:22:27
7a857af4-fd70-41db-90f2-30a25ff374b7,Prayog Chettri,https://play-lh.googleusercontent.com/a-/ACB-R5QwEyeyFLjswv1JgpYPWiX_M3WPeKdJSn43gikx,"Worst I was paying fine at first like 900 dept paid 1200 but next time I used 240 and it crossed almost 5000 in 2,3 months who can pay like that write this report 🤬🤬🤬",1,0,,2023-04-16 13:47:10,"Hey Prayog, we're sorry to learn this. Request you connect with us via feedback@mobikwik.com to help us serve you better.
",2023-04-16 18:21:42
ef56f52d-da67-4b3c-8658-755b7f00cbf8,Katla Ramesh,https://play-lh.googleusercontent.com/a/AGNmyxYKDGHl4soynTsu9jZAveRM0hQBQAqv75SYd58w=mo,Customer support not provided for doubt solving.,1,0,22.58.0,2023-04-16 13:44:12,"Hey Katla, we're sorry to learn this. Request you connect with us via feedback@mobikwik.com to help us serve you better.
",2023-04-16 18:21:29
b26de3c4-53aa-4a8f-befc-ffa8babf48d5,Mehul Bhabhor,https://play-lh.googleusercontent.com/a-/ACB-R5RleT3itGOpIjtA_q8kc-_RooWr2cv8cg9flHXzGg,Inke call center walo ko koi sanskar NAHI he Bhai wery Chip proson to call you and inberesing words,1,0,22.57.0,2023-04-16 13:32:29,"Hi Mehul, this is not the kind of experience we desired for you. We request you to get in touch with us via feedback@mobikwik.com so that we can learn about your concerns and assist you better with the same.
",2023-04-16 18:15:31
1ce9b3db-4ed9-4f91-969f-6473a52b773e,Suchitra Chadha,https://play-lh.googleusercontent.com/a/AGNmyxYoooPqyKRmcJR8HzOL0couR2rCRs1gbwhql7Jn=mo,Bakwaeh,1,0,22.58.0,2023-04-16 13:23:33,"Hi Suchitra, this is not the kind of experience we desired for you. We request you to get in touch with us via feedback@mobikwik.com so that we can learn about your concerns and assist you better with the same.
",2023-04-16 18:15:05
5034ba37-974e-4ee5-b30a-adaca395ac05,PARAMVEER SINGH BHATI,https://play-lh.googleusercontent.com/a-/ACB-R5SV4PtiZg68b1d434f5a9IRb6XtIVlJgJ5NcoxF4g,Fraud application it used my ZIP account without my permission and I have uninstalled this application after uninstalling it used my money of 571 rupees although I haven't grant permission. It leakes out information and our money is not safe.,1,0,22.58.0,2023-04-16 13:13:47,"Hi PARAMVEER, this is not the kind of experience we desired for you. We request you to get in touch with us via feedback@mobikwik.com so that we can learn about your concerns and assist you better with the same.
",2023-04-16 18:15:16
e2ccad60-2fa7-4b22-b656-66aa8914950b,123cs yuvraj kumar verma,https://play-lh.googleusercontent.com/a-/ACB-R5RBJVwyUIUyIbtFACO9NMGfdxvJpZTvdeA9otSz2w,Bad experiance,1,0,22.58.0,2023-04-16 13:11:07,"Hi, this is not the kind of experience we desired for you. We request you to get in touch with us via feedback@mobikwik.com so that we can learn about your concerns and assist you better with the same.
",2023-04-16 18:14:17
49b0a81f-0c7b-4d5b-aa48-30c802728835,Sreeramulu Macherla,https://play-lh.googleusercontent.com/a/AGNmyxY-cEAp3nNsubCL8MA6fxg-EN4wlKziNPui0_ni=mo,Worst app and fraudulent,1,0,,2023-04-16 12:58:55,"Hi Sreeramulu, this is not the kind of experience we desired for you. We request you to get in touch with us via feedback@mobikwik.com so that we can learn about your concerns and assist you better with the same.
",2023-04-16 18:14:30
642c8ab4-cccb-4a29-ac0a-caaad8ed09e0,Yash Bhaskar,https://play-lh.googleusercontent.com/a-/ACB-R5SVConlaGmiwoyZbxuVWzhullPs98jsQbTpQtOVlQ,मतरचोद आहेत हे ऑनलाईन वाले उगाच ऍड करतात आणि नादी लावुन लुबाडतात आपल्याला आपल्या मेहनतीने कमवायची सवय लागलेली असली तरी हे लाचारी करायला शिकवत आहेत म्हणून ह्यांचा नादी लागू नये ही नम्र विनंती!,1,0,,2023-04-16 12:48:23,"Hi Yash, this is not the kind of experience we desired for you. We request you to get in touch with us via feedback@mobikwik.com so that we can learn about your concerns and assist you better with the same.
",2023-04-16 18:14:06
cefba380-9ce1-479a-8332-e8ac84b20ccf,Viralkumar Mevada,https://play-lh.googleusercontent.com/a/AGNmyxYB5nti1rRNLiT0EqAUmytqSQzW8VjUFuOkqgik=mo,Never received any loans even after my cibil is very good useless app,1,0,22.58.0,2023-04-16 12:46:57,"Hi Viralkumar, this is not the kind of experience we desired for you. We request you to get in touch with us via feedback@mobikwik.com so that we can learn about your concerns and assist you better with the same.
",2023-04-16 18:13:46
03a32e35-d6a1-454b-8f1f-30ff55881e19,prashant patle,https://play-lh.googleusercontent.com/a/AGNmyxas2IdifRzY33BVa6Rgvmcz-8rn41OFbn7poFJt=mo,"Only one time given 50,000 credit after paying my all dues before time they didn't give me credit instead of increasing credit limit that's why only 1 star otherwise app is awesome",1,0,22.58.0,2023-04-16 12:41:22,"Hi Prashant, this is not the kind of experience we desired for you. We request you to get in touch with us via feedback@mobikwik.com so that we can learn about your concerns and assist you better with the same.
",2023-04-16 18:12:46
48a7f9ae-0304-4751-bfd6-2eb476229940,Nirmalendu Kajli,https://play-lh.googleusercontent.com/a-/ACB-R5RaHNoDoej8wV67bCEenST8flby8vzFB9GbX_zc_A,"worst app ever Request to Play Store , Please remove this app",1,0,,2023-04-16 12:33:25,"Hi Nirmalendu, this is not the kind of experience we desired for you. We request you to get in touch with us via feedback@mobikwik.com so that we can learn about your concerns and assist you better with the same.
",2023-04-16 18:12:58
ef4a39d1-da17-4cdc-baae-25177a69b657,Rajpal Singh Rawat,https://play-lh.googleusercontent.com/a-/ACB-R5S77ejAE1mVcL6uvGLklsR6pbCN5jlF1TIe-KVn8Q,"Was using since 2 years, recently turns out to be app that thugs you by giving fake loan offers. Not going to use it from now on.",1,0,22.58.0,2023-04-16 12:29:45,"Hi Rajpal, this is not the kind of experience we desired for you. We request you to get in touch with us via feedback@mobikwik.com so that we can learn about your concerns and assist you better with the same.
",2023-04-16 18:13:28
7486e92f-430a-41f9-9c3f-2ea39cf185e9,Amit Aishwarya Singh,https://play-lh.googleusercontent.com/a/AGNmyxZF48Npk5uUhpbax-uG3W1xhA-fykVHcQy53FOR=mo,I made a transaction of 205 on zomato and my balance should be 795. But 200 extra has been deducted I don't know for what. And now my balance says 595. And there customer service is pathetic.,1,0,22.58.0,2023-04-16 12:26:46,"Hi Amit, this is not the kind of experience we desired for you. We request you to get in touch with us via feedback@mobikwik.com so that we can learn about your concerns and assist you better with the same.
",2023-04-16 18:12:30
60a3bdd4-f87c-42d3-8cd0-047b1d16ff58,ROHAN SHEKU,https://play-lh.googleusercontent.com/a/AGNmyxYGo287aNX18nQB_cqZTl0SDttaDBD4u1sYbt8L=mo,Fake promotion Fake offers Gateway is way too slow And no genuine offers. Edit: Now They have started Stealing money. I bought a voucher and the voucher didn't work and i complained regarding the same and to my surprise their customer service is the worst. There are literally illiterate people sitting which just copy paste the answers without even reading the query raised. Edit: No improvement. Day by day it's going down on its services.Still providing fake offers with no benefits to customers.,1,0,22.58.0,2023-04-16 12:26:09,Hi Rohan! Apologies for the inconvenience caused. That's not the experience we want you to have. Please write your concern at feedback@mobikwik.com. We'll get back to you promptly. Team MobiKwik,2023-03-01 12:25:14
e897324e-20d9-4604-b9e6-26c7fb36205f,Babloo Kumar,https://play-lh.googleusercontent.com/a-/ACB-R5T9FnJt5Wgkn0EbvNowOfUrA7sEPyRWn4qRIKPV,Bhaiyon and bahanon se Anurodh Hai Ki MobiKwik apps se Bachke Rahe Savdhan 👎👎👎👎👎,1,0,22.58.0,2023-04-16 12:03:48,,
158a6332-f12b-4053-91c0-c195634c832d,Rakesh Verma,https://play-lh.googleusercontent.com/a-/ACB-R5ThIVW_xMzCkYQ6kQv1FbrzhsxLy-YtI3jdEVNk,Bakwash app hai,1,0,,2023-04-16 11:59:42,"Hi Rakesh, we are here to make things right for you. If you have encountered any problems, can you please send your feedback to feedback@mobikwik.com. We'll get back to you promptly. Team MobiKwik",2023-04-16 17:52:18
8ee4552d-b605-466a-8bf4-943c30c914f9,Rupesh Shinde,https://play-lh.googleusercontent.com/a-/ACB-R5Ts6ckcR3jrBkWKnDsZU2HS-C60Nzj8zajYWeTPHow,I got two registration no with same application But I can not change any this Or can not deactivate any one number. That's why I give 1 star,1,0,,2023-04-16 11:45:09,"Hi Rupesh, we are here for you. Request you to kindly connect with us via feedback@mobikwik.com along with complete concern it will help us to assist better. Team Mobikwik.",2023-04-16 17:45:06
46a0a19f-2e1d-4dcf-bcdb-c8bf9236032a,rakesh agarwal,https://play-lh.googleusercontent.com/a-/ACB-R5R9IZlSguUvBdkEr7s4D3ZtsFKNhVMC4oL9l9b6,Los my amount 1698 here,1,0,22.5.2,2023-04-16 11:36:33,"Hi Rakesh, we are here to make things right for you. Kindly elaborate on the issue so that we can look into the matter and resolve it for you. Please write to us at feedback@mobikwik.com. Team Mobikwik.",2023-04-16 17:38:06
ab1f10bb-63c9-4cd1-b6a0-7a80e9e993e6,jitendra dutta,https://play-lh.googleusercontent.com/a-/ACB-R5R4HvNRsGLkJf4wTt9yLp4J_GgSJV2IT-CWV02z,After mobile phone change... error msg.. this action is not perform of this device,1,0,,2023-04-16 11:30:06,"Hi Jitendra, we are here for you. Request you to kindly connect with us via feedback@mobikwik.com It will help us to assist better. Team Mobikwik.",2023-04-16 17:40:59
1c42af3d-930e-43e9-8b17-1d05ca8a23fa,Vijay Kumar Meena,https://play-lh.googleusercontent.com/a-/ACB-R5QqeHjZOVXTy1pwXhPetYq2Sg2_ieMrtANIy6Yuiw,Poar,1,0,,2023-04-16 11:25:43,,
2a579df9-c308-4da8-a5f0-4aae5345362d,Arvind Gungaliya Jain,https://play-lh.googleusercontent.com/a-/ACB-R5QxsAmgHvIxrQzbOQKRB86B6cqm569vESkQ7vXaDw,Mobikwik is data fraudulent app and never give permission for contact and sms permission they misuse,1,0,21.11.1,2023-04-16 11:06:38,"Hi Arvind, we are here to make things right for you. Kindly elaborate on the issue so that we can look into the matter and resolve it for you. Please write to us at feedback@mobikwik.com. Team Mobikwik.",2023-04-16 17:32:21
5baeaeb4-ba3e-464f-be51-dc726c039fc5,Sone Lal,https://play-lh.googleusercontent.com/a/AGNmyxYwJjLLf6XvoUbTaNWeR1pb4TQPOARm7CZLECFY=mo,Sabhi bhaiyon se nivedan hai is app Ko download mat Karna galti se bhi chor Baja rahi hai Maine galti se 2021 mein download kar liya tha ABB company wale Bata rahe hain ya service chal rahi hai vah service chal rahi hai uski planti hi 4298.77 chor bajar,1,0,22.58.0,2023-04-16 10:46:53,"Hi Sone, we are here to make things right for you. Kindly elaborate on the issue so that we can look into the matter and resolve it for you. Please write to us at feedback@mobikwik.com. Team Mobikwik.",2023-04-16 17:29:21
65074d62-8cd4-4d11-b1fc-9a73ced96e2f,theqnic music world,https://play-lh.googleusercontent.com/a-/ACB-R5RN9hr_np3m406zsGsDwYjrIrJA87fbxI84QRFs,Ghatiya application,1,0,,2023-04-16 10:40:40,"Hi User, we are here to make things right for you. Kindly elaborate on the issue so that we can look into the matter and resolve it for you. Please write to us at feedback@mobikwik.com. Team Mobikwik.",2023-04-16 17:20:29
